Scholar ID,Paper Number,Paper Title,Authors,"Publication (journal name. volume, no. pages)",Year,Cited_by,Link
0fNwcSsAAAAJ,1,Deep and hand-crafted features based on Weierstrass elliptic function for MRI brain tumor classification,"I Aldawish, HA Jalab","Journal of Intelligent Systems 33 (1), 20240106",2024,https://scholar.google.com/scholar?oi=bibs&hl=en&cites=NA,""
0fNwcSsAAAAJ,2,On Hermite–Hadamard-Type Inequalities for Functions Satisfying Second-Order Differential Inequalities,"I Aldawish, M Jleli, B Samet","Axioms 12 (5), 443",2023,https://scholar.google.com/scholar?oi=bibs&hl=en&cites=12583380951135955914,https://scholar.google.com/citations?view_op=view_citation&hl=en&user=0fNwcSsAAAAJ&pagesize=100&sortby=pubdate&citation_for_view=0fNwcSsAAAAJ:hMod-77fHWUC
0fNwcSsAAAAJ,3,Nonexistence criteria for a generalized Boussinesq-type equation in bounded and unbounded domains,"I Aldawish, I Alazman, M Jleli, B Samet","Discrete and Continuous Dynamical Systems-S 16 (8), 2017-2029",2023,https://scholar.google.com/scholar?oi=bibs&hl=en&cites=5041445865946583239,https://scholar.google.com/citations?view_op=view_citation&hl=en&user=0fNwcSsAAAAJ&pagesize=100&sortby=pubdate&citation_for_view=0fNwcSsAAAAJ:k_IJM867U9cC
0fNwcSsAAAAJ,4,Bell Distribution Series Defined on Subclasses of Bi-Univalent Functions That Are Subordinate to Horadam Polynomials,"I Aldawish, B Frasin, A Amourah","Axioms 12 (4), 362",2023,https://scholar.google.com/scholar?oi=bibs&hl=en&cites=4746721727391109710,https://scholar.google.com/citations?view_op=view_citation&hl=en&user=0fNwcSsAAAAJ&pagesize=100&sortby=pubdate&citation_for_view=0fNwcSsAAAAJ:blknAaTinKkC
0fNwcSsAAAAJ,5,Formula for meromorphic symmetric differences operator with application in the theory of subordination inequality,I Aldawish,Heliyon 9 (2),2023,https://scholar.google.com/scholar?oi=bibs&hl=en&cites=16385435600920442073,https://scholar.google.com/citations?view_op=view_citation&hl=en&user=0fNwcSsAAAAJ&pagesize=100&sortby=pubdate&citation_for_view=0fNwcSsAAAAJ:GnPB-g6toBAC
0fNwcSsAAAAJ,6,Studies on a new K-symbol analytic functions generated by a modified K-symbol Riemann-Liouville fractional calculus,"I Aldawish, RW Ibrahim","MethodsX 11, 102398",2023,https://scholar.google.com/scholar?oi=bibs&hl=en&cites=6787549438488166035,https://scholar.google.com/citations?view_op=view_citation&hl=en&user=0fNwcSsAAAAJ&pagesize=100&sortby=pubdate&citation_for_view=0fNwcSsAAAAJ:J_g5lzvAfSwC
0fNwcSsAAAAJ,7,On the critical behavior for time-fractional reaction diffusion problems,"I Aldawish, B Samet","Discrete and Continuous Dynamical Systems-S 16 (8), 2030-2046",2023,https://scholar.google.com/scholar?oi=bibs&hl=en&cites=8699685073051618077,https://scholar.google.com/citations?view_op=view_citation&hl=en&user=0fNwcSsAAAAJ&pagesize=100&sortby=pubdate&citation_for_view=0fNwcSsAAAAJ:M3NEmzRMIkIC
0fNwcSsAAAAJ,8,Applications of Shell-like Curves Connected with Fibonacci Numbers,"A Amourah, I Aldawish, BA Frasin, T Al-Hawary","Axioms 12 (7), 639",2023,https://scholar.google.com/scholar?oi=bibs&hl=en&cites=15461470755271399685,https://scholar.google.com/citations?view_op=view_citation&hl=en&user=0fNwcSsAAAAJ&pagesize=100&sortby=pubdate&citation_for_view=0fNwcSsAAAAJ:O3NaXMp0MMsC
0fNwcSsAAAAJ,9,Investigation of the Second-Order Hankel Determinant for Sakaguchi-Type Functions Involving the Symmetric Cardioid-Shaped Domain,"K Ullah, M Arif, IM Aldawish, SM El-Deeb","Fractal and Fractional 7 (5), 376",2023,https://scholar.google.com/scholar?oi=bibs&hl=en&cites=15262095519661596437,https://scholar.google.com/citations?view_op=view_citation&hl=en&user=0fNwcSsAAAAJ&pagesize=100&sortby=pubdate&citation_for_view=0fNwcSsAAAAJ:YFjsv_pBGBYC
0fNwcSsAAAAJ,10,Binomial Series-Confluent Hypergeometric Distribution and Its Applications on Subclasses of Multivalent Functions,"I Aldawish, SM El-Deeb, G Murugusundaramoorthy","Symmetry 15 (12), 2186",2023,https://scholar.google.com/scholar?oi=bibs&hl=en&cites=NA,""
0fNwcSsAAAAJ,11,On a New Ma-Minda Class of Analytic Functions Created by a Roulette Curve Formula,"I Aldawish, RW Ibrahim","Symmetry 15 (10), 1913",2023,https://scholar.google.com/scholar?oi=bibs&hl=en&cites=NA,""
0fNwcSsAAAAJ,12,Boundedness in the Bloch Space of Symmetric Domain for a Class of Multi-Valent Meromorphic Functions Given by a Fractional Integral,"I Aldawish, RW Ibrahim","Symmetry 15 (9), 1761",2023,https://scholar.google.com/scholar?oi=bibs&hl=en&cites=NA,""
0fNwcSsAAAAJ,13,Complex-Variable Dynamic System of Layla and Majnun Model with Analytic Solutions,"I Aldawish, RW Ibrahim","Symmetry 15 (8), 1557",2023,https://scholar.google.com/scholar?oi=bibs&hl=en&cites=NA,""
0fNwcSsAAAAJ,14,A (3+ 1)-dimensional equation of plasma drift waves perturbed by a singular potential in an infinite parallelepiped,"I Aldawish, I Alazman, M Jleli, B Samet","Journal of Physics A: Mathematical and Theoretical 56 (26), 265205",2023,https://scholar.google.com/scholar?oi=bibs&hl=en&cites=NA,""
0fNwcSsAAAAJ,15,A One-Dimensional Time-Fractional Damped Wave Equation with a Convection Term,"I Aldawish, M Jleli, B Samet","Symmetry 15 (5), 1071",2023,https://scholar.google.com/scholar?oi=bibs&hl=en&cites=NA,""
0fNwcSsAAAAJ,16,Hyperbolic inequalities with a Hardy potential singular on the boundary of an annulus,"I Alazman, I Aldawish, M Jleli, B Samet","AIMS Mathematics 8 (5), 11629-11650",2023,https://scholar.google.com/scholar?oi=bibs&hl=en&cites=NA,""
0fNwcSsAAAAJ,17,A higher order evolution inequality with a gradient term in the exterior of the half-ball,"I Alazman, I Aldawish, M Jleli, B Samet","AIMS Mathematics 8 (4), 9230-9246",2023,https://scholar.google.com/scholar?oi=bibs&hl=en&cites=NA,""
0fNwcSsAAAAJ,18,Third Hankel determinant for the logarithmic coefficients of starlike functions associated with sine function,"B Khan, I Aldawish, S Araci, MG Khan","Fractal and Fractional 6 (5), 261",2022,https://scholar.google.com/scholar?oi=bibs&hl=en&cites=5029377595607307984,https://scholar.google.com/citations?view_op=view_citation&hl=en&user=0fNwcSsAAAAJ&pagesize=100&sortby=pubdate&citation_for_view=0fNwcSsAAAAJ:Zph67rFs4hoC
0fNwcSsAAAAJ,19,Fekete–Szegö Functional Problem for a Special Family of m-Fold Symmetric Bi-Univalent Functions,"SR Swamy, BA Frasin, I Aldawish","Mathematics 10 (7), 1165",2022,https://scholar.google.com/scholar?oi=bibs&hl=en&cites=13245341151702650757,https://scholar.google.com/citations?view_op=view_citation&hl=en&user=0fNwcSsAAAAJ&pagesize=100&sortby=pubdate&citation_for_view=0fNwcSsAAAAJ:KlAtU1dfN6UC
0fNwcSsAAAAJ,20,A new mathematical model of multi-faced COVID-19 formulated by fractional derivative chains,"I Aldawish, RW Ibrahim","Advances in Continuous and Discrete Models 2022 (1), 6",2022,https://scholar.google.com/scholar?oi=bibs&hl=en&cites=6207857737526813424,https://scholar.google.com/citations?view_op=view_citation&hl=en&user=0fNwcSsAAAAJ&pagesize=100&sortby=pubdate&citation_for_view=0fNwcSsAAAAJ:W7OEmFMy1HYC
0fNwcSsAAAAJ,21,On subclasses of analytic functions associated with Struve functions,"BA Frasin, T Al-Hawary, F Yousef, I Aldawish","Nonlinear Functional Analysis and Applications 27 (1), 99-110",2022,https://scholar.google.com/scholar?oi=bibs&hl=en&cites=6920336549324336348,https://scholar.google.com/citations?view_op=view_citation&hl=en&user=0fNwcSsAAAAJ&pagesize=100&sortby=pubdate&citation_for_view=0fNwcSsAAAAJ:kNdYIx-mwKoC
0fNwcSsAAAAJ,22,A Special Family of m-Fold Symmetric Bi-Univalent Functions Satisfying Subordination Condition,"I Aldawish, SR Swamy, BA Frasin","Fractal and Fractional 6 (5), 271",2022,https://scholar.google.com/scholar?oi=bibs&hl=en&cites=4405206871619108610,https://scholar.google.com/citations?view_op=view_citation&hl=en&user=0fNwcSsAAAAJ&pagesize=100&sortby=pubdate&citation_for_view=0fNwcSsAAAAJ:ULOm3_A8WrAC
0fNwcSsAAAAJ,23,Estimation of the second-order Hankel determinant of logarithmic coefficients for two subclasses of starlike functions,"P Sunthrayuth, I Aldawish, M Arif, M Abbas, S El-Deeb","Symmetry 14 (10), 2039",2022,https://scholar.google.com/scholar?oi=bibs&hl=en&cites=8249262866819947635,https://scholar.google.com/citations?view_op=view_citation&hl=en&user=0fNwcSsAAAAJ&pagesize=100&sortby=pubdate&citation_for_view=0fNwcSsAAAAJ:mVmsd5A6BfQC
0fNwcSsAAAAJ,24,An application of Rabotnov functions on certain subclasses of bi-univalent functions,"A Amourah, I Aldawish, KR Alhindi, BA Frasin","Axioms 11 (12), 680",2022,https://scholar.google.com/scholar?oi=bibs&hl=en&cites=4388875993031294283,https://scholar.google.com/citations?view_op=view_citation&hl=en&user=0fNwcSsAAAAJ&pagesize=100&sortby=pubdate&citation_for_view=0fNwcSsAAAAJ:QIV2ME_5wuYC
0fNwcSsAAAAJ,25,Necessary conditions for the existence of global solutions to nonlinear fractional differential inequalities and systems,"I Aldawish, B Samet","Journal of Function Spaces 2022 (1), 4347755",2022,https://scholar.google.com/scholar?oi=bibs&hl=en&cites=12141906658859878071,https://scholar.google.com/citations?view_op=view_citation&hl=en&user=0fNwcSsAAAAJ&pagesize=100&sortby=pubdate&citation_for_view=0fNwcSsAAAAJ:UebtZRa9Y70C
0fNwcSsAAAAJ,26,Necessary and Sufficient Conditions for Normalized Wright Functions to be in Certain Classes of Analytic Functions,"T Al-Hawary, I Aldawish, BA Frasin, O Alkam, F Yousef","Mathematics 10 (24), 4693",2022,https://scholar.google.com/scholar?oi=bibs&hl=en&cites=1896069641974576259,https://scholar.google.com/citations?view_op=view_citation&hl=en&user=0fNwcSsAAAAJ&pagesize=100&sortby=pubdate&citation_for_view=0fNwcSsAAAAJ:dhFuZR0502QC
0fNwcSsAAAAJ,27,Blow-up of solutions to fractional differential inequalities involving ψ-Caputo fractional derivatives of different orders,"I Aldawish, M Jleli, B Samet","AIMS Mathematics 7 (5), 9189-9205",2022,https://scholar.google.com/scholar?oi=bibs&hl=en&cites=18351118026286519255,https://scholar.google.com/citations?view_op=view_citation&hl=en&user=0fNwcSsAAAAJ&pagesize=100&sortby=pubdate&citation_for_view=0fNwcSsAAAAJ:8k81kl-MbHgC
0fNwcSsAAAAJ,28,A Mathematical Model for COVID-19 Image Enhancement based on Mittag-Leffler-Chebyshev Shift.,"I Aldawish, HA Jalab","Computers, Materials & Continua 73 (1)",2022,https://scholar.google.com/scholar?oi=bibs&hl=en&cites=9221804156750000173,https://scholar.google.com/citations?view_op=view_citation&hl=en&user=0fNwcSsAAAAJ&pagesize=100&sortby=pubdate&citation_for_view=0fNwcSsAAAAJ:qxL8FJ1GzNcC
0fNwcSsAAAAJ,29,Neighborhood properties for certain p-valent analytic functions associated with q-p-valent Bernardi integral operator of complex order,"I Aldawish, MK AOUF, TM SEOUDY, BA FRASIN","Journal of applied mathematics & informatics 40 (3_4), 753-764",2022,https://scholar.google.com/scholar?oi=bibs&hl=en&cites=14090776244462968148,https://scholar.google.com/citations?view_op=view_citation&hl=en&user=0fNwcSsAAAAJ&pagesize=100&sortby=pubdate&citation_for_view=0fNwcSsAAAAJ:M3ejUd6NZC8C
0fNwcSsAAAAJ,30,On some inequalities involving the function and its fractional derivative.,"I Aldawish, M Jleli, B Samet",Mathematical Methods in the Applied Sciences 45 (9),2022,https://scholar.google.com/scholar?oi=bibs&hl=en&cites=NA,""
0fNwcSsAAAAJ,31,A Class of Symmetric Fractional Differential Operator Formed by Special Functions,"I Aldawish, RW Ibrahim, SJ Obaiys","Journal of Mathematics 2022 (1), 8339837",2022,https://scholar.google.com/scholar?oi=bibs&hl=en&cites=NA,""
0fNwcSsAAAAJ,32,Certain Analytic Formulas Linked to Locally Fractional Differential and Integral Operators,"I Aldawish, RW Ibrahim","Journal of Function Spaces 2022 (1), 3950149",2022,https://scholar.google.com/scholar?oi=bibs&hl=en&cites=NA,""
0fNwcSsAAAAJ,33,Application of generalized Bessel functions to classes of analytic functions,"BA Frasin, F Yousef, T Al-Hawary, I Aldawish","Afrika Matematika 32, 431-439",2021,https://scholar.google.com/scholar?oi=bibs&hl=en&cites=5554823968986160042,https://scholar.google.com/citations?view_op=view_citation&hl=en&user=0fNwcSsAAAAJ&pagesize=100&sortby=pubdate&citation_for_view=0fNwcSsAAAAJ:Y0pCki6q_DkC
0fNwcSsAAAAJ,34,A Comprehensive Family of Biunivalent Functions Defined by k‐Fibonacci Numbers,"BA Frasin, SR Swamy, I Aldawish","Journal of Function Spaces 2021 (1), 4249509",2021,https://scholar.google.com/scholar?oi=bibs&hl=en&cites=12398690638963128446,https://scholar.google.com/citations?view_op=view_citation&hl=en&user=0fNwcSsAAAAJ&pagesize=100&sortby=pubdate&citation_for_view=0fNwcSsAAAAJ:IjCSPb-OGe4C
0fNwcSsAAAAJ,35,Solvability of a New q-Differential Equation Related to q-Differential Inequality of a Special Type of Analytic Functions,"I Aldawish, RW Ibrahim","Fractal and Fractional 5 (4), 228",2021,https://scholar.google.com/scholar?oi=bibs&hl=en&cites=8361696736381919870,https://scholar.google.com/citations?view_op=view_citation&hl=en&user=0fNwcSsAAAAJ&pagesize=100&sortby=pubdate&citation_for_view=0fNwcSsAAAAJ:WF5omc3nYNoC
0fNwcSsAAAAJ,36,New subclass of analytic functions defined by q-analogue of p-valent Noor integral operator,"I Aldawish, MK Aouf, BA Frasin, T Al-Hawary","AIMS Math 6, 10466-10484",2021,https://scholar.google.com/scholar?oi=bibs&hl=en&cites=5464853287471095736,https://scholar.google.com/citations?view_op=view_citation&hl=en&user=0fNwcSsAAAAJ&pagesize=100&sortby=pubdate&citation_for_view=0fNwcSsAAAAJ:Tyk-4Ss8FVUC
0fNwcSsAAAAJ,37,New oscillation results of even-order emden–fowler neutral differential equations,"S Althubiti, I Aldawish, J Awrejcewicz, O Bazighifan","Symmetry 13 (11), 2177",2021,https://scholar.google.com/scholar?oi=bibs&hl=en&cites=8833556520499771505,https://scholar.google.com/citations?view_op=view_citation&hl=en&user=0fNwcSsAAAAJ&pagesize=100&sortby=pubdate&citation_for_view=0fNwcSsAAAAJ:LkGwnXOMwfcC
0fNwcSsAAAAJ,38,Difference formula defined by a new differential symmetric operator for a class of meromorphically multivalent functions,"RW Ibrahim, I Aldawish","Advances in Difference Equations 2021 (1), 281",2021,https://scholar.google.com/scholar?oi=bibs&hl=en&cites=8601015372479216492,https://scholar.google.com/citations?view_op=view_citation&hl=en&user=0fNwcSsAAAAJ&pagesize=100&sortby=pubdate&citation_for_view=0fNwcSsAAAAJ:ufrVoPGSRksC
0fNwcSsAAAAJ,39,A new parametric differential operator generalized a class of d'Alembert's equations,"I Aldawish, RW Ibrahim","Journal of Taibah University for Science 15 (1), 449-457",2021,https://scholar.google.com/scholar?oi=bibs&hl=en&cites=11051865944854312564,https://scholar.google.com/citations?view_op=view_citation&hl=en&user=0fNwcSsAAAAJ&pagesize=100&sortby=pubdate&citation_for_view=0fNwcSsAAAAJ:Se3iqnhoufwC
0fNwcSsAAAAJ,40,On a geometric study of a class of normalized functions defined by Bernoulli’s formula,"RW Ibrahim, I Aldawish, D Baleanu","Advances in Difference Equations 2021, 1-12",2021,https://scholar.google.com/scholar?oi=bibs&hl=en&cites=NA,""
0fNwcSsAAAAJ,41,Subclasses of bi-univalent functions defined by Frasin differential operator,"I Aldawish, T Al-Hawary, BA Frasin","Mathematics 8 (5), 783",2020,https://scholar.google.com/scholar?oi=bibs&hl=en&cites=7095739209991558254,https://scholar.google.com/citations?view_op=view_citation&hl=en&user=0fNwcSsAAAAJ&pagesize=100&sortby=pubdate&citation_for_view=0fNwcSsAAAAJ:YsMSGLbcyi4C
0fNwcSsAAAAJ,42,On Subclasses of Uniformly Spiral‐like Functions Associated with Generalized Bessel Functions,"BA Frasin, I Aldawish","Journal of Function Spaces 2019 (1), 1329462",2019,https://scholar.google.com/scholar?oi=bibs&hl=en&cites=5023109038817277894,https://scholar.google.com/citations?view_op=view_citation&hl=en&user=0fNwcSsAAAAJ&pagesize=100&sortby=pubdate&citation_for_view=0fNwcSsAAAAJ:zYLM7Y9cAGgC
0fNwcSsAAAAJ,43,Univalence preserving integral operator defined by generalized hypergeometric functions,"I Aldawish, M Darus",Nonlinear Functional Analysis and Applications 539-549,2018,https://scholar.google.com/scholar?oi=bibs&hl=en&cites=NA,""
0fNwcSsAAAAJ,44,On certain class of meromorphic harmonic concave functions,"I Aldawish, M Darus","Tamkang Journal of Mathematics 46 (2), 101-109",2015,https://scholar.google.com/scholar?oi=bibs&hl=en&cites=14686513905654644829,https://scholar.google.com/citations?view_op=view_citation&hl=en&user=0fNwcSsAAAAJ&pagesize=100&sortby=pubdate&citation_for_view=0fNwcSsAAAAJ:hqOjcs7Dif8C
0fNwcSsAAAAJ,45,Some concavity properties for general integral operators,"M Darus, I Aldawish, RW Ibrahim","Bulletin of the Iranian Mathematical Society 41 (5), 1085-1092",2015,https://scholar.google.com/scholar?oi=bibs&hl=en&cites=4597630430252979293,https://scholar.google.com/citations?view_op=view_citation&hl=en&user=0fNwcSsAAAAJ&pagesize=100&sortby=pubdate&citation_for_view=0fNwcSsAAAAJ:UeHWp8X0CEIC
0fNwcSsAAAAJ,46,On p-valent Concave Functions,"I AlDawish, M Darus","Kochi Journal of Mathematics 10, 43-51",2015,https://scholar.google.com/scholar?oi=bibs&hl=en&cites=15866660745567175992,https://scholar.google.com/citations?view_op=view_citation&hl=en&user=0fNwcSsAAAAJ&pagesize=100&sortby=pubdate&citation_for_view=0fNwcSsAAAAJ:ns9cj8rnVeAC
0fNwcSsAAAAJ,47,ON p-VALENT CONCAVE FUNCTIONS BASED ON SĂLĂGEAN DIFFERENTIAL OPERATOR,"I ALDAWISH, M Darus",Kochi Journal of Mathematics 43,2015,https://scholar.google.com/scholar?oi=bibs&hl=en&cites=NA,""
0fNwcSsAAAAJ,48,Starlikeness of q− differential operator involving quantum calculus,"I Aldawish, M Darus","Korean Journal of Mathematics 22 (4), 699-709",2014,https://scholar.google.com/scholar?oi=bibs&hl=en&cites=4186899748879528168,https://scholar.google.com/citations?view_op=view_citation&hl=en&user=0fNwcSsAAAAJ&pagesize=100&sortby=pubdate&citation_for_view=0fNwcSsAAAAJ:qjMakFHDy7sC
0fNwcSsAAAAJ,49,New subclass of analytic function associated with the generlalized hypergeometric functions,"I Aldawish, M Darus","Electronic J. Math. Anal. Appl 2 (2), 163-171",2014,https://scholar.google.com/scholar?oi=bibs&hl=en&cites=3038544203431634288,https://scholar.google.com/citations?view_op=view_citation&hl=en&user=0fNwcSsAAAAJ&pagesize=100&sortby=pubdate&citation_for_view=0fNwcSsAAAAJ:2osOgNQ5qMEC
0fNwcSsAAAAJ,50,Concavity of Ruscheweyh differential operator,"M Aldawish, M Darus, RW Ibrahim","Acta Universitatis Apulensis 37, 73-82",2014,https://scholar.google.com/scholar?oi=bibs&hl=en&cites=17591322683300022614,https://scholar.google.com/citations?view_op=view_citation&hl=en&user=0fNwcSsAAAAJ&pagesize=100&sortby=pubdate&citation_for_view=0fNwcSsAAAAJ:0EnyYjriUFMC
0fNwcSsAAAAJ,51,Concavity Solutions of Second-Order Differential Equations,"I Aldawish, M Darus",PAKISTAN ACADEMY OF SCIENCES 241,2014,https://scholar.google.com/scholar?oi=bibs&hl=en&cites=NA,""
0fNwcSsAAAAJ,52,Some properties for an integral operator defined by generalized hypergeometric function,"I Aldawish, M Darus",Journal of Applied Mathematics 2014,2014,https://scholar.google.com/scholar?oi=bibs&hl=en&cites=NA,""
0fNwcSsAAAAJ,53,Boundedness and Compactness of Parametric Convex Operators of Analytic Functions on a Complex Domain,I Aldawish,Available at SSRN 465952,,https://scholar.google.com/scholar?oi=bibs&hl=en&cites=NA,""
