Scholar ID,Paper Number,Paper Title,Authors,"Publication (journal name. volume, no. pages)",Year,Cited_by,Link
96sgQ2UAAAAJ,1,"Structural, theoretical and biological studies on Cu2+ and Co2+ complexes of new thiosemicarbazone ligands","FA Adam, YG Abou El-Reash, ES Al-Farraj, IA Abdelwahed, MM El-Gamil, ...","Journal of Molecular Structure 1311, 138360",2024,https://scholar.google.com/scholar?oi=bibs&hl=en&cites=NA,""
96sgQ2UAAAAJ,2,"Green processing and characterization of Novel HETERO-ligand Co (II) complexes with cyanopyridine derivatives: Quantitative structure, Computational assessment, and Biological …","FA Adam, YG Abou El-Reash, MG Ghoniem, RR Zaky","Journal of Molecular Structure 1308, 137947",2024,https://scholar.google.com/scholar?oi=bibs&hl=en&cites=NA,""
96sgQ2UAAAAJ,3,"Purification of Water Contaminated with Heavy Metals, Exemplified by Lead Cations, Utilizing Fe2O3@ Al2O3 Nanocomposites",FA Adam,"Egyptian Journal of Chemistry 67 (3), 457-466",2024,https://scholar.google.com/scholar?oi=bibs&hl=en&cites=NA,""
96sgQ2UAAAAJ,4,Fortified anti-proliferative activity of niclosamide for breast cancer treatment: In-vitro and in-vivo assessment,"A Mansour, MY Mahmoud, AF Bakr, MG Ghoniem, FA Adam, ...","Life Sciences 316, 121379",2023,https://scholar.google.com/scholar?oi=bibs&hl=en&cites=NA,""
96sgQ2UAAAAJ,5,Highly selective removal of cationic dyes from wastewater by MgO nanorods,"MG Ghoniem, FAM Ali, BY Abdulkhair, MRA Elamin, AM Alqahtani, ...","Nanomaterials 12 (6), 1023",2022,https://scholar.google.com/scholar?oi=bibs&hl=en&cites=3247970973029602783,https://scholar.google.com/citations?view_op=view_citation&hl=en&user=96sgQ2UAAAAJ&pagesize=100&sortby=pubdate&citation_for_view=96sgQ2UAAAAJ:qjMakFHDy7sC
96sgQ2UAAAAJ,6,"Enhanced adsorptive removal of indigo carmine dye by bismuth oxide doped MgO based adsorbents from aqueous solution: Equilibrium, kinetic and computational studies","FA Adam, MG Ghoniem, M Diawara, S Rahali, BY Abdulkhair, MR Elamin, ...","RSC advances 12 (38), 24786-24803",2022,https://scholar.google.com/scholar?oi=bibs&hl=en&cites=4893478828283231244,https://scholar.google.com/citations?view_op=view_citation&hl=en&user=96sgQ2UAAAAJ&pagesize=100&sortby=pubdate&citation_for_view=96sgQ2UAAAAJ:YsMSGLbcyi4C
96sgQ2UAAAAJ,7,"Excellent Adsorption of Dyes via MgTiO3@g-C3N4 Nanohybrid: Construction, Description and Adsorption Mechanism","A Modwi, MR Elamin, H Idriss, NY Elamin, FA Adam, AE Albadri, ...","Inorganics 10 (11), 210",2022,https://scholar.google.com/scholar?oi=bibs&hl=en&cites=9760753132815545397,https://scholar.google.com/citations?view_op=view_citation&hl=en&user=96sgQ2UAAAAJ&pagesize=100&sortby=pubdate&citation_for_view=96sgQ2UAAAAJ:LkGwnXOMwfcC
96sgQ2UAAAAJ,8,Removal of malachite green dye from aqueous solution by catalytic wet oxidation technique using Ni/kaolin as catalyst,"A Moumen, Y Belhocine, N Sbei, S Rahali, FAM Ali, F Mechati, ...","Molecules 27 (21), 7528",2022,https://scholar.google.com/scholar?oi=bibs&hl=en&cites=8121111394362501848,https://scholar.google.com/citations?view_op=view_citation&hl=en&user=96sgQ2UAAAAJ&pagesize=100&sortby=pubdate&citation_for_view=96sgQ2UAAAAJ:eQOLeE2rZwMC
96sgQ2UAAAAJ,9,Spontaneous Adsorption and Efficient Photodegradation of Indigo Carmine under Visible Light by Bismuth Oxyiodide Nanoparticles Fabricated Entirely at Room Temperature,"MR Elamin, KH Ibnaouf, NY Elamin, FA Adam, AH Alolayan, ...","Inorganics 10 (5), 65",2022,https://scholar.google.com/scholar?oi=bibs&hl=en&cites=8639075835013226504,https://scholar.google.com/citations?view_op=view_citation&hl=en&user=96sgQ2UAAAAJ&pagesize=100&sortby=pubdate&citation_for_view=96sgQ2UAAAAJ:UeHWp8X0CEIC
96sgQ2UAAAAJ,10,Efficient and rapid removal of Pb (II) and Cu (II) heavy metals from aqueous solutions by MgO nanorods,"MG Ghoniem, MA Ben Aissa, FAM Ali, M Khairy","Inorganics 10 (12), 256",2022,https://scholar.google.com/scholar?oi=bibs&hl=en&cites=2755554895404017659,https://scholar.google.com/citations?view_op=view_citation&hl=en&user=96sgQ2UAAAAJ&pagesize=100&sortby=pubdate&citation_for_view=96sgQ2UAAAAJ:WF5omc3nYNoC
96sgQ2UAAAAJ,11,In search of preferential macrocyclic hosts for sulfur mustard sensing and recognition: a computational investigation through the new composite method r2SCAN-3c of the key …,"FA Messiad, N Ammouchi, Y Belhocine, H Alhussain, MG Ghoniem, ...","Nanomaterials 12 (15), 2517",2022,https://scholar.google.com/scholar?oi=bibs&hl=en&cites=933116463160563779,https://scholar.google.com/citations?view_op=view_citation&hl=en&user=96sgQ2UAAAAJ&pagesize=100&sortby=pubdate&citation_for_view=96sgQ2UAAAAJ:zYLM7Y9cAGgC
96sgQ2UAAAAJ,12,Dual-enhanced pluronic nanoformulated methotrexate-based treatment approach for breast cancer: Development and evaluation of in vitro and in vivo efficiency,"A Mansour, MY Mahmoud, AF Bakr, MG Ghoniem, FA Adam, ...","Pharmaceutics 14 (12), 2668",2022,https://scholar.google.com/scholar?oi=bibs&hl=en&cites=2478412931852739172,https://scholar.google.com/citations?view_op=view_citation&hl=en&user=96sgQ2UAAAAJ&pagesize=100&sortby=pubdate&citation_for_view=96sgQ2UAAAAJ:_FxGoFyzp5QC
96sgQ2UAAAAJ,13,Influence of Doping-Ion-Type on the Characteristics of Al2O3-Based Nanocomposites and Their Capabilities of Removing Indigo Carmine from Water,FA Adam,"Inorganics 10 (9), 144",2022,https://scholar.google.com/scholar?oi=bibs&hl=en&cites=12345271643430832306,https://scholar.google.com/citations?view_op=view_citation&hl=en&user=96sgQ2UAAAAJ&pagesize=100&sortby=pubdate&citation_for_view=96sgQ2UAAAAJ:W7OEmFMy1HYC
96sgQ2UAAAAJ,14,Synthesis of two novel copper (II) complexes as potential inhibitors of HIV-1 protease enzyme: experimental and theoretical investigations,"M Hamlaoui, I Hamlaoui, M Damous, Y Belhocine, N Sbei, FAM Ali, ...","Crystals 12 (8), 1066",2022,https://scholar.google.com/scholar?oi=bibs&hl=en&cites=9666118209121808770,https://scholar.google.com/citations?view_op=view_citation&hl=en&user=96sgQ2UAAAAJ&pagesize=100&sortby=pubdate&citation_for_view=96sgQ2UAAAAJ:Tyk-4Ss8FVUC
96sgQ2UAAAAJ,15,Adsorption behavior of barium ions onto ZnO surfaces: Experiments associated with DFT calculations,"M Salih, A Modwi, F Adam, N Elamin, M Seydou, S Rahali","Journal of Molecular Structure 1223, 128991",2021,https://scholar.google.com/scholar?oi=bibs&hl=en&cites=11125834294271651500,https://scholar.google.com/citations?view_op=view_citation&hl=en&user=96sgQ2UAAAAJ&pagesize=100&sortby=pubdate&citation_for_view=96sgQ2UAAAAJ:d1gkVwhDpl0C
96sgQ2UAAAAJ,16,"DFT-D4 insight into the inclusion of amphetamine and methamphetamine in cucurbit [7] uril: energetic, structural and biosensing properties","A Litim, Y Belhocine, T Benlecheb, MG Ghoniem, Z Kabouche, FAM Ali, ...","Molecules 26 (24), 7479",2021,https://scholar.google.com/scholar?oi=bibs&hl=en&cites=13999847314986998495,https://scholar.google.com/citations?view_op=view_citation&hl=en&user=96sgQ2UAAAAJ&pagesize=100&sortby=pubdate&citation_for_view=96sgQ2UAAAAJ:9yKSN-GCB0IC
96sgQ2UAAAAJ,17,"Discovery of natural compounds as potential inhibitors of human carbonic anhydrase II: An integrated virtual screening, docking, and molecular dynamics simulation study","F Anjum, F Ali, T Mohammad, A Shafie, O Akhtar, B Abdullaev, I Hassan","OMICS: A Journal of Integrative Biology 25 (8), 513-524",2021,https://scholar.google.com/scholar?oi=bibs&hl=en&cites=12247821591311580841,https://scholar.google.com/citations?view_op=view_citation&hl=en&user=96sgQ2UAAAAJ&pagesize=100&sortby=pubdate&citation_for_view=96sgQ2UAAAAJ:Y0pCki6q_DkC
96sgQ2UAAAAJ,18,A dispersion corrected DFT investigation of the inclusion complexation of dexamethasone with β-cyclodextrin and molecular docking study of its potential activity against COVID-19,"Y Belhocine, S Rahali, H Allal, IM Assaba, MG Ghoniem, FAM Ali","Molecules 26 (24), 7622",2021,https://scholar.google.com/scholar?oi=bibs&hl=en&cites=11082996886552831983,https://scholar.google.com/citations?view_op=view_citation&hl=en&user=96sgQ2UAAAAJ&pagesize=100&sortby=pubdate&citation_for_view=96sgQ2UAAAAJ:2osOgNQ5qMEC
96sgQ2UAAAAJ,19,Simplistic synthesis and enhanced photocatalytic performance of spherical ZnO nanoparticles prepared from arabinose solution,"BY Abdulkhair, ME Salih, NY Elamin, AMA Fatima, A Modwi","Zeitschrift für Naturforschung A 74 (10), 937-944",2019,https://scholar.google.com/scholar?oi=bibs&hl=en&cites=12977145824867565712,https://scholar.google.com/citations?view_op=view_citation&hl=en&user=96sgQ2UAAAAJ&pagesize=100&sortby=pubdate&citation_for_view=96sgQ2UAAAAJ:u5HHmVD_uO8C
96sgQ2UAAAAJ,20,FAST AND GREEN SYNTHESIS OF Sn/TiO2 PHOTOCATALYST AND IT'S BI-FUNCTIONAL COMPETENCE AS ADSORBENT AND PHOTOCATALYST.,"A Modwi, BRY Abdulkhair, ME Salih, NY Elamin, AM Fatima",Digest Journal of Nanomaterials & Biostructures (DJNB) 14 (2),2019,https://scholar.google.com/scholar?oi=bibs&hl=en&cites=17096701160486768051,https://scholar.google.com/citations?view_op=view_citation&hl=en&user=96sgQ2UAAAAJ&pagesize=100&sortby=pubdate&citation_for_view=96sgQ2UAAAAJ:u-x6o8ySG0sC
