Scholar ID,Paper Number,Paper Title,Authors,"Publication (journal name. volume, no. pages)",Year,Cited_by,Link
HrHXO5kAAAAJ,1,Data analysis by adaptive progressive hybrid censored under bivariate model,"ESA El-Sherpieny, HZ Muhammed, EM Almetwally","Annals of Data Science 11 (2), 507-548",2024,https://scholar.google.com/scholar?oi=bibs&hl=en&cites=10516703104577165100,https://scholar.google.com/citations?view_op=view_citation&hl=en&user=HrHXO5kAAAAJ&pagesize=100&sortby=pubdate&citation_for_view=HrHXO5kAAAAJ:D_sINldO8mEC
HrHXO5kAAAAJ,2,Progressive Type-II censored samples for bivariate Weibull distribution with economic and medical Applications,"ESA El-Sherpieny, HZ Muhammed, EM Almetwally","Annals of Data Science 11 (1), 51-85",2024,https://scholar.google.com/scholar?oi=bibs&hl=en&cites=16834035827946678504,https://scholar.google.com/citations?view_op=view_citation&hl=en&user=HrHXO5kAAAAJ&pagesize=100&sortby=pubdate&citation_for_view=HrHXO5kAAAAJ:M05iB0D1s5AC
HrHXO5kAAAAJ,3,Bayesian and non-bayesian estimation for the shape parameters of new versions of bivariate inverse weibull distribution based on progressive type II censoring,"HZ Muhammed, EM Almetwally","Computational Journal of Mathematical and Statistical Sciences 3 (1), 85-111",2024,https://scholar.google.com/scholar?oi=bibs&hl=en&cites=12948380619956322936,https://scholar.google.com/citations?view_op=view_citation&hl=en&user=HrHXO5kAAAAJ&pagesize=100&sortby=pubdate&citation_for_view=HrHXO5kAAAAJ:yB1At4FlUx8C
HrHXO5kAAAAJ,4,Evaluating the discrete generalized Rayleigh distribution: Statistical inferences and applications to real data analysis,"H Haj Ahmad, DA Ramadan, EM Almetwally","Mathematics 12 (2), 183",2024,https://scholar.google.com/scholar?oi=bibs&hl=en&cites=11417078489222194011,https://scholar.google.com/citations?view_op=view_citation&hl=en&user=HrHXO5kAAAAJ&pagesize=100&sortby=pubdate&citation_for_view=HrHXO5kAAAAJ:ipzZ9siozwsC
HrHXO5kAAAAJ,5,Introducing the new arcsine-generator distribution family: An in-depth exploration with an illustrative example of the inverse weibull distribution for analyzing healthcare …,"TN Sindhu, A Shafiq, MB Riaz, TA Abushal, H Ahmad, EM Almetwally, ...","Journal of Radiation Research and Applied Sciences 17 (2), 100879",2024,https://scholar.google.com/scholar?oi=bibs&hl=en&cites=5541924264927158566,https://scholar.google.com/citations?view_op=view_citation&hl=en&user=HrHXO5kAAAAJ&pagesize=100&sortby=pubdate&citation_for_view=HrHXO5kAAAAJ:BwyfMAYsbu0C
HrHXO5kAAAAJ,6,Bayesian and non-Bayesian two-sample prediction for the Fréchet distribution under progressive type II censoring,"R Alotaibi, GR Al-Dayian, EM Almetwally, H Rezk",AIP Advances 14 (1),2024,https://scholar.google.com/scholar?oi=bibs&hl=en&cites=12206107039257398449,https://scholar.google.com/citations?view_op=view_citation&hl=en&user=HrHXO5kAAAAJ&pagesize=100&sortby=pubdate&citation_for_view=HrHXO5kAAAAJ:zLWjf1WUPmwC
HrHXO5kAAAAJ,7,Statistical Inference for the Unit Gompertz Power Series Distribution Using Ranked Set Sampling with Applications,"M Yousef, A Hassan, E Almetwally",Assiut University Journal of Multidisciplinary Scientific Research 53 (1 …,2024,https://scholar.google.com/scholar?oi=bibs&hl=en&cites=16449943486751422164,https://scholar.google.com/citations?view_op=view_citation&hl=en&user=HrHXO5kAAAAJ&pagesize=100&sortby=pubdate&citation_for_view=HrHXO5kAAAAJ:uc_IGeMz5qoC
HrHXO5kAAAAJ,8,Comparison of some Bayesian estimation methods for type-I generalized extreme value distribution with simulation,"SB Habeeb, FK Abdullah, RN Shalan, AS Hassan, EM Almetwally, ...","Alexandria Engineering Journal 98, 356-363",2024,https://scholar.google.com/scholar?oi=bibs&hl=en&cites=9173599324967059942,https://scholar.google.com/citations?view_op=view_citation&hl=en&user=HrHXO5kAAAAJ&pagesize=100&sortby=pubdate&citation_for_view=HrHXO5kAAAAJ:hMsQuOkrut0C
HrHXO5kAAAAJ,9,"Discrete Poisson Quasi-XLindley distribution with mathematical properties, regression model, and data analysis","FM Alghamdi, M Ahsan-ul-Haq, MNS Hussain, E Hussam, EM Almetwally, ...","Journal of Radiation Research and Applied Sciences 17 (2), 100874",2024,https://scholar.google.com/scholar?oi=bibs&hl=en&cites=17304051564731544928,https://scholar.google.com/citations?view_op=view_citation&hl=en&user=HrHXO5kAAAAJ&pagesize=100&sortby=pubdate&citation_for_view=HrHXO5kAAAAJ:ML0RJ9NH7IQC
HrHXO5kAAAAJ,10,A case study for Kuwait mortality during the consequent waves of COVID-19,"SS BuHamra, NM Al-Kandari, E Hussam, EM Almetwally, AM Gemeay",Heliyon 10 (5),2024,https://scholar.google.com/scholar?oi=bibs&hl=en&cites=13848602903667785651,https://scholar.google.com/citations?view_op=view_citation&hl=en&user=HrHXO5kAAAAJ&pagesize=100&sortby=pubdate&citation_for_view=HrHXO5kAAAAJ:vDijr-p_gm4C
HrHXO5kAAAAJ,11,Bivariate step-stress accelerated life test for a new three-parameter model under progressive censored schemes with application in medical,"N Alotaibi, AS Al-Moisheer, I Elbatal, SA Alyami, AM Gemeay, ...","AIMS Mathematics 9 (2), 3521-3558",2024,https://scholar.google.com/scholar?oi=bibs&hl=en&cites=8835104817399280644,https://scholar.google.com/citations?view_op=view_citation&hl=en&user=HrHXO5kAAAAJ&pagesize=100&sortby=pubdate&citation_for_view=HrHXO5kAAAAJ:EkHepimYqZsC
HrHXO5kAAAAJ,12,A New Extention of the Odd Inverse Weibull-G Family of Distributions: Bayesian and Non-Bayesian Estimation with Engineering Applications,"YY Abdelall, AS Hassan, EM Almetwally","Computational Journal of Mathematical and Statistical Sciences 3 (2), 359-388",2024,https://scholar.google.com/scholar?oi=bibs&hl=en&cites=NA,""
HrHXO5kAAAAJ,13,Advancing estimation techniques and their applications in engineering and medical data analysis through novel continuous and discrete linear failure rate distribution extension,"I Elbatal, M Elgarhy, SM Almarzouki, LS Diab, AB Ghorbal, EM Almetwally","Journal of Radiation Research and Applied Sciences 17 (3), 101006",2024,https://scholar.google.com/scholar?oi=bibs&hl=en&cites=NA,""
HrHXO5kAAAAJ,14,Univariate and bivariate extensions of the truncated inverted arctan power distribution with applications,"HE Semary, C Chesneau, MA Aldahlan, I Elbatal, M Elgarhy, ...","Alexandria Engineering Journal 100, 340-356",2024,https://scholar.google.com/scholar?oi=bibs&hl=en&cites=NA,""
HrHXO5kAAAAJ,15,New Arctan-generator family of distributions with an example of Frechet distribution: Simulation and analysis to strength of glass and carbon fiber data,"A Ahmad, FM Alghamdi, A Ahmad, O Albalawi, AA Zaagan, M Zakarya, ...","Alexandria Engineering Journal 100, 42-52",2024,https://scholar.google.com/scholar?oi=bibs&hl=en&cites=NA,""
HrHXO5kAAAAJ,16,A new extension of inverse length biased exponential model with statistical inference under joint censored samples and application,"MM Abdelwahab, I Elbatal, M Elgarhy, AB Ghorbal, HE Semary, ...","Alexandria Engineering Journal 99, 377-393",2024,https://scholar.google.com/scholar?oi=bibs&hl=en&cites=NA,""
HrHXO5kAAAAJ,17,New comprehensive class of estimators for population proportion using auxiliary attribute: Simulation and an application,"HE Semary, S Ahmad, I Elbatal, C Chesneau, M Elgarhy, EM Almetwally","Alexandria Engineering Journal 99, 130-136",2024,https://scholar.google.com/scholar?oi=bibs&hl=en&cites=NA,""
HrHXO5kAAAAJ,18,Advanced Copula-Based Models for Type II Censored Data: Applications in Industrial and Medical Settings,"EM Almetwally, A Fayomi, ME Qura","Mathematics 12 (12), 1774",2024,https://scholar.google.com/scholar?oi=bibs&hl=en&cites=NA,""
HrHXO5kAAAAJ,19,Physics and economic applications by progressive censoring and bootstrapping sampling for extension of power Topp-Leone model,"OM Khaled, HM Barakat, LA AL-Essa, EM Almetwally","Journal of Radiation Research and Applied Sciences 17 (2), 100898",2024,https://scholar.google.com/scholar?oi=bibs&hl=en&cites=NA,""
HrHXO5kAAAAJ,20,Bayesian and Non-Bayesian Analysis for the Sine Generalized Linear Exponential Model under Progressively Censored Data,"N Alotaibi, AS Al-Moisheer, I Elbatal, M Elgarhy, EM Almetwally",Computer Modeling in Engineering & Sciences 140,2024,https://scholar.google.com/scholar?oi=bibs&hl=en&cites=NA,""
HrHXO5kAAAAJ,21,"Tampered Random Variable Analysis in Step-Stress Testing: Modeling, Inference, and Applications","HH Ahmad, DA Ramadan, EM Almetwally","Mathematics 12 (8), 1248",2024,https://scholar.google.com/scholar?oi=bibs&hl=en&cites=NA,""
HrHXO5kAAAAJ,22,The optimal multi-stress–strength reliability technique for the progressive first failure in the length-bias exponential model using Bayesian and non-Bayesian methods,"R Alotaibi, EM Almetwally, I Ghosh, H Rezk",Journal of Statistical Computation and Simulation 1-26,2024,https://scholar.google.com/scholar?oi=bibs&hl=en&cites=NA,""
HrHXO5kAAAAJ,23,Enhancing Stock Price Prediction Accuracy Using ARIMA and Advanced Greylag Goose Optimizer Algorithm,"M Abotaleb, WH Lim, P Mishra, AST Qenawy, EM ALmetwally","Journal of Artificial Intelligence in Engineering Practice 1 (1), 49-65",2024,https://scholar.google.com/scholar?oi=bibs&hl=en&cites=NA,""
HrHXO5kAAAAJ,24,Applications to Physical Data Using Four-Parameter Inverted Topp-Leone Model,"AS Hassan, EM Almetwally","Thailand Statistician 22 (2), 430-457",2024,https://scholar.google.com/scholar?oi=bibs&hl=en&cites=NA,""
HrHXO5kAAAAJ,25,Statistical inference of a step-stress model with competing risks under time censoring for alpha power exponential distribution,"R Alotaibi, EM Almetwally, I Ghosh, H Rezk","Journal of Radiation Research and Applied Sciences 17 (1), 100771",2024,https://scholar.google.com/scholar?oi=bibs&hl=en&cites=NA,""
HrHXO5kAAAAJ,26,Bayesian and non-Bayesian estimation for the bivariate inverse weibull distribution under progressive type-II censoring,"HZ Muhammed, EM Almetwally","Annals of Data Science 10 (2), 481-512",2023,https://scholar.google.com/scholar?oi=bibs&hl=en&cites=4997439488755405778,https://scholar.google.com/citations?view_op=view_citation&hl=en&user=HrHXO5kAAAAJ&pagesize=100&sortby=pubdate&citation_for_view=HrHXO5kAAAAJ:4TOpqqG69KYC
HrHXO5kAAAAJ,27,Bayesian and non-bayesian estimation for the parameter of bivariate generalized Rayleigh distribution based on clayton copula under progressive type-II censoring with random …,"ESA El-Sherpieny, EM Almetwally, HZ Muhammed","Sankhya A 85 (2), 1205-1242",2023,https://scholar.google.com/scholar?oi=bibs&hl=en&cites=6451897069450581619,https://scholar.google.com/citations?view_op=view_citation&hl=en&user=HrHXO5kAAAAJ&pagesize=100&sortby=pubdate&citation_for_view=HrHXO5kAAAAJ:k_IJM867U9cC
HrHXO5kAAAAJ,28,Analysis of unit-Weibull based on progressive type-II censored with optimal scheme,"EM Almetwally, TM Jawa, N Sayed-Ahmed, C Park, M Zakarya, S Dey","Alexandria Engineering Journal 63, 321-338",2023,https://scholar.google.com/scholar?oi=bibs&hl=en&cites=15423896208217360465,https://scholar.google.com/citations?view_op=view_citation&hl=en&user=HrHXO5kAAAAJ&pagesize=100&sortby=pubdate&citation_for_view=HrHXO5kAAAAJ:738O_yMBCRsC
HrHXO5kAAAAJ,29,New hyperbolic sine-generator with an example of Rayleigh distribution: Simulation and data analysis in industry,"A Ahmad, N Alsadat, MN Atchade, SQ ul Ain, AM Gemeay, MA Meraou, ...","Alexandria Engineering Journal 73, 415-426",2023,https://scholar.google.com/scholar?oi=bibs&hl=en&cites=15942268448188725931,https://scholar.google.com/citations?view_op=view_citation&hl=en&user=HrHXO5kAAAAJ&pagesize=100&sortby=pubdate&citation_for_view=HrHXO5kAAAAJ:VL0QpB8kHFEC
HrHXO5kAAAAJ,30,Optimal analysis of adaptive type-II progressive censored for new unit-lindley model,"A Alrumayh, W Weera, HA Khogeer, EM Almetwally","Journal of King Saud University-Science 35 (2), 102462",2023,https://scholar.google.com/scholar?oi=bibs&hl=en&cites=3505869383210003829,https://scholar.google.com/citations?view_op=view_citation&hl=en&user=HrHXO5kAAAAJ&pagesize=100&sortby=pubdate&citation_for_view=HrHXO5kAAAAJ:V3AGJWp-ZtQC
HrHXO5kAAAAJ,31,Statistical inference to the parameter of the Akshaya distribution under competing risks data with application HIV infection to aids,"DA Ramadan, EM Almetwally, AH Tolba","Annals of Data Science 10 (6), 1499-1525",2023,https://scholar.google.com/scholar?oi=bibs&hl=en&cites=8695928503811426859,https://scholar.google.com/citations?view_op=view_citation&hl=en&user=HrHXO5kAAAAJ&pagesize=100&sortby=pubdate&citation_for_view=HrHXO5kAAAAJ:pqnbT2bcN3wC
HrHXO5kAAAAJ,32,Bayesian inference and data analysis of the unit–power Burr X distribution,"A Fayomi, AS Hassan, H Baaqeel, EM Almetwally","Axioms 12 (3), 297",2023,https://scholar.google.com/scholar?oi=bibs&hl=en&cites=198964015999949490,https://scholar.google.com/citations?view_op=view_citation&hl=en&user=HrHXO5kAAAAJ&pagesize=100&sortby=pubdate&citation_for_view=HrHXO5kAAAAJ:PELIpwtuRlgC
HrHXO5kAAAAJ,33,Statistical inferences for the extended inverse Weibull distribution under progressive type-II censored sample with applications,"YA Tashkandy, EM Almetwally, R Ragab, AM Gemeay, MM Abd El-Raouf, ...","Alexandria Engineering Journal 65, 493-502",2023,https://scholar.google.com/scholar?oi=bibs&hl=en&cites=7890249495009347844,https://scholar.google.com/citations?view_op=view_citation&hl=en&user=HrHXO5kAAAAJ&pagesize=100&sortby=pubdate&citation_for_view=HrHXO5kAAAAJ:LPZeul_q3PIC
HrHXO5kAAAAJ,34,New lifetime distribution with applications to single acceptance sampling plan and scenarios of increasing hazard rates,"EQ Chinedu, QC Chukwudum, N Alsadat, OJ Obulezi, EM Almetwally, ...","Symmetry 15 (10), 1881",2023,https://scholar.google.com/scholar?oi=bibs&hl=en&cites=4293535106195903228,https://scholar.google.com/citations?view_op=view_citation&hl=en&user=HrHXO5kAAAAJ&pagesize=100&sortby=pubdate&citation_for_view=HrHXO5kAAAAJ:j8SEvjWlNXcC
HrHXO5kAAAAJ,35,Bayesian and non-bayesian inference for the generalized power akshaya distribution with application in medical,"A Hamdy, EM Almetwally","Computational Journal of Mathematical and Statistical Sciences 2 (1), 31-51",2023,https://scholar.google.com/scholar?oi=bibs&hl=en&cites=6057396201008910219,https://scholar.google.com/citations?view_op=view_citation&hl=en&user=HrHXO5kAAAAJ&pagesize=100&sortby=pubdate&citation_for_view=HrHXO5kAAAAJ:HE397vMXCloC
HrHXO5kAAAAJ,36,Statistical inference for the Kavya–Manoharan Kumaraswamy model under ranked set sampling with applications,"N Alotaibi, I Elbatal, M Shrahili, AS Al-Moisheer, M Elgarhy, ...","Symmetry 15 (3), 587",2023,https://scholar.google.com/scholar?oi=bibs&hl=en&cites=5050360866200540306,https://scholar.google.com/citations?view_op=view_citation&hl=en&user=HrHXO5kAAAAJ&pagesize=100&sortby=pubdate&citation_for_view=HrHXO5kAAAAJ:tkaPQYYpVKoC
HrHXO5kAAAAJ,37,Bivariate power Lomax distribution with medical applications,"ME Qura, A Fayomi, M Kilai, EM Almetwally","Plos one 18 (3), e0282581",2023,https://scholar.google.com/scholar?oi=bibs&hl=en&cites=1606289130481736749,https://scholar.google.com/citations?view_op=view_citation&hl=en&user=HrHXO5kAAAAJ&pagesize=100&sortby=pubdate&citation_for_view=HrHXO5kAAAAJ:_B80troHkn4C
HrHXO5kAAAAJ,38,On unit exponential pareto distribution for modeling the recovery rate of COVID-19,"H Haj Ahmad, EM Almetwally, M Elgarhy, DA Ramadan","Processes 11 (1), 232",2023,https://scholar.google.com/scholar?oi=bibs&hl=en&cites=1146376866631866772,https://scholar.google.com/citations?view_op=view_citation&hl=en&user=HrHXO5kAAAAJ&pagesize=100&sortby=pubdate&citation_for_view=HrHXO5kAAAAJ:5ugPr518TE4C
HrHXO5kAAAAJ,39,"The odd lindley power rayleigh distribution: properties, classical and bayesian estimation with applications","AA Bhat, SP Ahmad, EM Almetwally, N Yehia, N Alsadat, AH Tolba","Scientific African 20, e01736",2023,https://scholar.google.com/scholar?oi=bibs&hl=en&cites=9798236509428716288,https://scholar.google.com/citations?view_op=view_citation&hl=en&user=HrHXO5kAAAAJ&pagesize=100&sortby=pubdate&citation_for_view=HrHXO5kAAAAJ:ZuybSZzF8UAC
HrHXO5kAAAAJ,40,Optimal test plan of discrete alpha power inverse Weibull distribution under censored data,"R Alotaibi, EM Almetwally, H Rezk","Journal of Radiation Research and Applied Sciences 16 (2), 100573",2023,https://scholar.google.com/scholar?oi=bibs&hl=en&cites=2601457930510328187,https://scholar.google.com/citations?view_op=view_citation&hl=en&user=HrHXO5kAAAAJ&pagesize=100&sortby=pubdate&citation_for_view=HrHXO5kAAAAJ:SdhP9T11ey4C
HrHXO5kAAAAJ,41,A new heavy tailed distribution with actuarial measures,"FH Riad, A Radwan, EM Almetwally, M Elgarhy","Journal of Radiation Research and Applied Sciences 16 (2), 100562",2023,https://scholar.google.com/scholar?oi=bibs&hl=en&cites=10918956565891926222,https://scholar.google.com/citations?view_op=view_citation&hl=en&user=HrHXO5kAAAAJ&pagesize=100&sortby=pubdate&citation_for_view=HrHXO5kAAAAJ:JoZmwDi-zQgC
HrHXO5kAAAAJ,42,"A compound class of unit Burr XII model: Theory, estimation, fuzzy, and application","MA Zayed, AS Hassan, EM Almetwally, AM Aboalkhair, AH Al-Nefaie, ...","Scientific Programming 2023 (1), 4509889",2023,https://scholar.google.com/scholar?oi=bibs&hl=en&cites=15224299247347520619,https://scholar.google.com/citations?view_op=view_citation&hl=en&user=HrHXO5kAAAAJ&pagesize=100&sortby=pubdate&citation_for_view=HrHXO5kAAAAJ:WqliGbK-hY8C
HrHXO5kAAAAJ,43,Inferential survival analysis for inverted NH distribution under adaptive progressive hybrid censoring with application of transformer insulation,"OE Abo-Kasem, EM Almetwally, WS Abu El Azm","Annals of Data Science 10 (5), 1237-1284",2023,https://scholar.google.com/scholar?oi=bibs&hl=en&cites=9232152943462988963,https://scholar.google.com/citations?view_op=view_citation&hl=en&user=HrHXO5kAAAAJ&pagesize=100&sortby=pubdate&citation_for_view=HrHXO5kAAAAJ:b0M2c_1WBrUC
HrHXO5kAAAAJ,44,"The Gull Alpha Power Lomax distributions: Properties, simulation, and applications to modeling COVID-19 mortality rates","AH Tolba, AH Muse, A Fayomi, HM Baaqeel, EM Almetwally","Plos one 18 (9), e0283308",2023,https://scholar.google.com/scholar?oi=bibs&hl=en&cites=14850482266842092590,https://scholar.google.com/citations?view_op=view_citation&hl=en&user=HrHXO5kAAAAJ&pagesize=100&sortby=pubdate&citation_for_view=HrHXO5kAAAAJ:evX43VCCuoAC
HrHXO5kAAAAJ,45,Statistical inference of truncated Cauchy power-inverted Topp–Leone distribution under hybrid censored scheme with applications,"RAH Mohamed, M Elgarhy, MH Alabdulhadi, EM Almetwally, T Radwan","Axioms 12 (2), 148",2023,https://scholar.google.com/scholar?oi=bibs&hl=en&cites=17736315997160836037,https://scholar.google.com/citations?view_op=view_citation&hl=en&user=HrHXO5kAAAAJ&pagesize=100&sortby=pubdate&citation_for_view=HrHXO5kAAAAJ:Mojj43d5GZwC
HrHXO5kAAAAJ,46,"A novel bivariate Lomax-G family of distributions: Properties, inference, and applications to environmental, medical, and computer science data","A Fayomi, EM Almetwally, ME Qura","Aims Math 8 (8), 17539-17584",2023,https://scholar.google.com/scholar?oi=bibs&hl=en&cites=7096877075326111028,https://scholar.google.com/citations?view_op=view_citation&hl=en&user=HrHXO5kAAAAJ&pagesize=100&sortby=pubdate&citation_for_view=HrHXO5kAAAAJ:N5tVd3kTz84C
HrHXO5kAAAAJ,47,Exploring new horizons: Advancing data analysis in kidney patient infection rates and UEFA champions league scores using bivariate kavya–manoharan transformation family of …,"A Fayomi, EM Almetwally, ME Qura","Mathematics 11 (13), 2986",2023,https://scholar.google.com/scholar?oi=bibs&hl=en&cites=11055868204259542170,https://scholar.google.com/citations?view_op=view_citation&hl=en&user=HrHXO5kAAAAJ&pagesize=100&sortby=pubdate&citation_for_view=HrHXO5kAAAAJ:_Ybze24A_UAC
HrHXO5kAAAAJ,48,Kavya-Manoharan Weibull-G family of distributions: Statistical inference under progressive type-II censoring scheme,"I Elbatal, SM Alghamdi, F Jamal, S Khan, EM Almetwally, M Elgarhy","Advances and Applications in Statistics 87 (2), 191-223",2023,https://scholar.google.com/scholar?oi=bibs&hl=en&cites=13962869443365852217,https://scholar.google.com/citations?view_op=view_citation&hl=en&user=HrHXO5kAAAAJ&pagesize=100&sortby=pubdate&citation_for_view=HrHXO5kAAAAJ:JQOojiI6XY0C
HrHXO5kAAAAJ,49,A new extension of the Kumaraswamy exponential model with modeling of food chain data,"EA Eldessouky, OHM Hassan, M Elgarhy, EAA Hassan, I Elbatal, ...","Axioms 12 (4), 379",2023,https://scholar.google.com/scholar?oi=bibs&hl=en&cites=7434203005908976473,https://scholar.google.com/citations?view_op=view_citation&hl=en&user=HrHXO5kAAAAJ&pagesize=100&sortby=pubdate&citation_for_view=HrHXO5kAAAAJ:eq2jaN3J8jMC
HrHXO5kAAAAJ,50,Half logistic inverted Nadarajah–Haghighi distribution under ranked set sampling with applications,"N Alotaibi, AS Al-Moisheer, I Elbatal, M Shrahili, M Elgarhy, ...","Mathematics 11 (7), 1693",2023,https://scholar.google.com/scholar?oi=bibs&hl=en&cites=6255908727239010588,https://scholar.google.com/citations?view_op=view_citation&hl=en&user=HrHXO5kAAAAJ&pagesize=100&sortby=pubdate&citation_for_view=HrHXO5kAAAAJ:dTyEYWd-f8wC
HrHXO5kAAAAJ,51,Statistical analysis of alpha power inverse Weibull distribution under hybrid censored scheme with applications to ball bearings technology and biomedical data,"H Haj Ahmad, EM Almetwally, A Rabaiah, DA Ramadan","Symmetry 15 (1), 161",2023,https://scholar.google.com/scholar?oi=bibs&hl=en&cites=3212316735793918159,https://scholar.google.com/citations?view_op=view_citation&hl=en&user=HrHXO5kAAAAJ&pagesize=100&sortby=pubdate&citation_for_view=HrHXO5kAAAAJ:wbdj-CoPYUoC
HrHXO5kAAAAJ,52,Classical and Bayesian inference for the Kavya–Manoharan generalized exponential distribution under generalized progressively hybrid censored data,"MM Abdelwahab, AB Ghorbal, AS Hassan, M Elgarhy, EM Almetwally, ...","Symmetry 15 (6), 1193",2023,https://scholar.google.com/scholar?oi=bibs&hl=en&cites=5022310669668576281,https://scholar.google.com/citations?view_op=view_citation&hl=en&user=HrHXO5kAAAAJ&pagesize=100&sortby=pubdate&citation_for_view=HrHXO5kAAAAJ:PR6Y55bgFSsC
HrHXO5kAAAAJ,53,Simulation techniques for strength component partially accelerated to analyze stress–strength model,"MM Yousef, A Fayomi, EM Almetwally","Symmetry 15 (6), 1183",2023,https://scholar.google.com/scholar?oi=bibs&hl=en&cites=14874304297020150745,https://scholar.google.com/citations?view_op=view_citation&hl=en&user=HrHXO5kAAAAJ&pagesize=100&sortby=pubdate&citation_for_view=HrHXO5kAAAAJ:dQ2og3OwTAUC
HrHXO5kAAAAJ,54,Investigating the relationship between processor and memory reliability in data science: A bivariate model approach,"H Haj Ahmad, EM Almetwally, DA Ramadan","Mathematics 11 (9), 2142",2023,https://scholar.google.com/scholar?oi=bibs&hl=en&cites=15618222773704078792,https://scholar.google.com/citations?view_op=view_citation&hl=en&user=HrHXO5kAAAAJ&pagesize=100&sortby=pubdate&citation_for_view=HrHXO5kAAAAJ:ye4kPcJQO24C
HrHXO5kAAAAJ,55,Weighted power Maxwell distribution: Statistical inference and COVID-19 applications,"MA Almuqrin, SA Almutlak, AM Gemeay, EM Almetwally, K Karakaya, ...","Plos one 18 (1), e0278659",2023,https://scholar.google.com/scholar?oi=bibs&hl=en&cites=18217832308348878405,https://scholar.google.com/citations?view_op=view_citation&hl=en&user=HrHXO5kAAAAJ&pagesize=100&sortby=pubdate&citation_for_view=HrHXO5kAAAAJ:J-pR_7NvFogC
HrHXO5kAAAAJ,56,Marshall–Olkin Weibull–Burr XII distribution with application to physics data,"N Alsadat, VBV Nagarjuna, AS Hassan, M Elgarhy, H Ahmad, ...",AIP Advances 13 (9),2023,https://scholar.google.com/scholar?oi=bibs&hl=en&cites=5433655921426790001,https://scholar.google.com/citations?view_op=view_citation&hl=en&user=HrHXO5kAAAAJ&pagesize=100&sortby=pubdate&citation_for_view=HrHXO5kAAAAJ:fEOibwPWpKIC
HrHXO5kAAAAJ,57,An overview of discrete distributions in modelling COVID-19 data sets,"EM Almetwally, S Dey, S Nadarajah","Sankhya A 85 (2), 1403-1430",2023,https://scholar.google.com/scholar?oi=bibs&hl=en&cites=16165663296640913811,https://scholar.google.com/citations?view_op=view_citation&hl=en&user=HrHXO5kAAAAJ&pagesize=100&sortby=pubdate&citation_for_view=HrHXO5kAAAAJ:sSrBHYA8nusC
HrHXO5kAAAAJ,58,A new improved form of the Lomax model: Its bivariate extension and an application in the financial sector,"M Kamal, R Aldallal, SG Nassr, A Al Mutairi, M Yusuf, MSA Mustafa, ...","Alexandria Engineering Journal 75, 127-138",2023,https://scholar.google.com/scholar?oi=bibs&hl=en&cites=8068415627556552095,https://scholar.google.com/citations?view_op=view_citation&hl=en&user=HrHXO5kAAAAJ&pagesize=100&sortby=pubdate&citation_for_view=HrHXO5kAAAAJ:1yQoGdGgb4wC
HrHXO5kAAAAJ,59,"The Unit Alpha-Power Kum-Modified Size-Biased Lehmann Type II Distribution: Theory, Simulation, and Applications","RS Gomaa, AM Magar, N Alsadat, EM Almetwally, AH Tolba","Symmetry 15 (6), 1283",2023,https://scholar.google.com/scholar?oi=bibs&hl=en&cites=3211786481017406961,https://scholar.google.com/citations?view_op=view_citation&hl=en&user=HrHXO5kAAAAJ&pagesize=100&sortby=pubdate&citation_for_view=HrHXO5kAAAAJ:uLbwQdceFCQC
HrHXO5kAAAAJ,60,Different estimation methods for new probability distribution approach based on environmental and medical data,"EAA Hassan, M Elgarhy, EA Eldessouky, OHM Hassan, EA Amin, ...","Axioms 12 (2), 220",2023,https://scholar.google.com/scholar?oi=bibs&hl=en&cites=7061411144261170575,https://scholar.google.com/citations?view_op=view_citation&hl=en&user=HrHXO5kAAAAJ&pagesize=100&sortby=pubdate&citation_for_view=HrHXO5kAAAAJ:Y5dfb0dijaUC
HrHXO5kAAAAJ,61,Classical and Bayesian estimation for the extended odd Weibull power Lomax model with applications,"N Alsadat, M Elgarhy, AH Tolba, AS Elwehidy, H Ahmad, EM Almetwally",AIP Advances 13 (9),2023,https://scholar.google.com/scholar?oi=bibs&hl=en&cites=1646228902984907561,https://scholar.google.com/citations?view_op=view_citation&hl=en&user=HrHXO5kAAAAJ&pagesize=100&sortby=pubdate&citation_for_view=HrHXO5kAAAAJ:35r97b3x0nAC
