Scholar ID,Paper Number,Paper Title,Authors,"Publication (journal name. volume, no. pages)",Year,Cited_by,Link
1GiAGgwAAAAJ,1,"Gamma/neutron radiation shielding, structural and physical characteristics of iron slag nanopowder","MA Al-Rajhi, H Idriss, AAS Alaamer, AM El-Khayatt","Applied Radiation and Isotopes 170, 109606",2021,https://scholar.google.com/scholar?oi=bibs&hl=en&cites=7694545216299762445,https://scholar.google.com/citations?view_op=view_citation&hl=en&user=1GiAGgwAAAAJ&pagesize=100&sortby=pubdate&citation_for_view=1GiAGgwAAAAJ:SeFeTyx0c_EC
1GiAGgwAAAAJ,2,Improvement of shielding properties of cement paste by slag addition from local steel industry,"AM El-Khayatt, MA Al-Rajhi, AT Hassan, H Idriss","Journal of Testing and Evaluation 49 (5), 3444-3459",2021,https://scholar.google.com/scholar?oi=bibs&hl=en&cites=15020888498624137979,https://scholar.google.com/citations?view_op=view_citation&hl=en&user=1GiAGgwAAAAJ&pagesize=100&sortby=pubdate&citation_for_view=1GiAGgwAAAAJ:M05iB0D1s5AC
1GiAGgwAAAAJ,3,Reprint of “Occupational exposure in nuclear medicine and interventional cardiology departments in Sudan: Are they following radiation protection standards?”,"II Suliman, LH Salih, DM Ali, AS Alaamer, MA Al-Rajhi, M Alkhorayef, ...","Radiation Physics and Chemistry 167, 108556",2020,https://scholar.google.com/scholar?oi=bibs&hl=en&cites=7781032573068035369,https://scholar.google.com/citations?view_op=view_citation&hl=en&user=1GiAGgwAAAAJ&pagesize=100&sortby=pubdate&citation_for_view=1GiAGgwAAAAJ:ldfaerwXgEUC
1GiAGgwAAAAJ,4,Occupational exposure in nuclear medicine and interventional cardiology departments in Sudan: are they following radiation protection standards?,"II Suliman, LH Salih, DM Ali, AS Alaamer, MA Al-Rajhi, M Alkhorayef, ...","Radiation physics and chemistry 160, 100-104",2019,https://scholar.google.com/scholar?oi=bibs&hl=en&cites=7208867580553850135,https://scholar.google.com/citations?view_op=view_citation&hl=en&user=1GiAGgwAAAAJ&pagesize=100&sortby=pubdate&citation_for_view=1GiAGgwAAAAJ:2P1L_qKh6hAC
1GiAGgwAAAAJ,5,RETROSPECTIVE ANALYSIS OF PATIENT RADIATION DOSES IN DIGITAL CORONARY ANGIOGRAPHY AND INTERVENTIONS,"A Suliman, K Al-Jabri, A Alzimami, Alsafi, Abdulaziz, MA Al-Rajhi","Radiation Protection Dosimetry 183 (4), 497-502",2019,https://scholar.google.com/scholar?oi=bibs&hl=en&cites=7184265678971715005,https://scholar.google.com/citations?view_op=view_citation&hl=en&user=1GiAGgwAAAAJ&pagesize=100&sortby=pubdate&citation_for_view=1GiAGgwAAAAJ:lSLTfruPkqcC
1GiAGgwAAAAJ,6,Synthesis and characterization of an efficient new liquid laser dye material-chalcone (DMAPPP),"A Elzupir, K Ibnaouf, H Idriss, M Ibrahem, S Prasad, M Alrajhi, M AlSalhi, ...","Acta Physica Polonica A 133 (1), 121-125",2018,https://scholar.google.com/scholar?oi=bibs&hl=en&cites=16930594724715667764,https://scholar.google.com/citations?view_op=view_citation&hl=en&user=1GiAGgwAAAAJ&pagesize=100&sortby=pubdate&citation_for_view=1GiAGgwAAAAJ:k_IJM867U9cC
1GiAGgwAAAAJ,7,"Health risk profile for terrestrial radionuclides in soil around artisanal gold mining area at Alsopag, Sudan","H Idriss, I Salih, AS Alaamer, MA Al-Rajhi, A Osman, TE Adreani, ...","Acta Geophysica 66, 673-681",2018,https://scholar.google.com/scholar?oi=bibs&hl=en&cites=17188777019946298301,https://scholar.google.com/citations?view_op=view_citation&hl=en&user=1GiAGgwAAAAJ&pagesize=100&sortby=pubdate&citation_for_view=1GiAGgwAAAAJ:IWHjjKOFINEC
1GiAGgwAAAAJ,8,"Assessment of health risks from aflatoxins in rice commercialised in Riyadh, Kingdom of Saudi Arabia","AO Elzupir, AS Alamer, M AlRajhi, H Idriss","Quality Assurance and Safety of Crops & Foods 10 (3), 255-260",2018,https://scholar.google.com/scholar?oi=bibs&hl=en&cites=1455590316980656833,https://scholar.google.com/citations?view_op=view_citation&hl=en&user=1GiAGgwAAAAJ&pagesize=100&sortby=pubdate&citation_for_view=1GiAGgwAAAAJ:J_g5lzvAfSwC
1GiAGgwAAAAJ,9,Monte Carlo study of unflattened versus flattened 18 MV photon beam from medical linear accelerator as photoneutron source for BNCT applications,"M Halato, I Suliman, A Artoli, M Al-Rajhi, F Longo, G Giannini","Physica Medica: European Journal of Medical Physics 52, 175",2018,https://scholar.google.com/scholar?oi=bibs&hl=en&cites=NA,""
1GiAGgwAAAAJ,10,"Information quantifiers, entropy squeezing and entanglement properties of superconducting qubit-deformed bosonic field system under dephasing effect","K Berrada, MA Al-Rajhi","Quantum Information Processing 16, 1-16",2017,https://scholar.google.com/scholar?oi=bibs&hl=en&cites=14853900885597871110,https://scholar.google.com/citations?view_op=view_citation&hl=en&user=1GiAGgwAAAAJ&pagesize=100&sortby=pubdate&citation_for_view=1GiAGgwAAAAJ:j3f4tGmQtD8C
1GiAGgwAAAAJ,11,A facile and economical method for mass production of ZnO nanopowder,"H Idriss, SA Moussa, AS Alaamer, MA Al-Rajhi","Digest J Nano mat Bio struct 12, 1069-1073",2017,https://scholar.google.com/scholar?oi=bibs&hl=en&cites=15738156459226751301,https://scholar.google.com/citations?view_op=view_citation&hl=en&user=1GiAGgwAAAAJ&pagesize=100&sortby=pubdate&citation_for_view=1GiAGgwAAAAJ:TQgYirikUcIC
1GiAGgwAAAAJ,12,"SPECTRAL AND ASE PROPERTIES OF AN AMINO CHALCONE 1-(4-CHLOROPHENYL)-3-(4-N, N DIMETHYLAMINO PHENYL)-2-PROPEN-1-ONE","KH Ibnaouf, MKM Ali, AO Elzupir, MA Ibrahem, MA Alrajhi, H Idriss, ...","DIGEST JOURNAL OF NANOMATERIALS AND BIOSTRUCTURES 12 (2), 423-430",2017,https://scholar.google.com/scholar?oi=bibs&hl=en&cites=9951248753203592404,https://scholar.google.com/citations?view_op=view_citation&hl=en&user=1GiAGgwAAAAJ&pagesize=100&sortby=pubdate&citation_for_view=1GiAGgwAAAAJ:RYcK_YlVTxYC
1GiAGgwAAAAJ,13,Investigation of Heavy Metal in Tea Prepared by Common Teapots in Riyadh,"MA Al-Rajhi, AS Alaamer, O Aldaghri, H Idriss","Journal of King Abdulaziz University 29 (1), 23-28",2017,https://scholar.google.com/scholar?oi=bibs&hl=en&cites=NA,""
1GiAGgwAAAAJ,14,PIXE study on the effects of parathyroid hormone on elemental content in rat bones,"MH Eisa, H Shen, W Jin, AS Alaamer, MA Al-Rajhi, H Idriss","Physica Medica 32 (12), 1615-1620",2016,https://scholar.google.com/scholar?oi=bibs&hl=en&cites=7431601400231057742,https://scholar.google.com/citations?view_op=view_citation&hl=en&user=1GiAGgwAAAAJ&pagesize=100&sortby=pubdate&citation_for_view=1GiAGgwAAAAJ:mVmsd5A6BfQC
1GiAGgwAAAAJ,15,Entanglement and Statistical Properties of a System Consisting of Three-Level Atom Interacting with a Nonlinear Kerr Medium Field,"S Abdel-Khalek, M Al-Rajhi, K Berrada","Acta Physica Polonica A 129 (6), 1083-1088",2016,https://scholar.google.com/scholar?oi=bibs&hl=en&cites=2624779463062333349,https://scholar.google.com/citations?view_op=view_citation&hl=en&user=1GiAGgwAAAAJ&pagesize=100&sortby=pubdate&citation_for_view=1GiAGgwAAAAJ:aqlVkmm33-oC
1GiAGgwAAAAJ,16,Analysis of some lunar soil and rocks samples in terms of photon interaction and photon energy absorption,"AM El-Khayatt, MA Al-Rajhi","Advances in Space Research 55 (7), 1816-1822",2015,https://scholar.google.com/scholar?oi=bibs&hl=en&cites=14672794217136901950,https://scholar.google.com/citations?view_op=view_citation&hl=en&user=1GiAGgwAAAAJ&pagesize=100&sortby=pubdate&citation_for_view=1GiAGgwAAAAJ:kNdYIx-mwKoC
1GiAGgwAAAAJ,17,Photon added coherent states for nonharmonic oscillators in a nonlinear Kerr medium,MA Al-Rajhi,"Modern Physics Letters B 29 (10), 1550035",2015,https://scholar.google.com/scholar?oi=bibs&hl=en&cites=9824979785722138369,https://scholar.google.com/citations?view_op=view_citation&hl=en&user=1GiAGgwAAAAJ&pagesize=100&sortby=pubdate&citation_for_view=1GiAGgwAAAAJ:YOwf2qJgpHMC
1GiAGgwAAAAJ,18,Generalized Heisenberg Algebra Coherent States for Nonharmonic Oscillators,"MA Al-Rajhi, S Abdel-Khalek","International Journal of Theoretical Physics 54, 1470-1480",2015,https://scholar.google.com/scholar?oi=bibs&hl=en&cites=7245902023407993085,https://scholar.google.com/citations?view_op=view_citation&hl=en&user=1GiAGgwAAAAJ&pagesize=100&sortby=pubdate&citation_for_view=1GiAGgwAAAAJ:KlAtU1dfN6UC
1GiAGgwAAAAJ,19,Comparative study of AFM and FESEM for imaging the single cell of Escherichia Coli bacteria,"K Ibrahim, MH Khalid, MH Eisa, MN Najimudin, MA Al Rajhi, H Idriss","Journal of Nano Research 34, 61-66",2015,https://scholar.google.com/scholar?oi=bibs&hl=en&cites=5615559369831347584,https://scholar.google.com/citations?view_op=view_citation&hl=en&user=1GiAGgwAAAAJ&pagesize=100&sortby=pubdate&citation_for_view=1GiAGgwAAAAJ:-f6ydRqryjwC
1GiAGgwAAAAJ,20,Comparison of aluminium thin film deposited on different polymer substrates with thermal evaporation for solar cell applications,"MG Faraj, K Ibrahim, MH Eisa, MA Alrajhi","Journal of Ovonic Research 10 (6), 231-235",2014,https://scholar.google.com/scholar?oi=bibs&hl=en&cites=2722476316653932895,https://scholar.google.com/citations?view_op=view_citation&hl=en&user=1GiAGgwAAAAJ&pagesize=100&sortby=pubdate&citation_for_view=1GiAGgwAAAAJ:u5HHmVD_uO8C
1GiAGgwAAAAJ,21,Study of some heavy metals and trace elements,MA Al-Rajhi,"Physics International 5 (2), 128-131",2014,https://scholar.google.com/scholar?oi=bibs&hl=en&cites=5204834338751763762,https://scholar.google.com/citations?view_op=view_citation&hl=en&user=1GiAGgwAAAAJ&pagesize=100&sortby=pubdate&citation_for_view=1GiAGgwAAAAJ:4DMP91E08xMC
1GiAGgwAAAAJ,22,Assessment of ambient magnetic field exposure emitted from underground transmission lines in some areas of Riyadh,MA AL-rajhi,"International Journal of Physics 2 (3), 76-77",2014,https://scholar.google.com/scholar?oi=bibs&hl=en&cites=424934118263775164,https://scholar.google.com/citations?view_op=view_citation&hl=en&user=1GiAGgwAAAAJ&pagesize=100&sortby=pubdate&citation_for_view=1GiAGgwAAAAJ:maZDTaKrznsC
1GiAGgwAAAAJ,23,Aluminum deposition on polymer substrate by DC sputtering and evaporation methods,"MG Faraj, K Ibrahim, MH Eisa, F Azhari, MA Alrajhi","Journal of Mechatronics 2 (3), 223-225",2014,https://scholar.google.com/scholar?oi=bibs&hl=en&cites=5521944238682980673,https://scholar.google.com/citations?view_op=view_citation&hl=en&user=1GiAGgwAAAAJ&pagesize=100&sortby=pubdate&citation_for_view=1GiAGgwAAAAJ:u-x6o8ySG0sC
1GiAGgwAAAAJ,24,Measurement of Different Types of Potato Chips by Inductively Coupled Plasma-Optical Emission Spectrometer,MA AL-rajhi,"Journal of Analytical Sciences, Methods and Instrumentation 2014",2014,https://scholar.google.com/scholar?oi=bibs&hl=en&cites=5918710269794990497,https://scholar.google.com/citations?view_op=view_citation&hl=en&user=1GiAGgwAAAAJ&pagesize=100&sortby=pubdate&citation_for_view=1GiAGgwAAAAJ:Wp0gIr-vW9MC
1GiAGgwAAAAJ,25,A radiation survey in an area suspected to be contaminated with a magnetic field from underground transmission cables,MA Al-Rajhi,"JKAU: Sci 26, 1",2014,https://scholar.google.com/scholar?oi=bibs&hl=en&cites=13196166109562108397,https://scholar.google.com/citations?view_op=view_citation&hl=en&user=1GiAGgwAAAAJ&pagesize=100&sortby=pubdate&citation_for_view=1GiAGgwAAAAJ:_kc_bZDykSQC
1GiAGgwAAAAJ,26,"General Approach to the Construction of Photon-Added SU(1,1) Coherent States",MA Alrajhi,"Journal of Russian Laser Research 35, 570-581",2014,https://scholar.google.com/scholar?oi=bibs&hl=en&cites=NA,""
1GiAGgwAAAAJ,27,Proton Induced X-ray Emission Study on the Content of Whale Tooth,"MH Eisa, H Shen, MA Alrajhi, H Idris","IOSR Journal of Applied Physics (IOSR-JAP) 6 (5), 35-39",2014,https://scholar.google.com/scholar?oi=bibs&hl=en&cites=NA,""
1GiAGgwAAAAJ,28,Study of the Electromagnetic Emission Generated from the Underground Cables between the Low-Tension Transformer and Residential Units. Problems and Solutions,MA Al-Rajhi,"Journal of King Abdulaziz University 26 (2), 51",2014,https://scholar.google.com/scholar?oi=bibs&hl=en&cites=NA,""
1GiAGgwAAAAJ,29,Derivation of Einstein Generalized Special Relativity Using Lorentz Transformation,"FM M D Abd Allah, K G Elgaylani, K M Harou, M H Eisa, M A Al Rajhi, A El-Tahir","International Journal of Science and Research (IJSR) 3 (6), 622-625",2014,https://scholar.google.com/scholar?oi=bibs&hl=en&cites=NA,""
1GiAGgwAAAAJ,30,Derivation of Einstein’s Energy Equation from Maxwell’s Electric Wave Equation,"KG Elgaylani, MDA Allah, KM Haroun, MH Eisa, MA Al Rajhi, A Eid","International Journal of Science and Research (IJSR) 3 (3), 666-690",2014,https://scholar.google.com/scholar?oi=bibs&hl=en&cites=NA,""
1GiAGgwAAAAJ,31,Proton Induced X-ray Emission Study on the Content of Whale Tooth,"HI M. H. Eisa , H. Shen , M. A. Alrajhi","IOSR Journal of Applied Physics (IOSR-JAP) 6 (5), 35-39",2014,https://scholar.google.com/scholar?oi=bibs&hl=en&cites=NA,""
1GiAGgwAAAAJ,32,Elemental monitoring of some selected sweets in Riyadh City,MA Al-Rajhi,"Journal of King Abdulaziz University 26 (1), 3",2014,https://scholar.google.com/scholar?oi=bibs&hl=en&cites=NA,""
1GiAGgwAAAAJ,33,Improving and Controlling Quantum Entanglement from Excited Barut–Girardello Coherent States via Unitary Beam Splitters,"K Berrada, MA Al-Rajhi","Journal of Russian Laser Research 34, 409-423",2013,https://scholar.google.com/scholar?oi=bibs&hl=en&cites=9180209420014221593,https://scholar.google.com/citations?view_op=view_citation&hl=en&user=1GiAGgwAAAAJ&pagesize=100&sortby=pubdate&citation_for_view=1GiAGgwAAAAJ:ULOm3_A8WrAC
1GiAGgwAAAAJ,34,Radiative Pollution by the Electric and Magnetic Fluxes Resulting from the Domestic and Offices Appliances,MAR Al-Rajhi,"Journal of Science King Abdulaziz University 20 (2), 1-2",2008,https://scholar.google.com/scholar?oi=bibs&hl=en&cites=12560028730057710213,https://scholar.google.com/citations?view_op=view_citation&hl=en&user=1GiAGgwAAAAJ&pagesize=100&sortby=pubdate&citation_for_view=1GiAGgwAAAAJ:TFP_iSt0sucC
1GiAGgwAAAAJ,35,Magnetic Field Irradiative Pollutions due to Technical Faults in the Internal Electrical Wiring in Buildings,MAAR Al-Rajhi,"Journal of Science 20 (2), 1-2",2008,https://scholar.google.com/scholar?oi=bibs&hl=en&cites=12268743582639681315,https://scholar.google.com/citations?view_op=view_citation&hl=en&user=1GiAGgwAAAAJ&pagesize=100&sortby=pubdate&citation_for_view=1GiAGgwAAAAJ:bEWYMUwI8FkC
1GiAGgwAAAAJ,36,Magnetic Field Pollutions due to Technical Faults in the Internal Electrical Wiring in Buildings Journal of King Abdulaziz University,MA AL-rajhi,"Science 20, 2",2008,https://scholar.google.com/scholar?oi=bibs&hl=en&cites=15176808275758452512,https://scholar.google.com/citations?view_op=view_citation&hl=en&user=1GiAGgwAAAAJ&pagesize=100&sortby=pubdate&citation_for_view=1GiAGgwAAAAJ:qxL8FJ1GzNcC
1GiAGgwAAAAJ,37,"Evaluation of the Risks of Very Low Frequency and Non-Ionizing Electromagnetic Radiations Emitted by Electric Current of 50/60 Hz, its Biological Effects, and Organizations of …",MA Al-Rajhi,Science 18 (1),2006,https://scholar.google.com/scholar?oi=bibs&hl=en&cites=16554135705743981886,https://scholar.google.com/citations?view_op=view_citation&hl=en&user=1GiAGgwAAAAJ&pagesize=100&sortby=pubdate&citation_for_view=1GiAGgwAAAAJ:3fE2CSJIrl8C
1GiAGgwAAAAJ,38,"Metal levels in indoor and outdoor dust in Riyadh, Saudi Arabia","MA Al-Rajhi, MRD Seaward, AS Al-Aamer","Environment international 22 (3), 315-324",1996,https://scholar.google.com/scholar?oi=bibs&hl=en&cites=17407855988552480923,https://scholar.google.com/citations?view_op=view_citation&hl=en&user=1GiAGgwAAAAJ&pagesize=100&sortby=pubdate&citation_for_view=1GiAGgwAAAAJ:MXK_kJrjxJIC
1GiAGgwAAAAJ,39,Particle size effect for metal pollution analysis of atmospherically deposited dust,"MA Al-Rajhi, SM Al-Shayeb, MRD Seaward, HGM Edwards","Atmospheric Environment 30 (1), 145-153",1996,https://scholar.google.com/scholar?oi=bibs&hl=en&cites=14481300548249967524,https://scholar.google.com/citations?view_op=view_citation&hl=en&user=1GiAGgwAAAAJ&pagesize=100&sortby=pubdate&citation_for_view=1GiAGgwAAAAJ:8k81kl-MbHgC
1GiAGgwAAAAJ,40,The date palm (Phoenix dactylifera L.) as a biomonitor of lead and other elements in arid environments,"SM Al-Shayeb, MA Al-Rajhi, MRD Seaward","Science of the Total Environment 168 (1), 1-10",1995,https://scholar.google.com/scholar?oi=bibs&hl=en&cites=15852923931660152451,https://scholar.google.com/citations?view_op=view_citation&hl=en&user=1GiAGgwAAAAJ&pagesize=100&sortby=pubdate&citation_for_view=1GiAGgwAAAAJ:5nxA0vEk-isC
1GiAGgwAAAAJ,41,FLSEVIER The Science of the Total Environment 168 (1995) 279,"MA Al-Rajhi, SM Al-Shayeb, DJ Allington, B Armstrong, G Akerblom, ...","The Science of the Total Environment 168, 279",1995,https://scholar.google.com/scholar?oi=bibs&hl=en&cites=NA,""
