Scholar ID,Paper Number,Paper Title,Authors,"Publication (journal name. volume, no. pages)",Year,Cited_by,Link
6SX0q70AAAAJ,1,Facile synthesis of carbon dots by the hydrothermal carbonization of avocado peels and evaluation of the photocatalytic property,"H Ferjani, S Abdalla, OA Oyewo, DC Onwudiwe","Inorganic Chemistry Communications 160, 111866",2024,https://scholar.google.com/scholar?oi=bibs&hl=en&cites=775627099479379638,https://scholar.google.com/citations?view_op=view_citation&hl=en&user=6SX0q70AAAAJ&pagesize=100&sortby=pubdate&citation_for_view=6SX0q70AAAAJ:QIV2ME_5wuYC
6SX0q70AAAAJ,2,Theoretical investigation of the conformational preference and spectroscopic analysis of cinnamoyl chloride and cinnamide,"F Fadl, S Abdalla, Y Umar, A Ishaq","Kuwait Journal of Science 51 (3), 100232",2024,https://scholar.google.com/scholar?oi=bibs&hl=en&cites=NA,""
6SX0q70AAAAJ,3,"Ab initio investigation of mechanical, electronic and optical properties in the orthorhombic CsPbI3 inorganic perovskite","A Alsaad, A Telfah, H Baaziz, T Ghellab, Z Charifi, S Abdalla, WN Mei, ...","Materials Science in Semiconductor Processing 177, 108375",2024,https://scholar.google.com/scholar?oi=bibs&hl=en&cites=NA,""
6SX0q70AAAAJ,4,Modeling a Graphene-Enhanced Surface Plasmon Resonance Sensor for Cancer Detection,"S Abdalla, H Ferjani, AM Alsaad, CJ Tavares, AD Telfah",Plasmonics 1-8,2024,https://scholar.google.com/scholar?oi=bibs&hl=en&cites=NA,""
6SX0q70AAAAJ,5,"Optical, electrical, and structural properties of polyethylene oxide/fullerene nanocomposite films","AD Telfah, S Abdalla, H Ferjani, CJ Tavares, J Etzkorn","Physica B: Condensed Matter 679, 415787",2024,https://scholar.google.com/scholar?oi=bibs&hl=en&cites=NA,""
6SX0q70AAAAJ,6,In silico and in vitro profiling of coumarins and flavonoids for anti-Alzheimer and antioxidant activity,"LY Osman, TA Awad, S Abdalla, MO El-Faki, A Ali, EF Fadul Alla","Pure and Applied Chemistry 96 (3), 327-339",2024,https://scholar.google.com/scholar?oi=bibs&hl=en&cites=NA,""
6SX0q70AAAAJ,7,"Tris (2-hydroxyethyl (Methyl) amino-dithiocarbamato) Indium (III): Structural Characterization, Optical Properties, and Thermal Stability Study for Optoelectronic Application","H Ferjani, Y Ben Smida, S Abdalla, DC Onwudiwe, EC Hosten",Journal of Inorganic and Organometallic Polymers and Materials 1-17,2024,https://scholar.google.com/scholar?oi=bibs&hl=en&cites=NA,""
6SX0q70AAAAJ,8,The impact of substitution of Diphenyl dialumene on molecular structure and energetic properties,"YU Salma Babikir, Sahar Abdalla, Wefag Mohamed","Indones. J.Chem 24 (2), 492-504",2024,https://scholar.google.com/scholar?oi=bibs&hl=en&cites=NA,""
6SX0q70AAAAJ,9,Spontaneous formation and protonation of dicyanofuran isomers under physical conditions found in interstellar space: quantum chemical insights into thermodynamics and spectroscopy,"R Simbizi, S Abdalla, T Bukuru, PC Mpawenayo, M Nihorimbere, ...","New Journal of Chemistry 48 (12), 5487-5494",2024,https://scholar.google.com/scholar?oi=bibs&hl=en&cites=NA,""
6SX0q70AAAAJ,10,"Structural characterization, Hirshfeld surface analysis, optical properties, and DFT study of a new copper (II) complex","H Ferjani, YB Smida, S Abdalla, DC Onwudiwe, E Hosten","Inorganic Chemistry Communications 157, 111314",2023,https://scholar.google.com/scholar?oi=bibs&hl=en&cites=2568826708307504601,https://scholar.google.com/citations?view_op=view_citation&hl=en&user=6SX0q70AAAAJ&pagesize=100&sortby=pubdate&citation_for_view=6SX0q70AAAAJ:mVmsd5A6BfQC
6SX0q70AAAAJ,11,"Molecular Structure, Conformational Preference and Vibrational Spectral Analysis of 2-, and 3-Furancarboselenaldehyde Using DFT","S Ahmed, S Abdalla, A Ishaq, Y Umar","Egyptian Journal of Chemistry 66 (8), 1-12",2023,https://scholar.google.com/scholar?oi=bibs&hl=en&cites=NA,""
6SX0q70AAAAJ,12,A DFT and TD-DFT study on emodin and purpurin and their functionalized molecules to produce promising organic semiconductor materials,"Z Ali, S Abdalla, EA Hassan, Y Umar, MM Al-Mogren","Journal of King Saud University-Science 34 (5), 102117",2022,https://scholar.google.com/scholar?oi=bibs&hl=en&cites=6881762122596547943,https://scholar.google.com/citations?view_op=view_citation&hl=en&user=6SX0q70AAAAJ&pagesize=100&sortby=pubdate&citation_for_view=6SX0q70AAAAJ:YOwf2qJgpHMC
6SX0q70AAAAJ,13,Theoretical study of electronic and optical properties of functionalized Indigo and Alizarin as potential organic semi-conductors for solar cells applications,"Z Ali, S Abdalla, EA Hassan, Y Umar, MM Al-Mogren","Materials Today Communications 32, 104048",2022,https://scholar.google.com/scholar?oi=bibs&hl=en&cites=10665073206422521559,https://scholar.google.com/citations?view_op=view_citation&hl=en&user=6SX0q70AAAAJ&pagesize=100&sortby=pubdate&citation_for_view=6SX0q70AAAAJ:4TOpqqG69KYC
6SX0q70AAAAJ,14,Phytochemicals and in silico investigations of Sudanese roselle,"A El-Naeem, S Abdalla, I Ahmed, G Alhassan","South African Journal of Science 118 (1-2), 1-7",2022,https://scholar.google.com/scholar?oi=bibs&hl=en&cites=8122407213853574605,https://scholar.google.com/citations?view_op=view_citation&hl=en&user=6SX0q70AAAAJ&pagesize=100&sortby=pubdate&citation_for_view=6SX0q70AAAAJ:KlAtU1dfN6UC
6SX0q70AAAAJ,15,"DFT study of the molecular structure, conformational preference, spectroscopic and vibrational analysis of cinnamic acid and cinnamaldehyde","F Fadl, S Abdalla, A Ishaq, Y Umar","Journal of the Mexican Chemical Society 66 (4), 543-559",2022,https://scholar.google.com/scholar?oi=bibs&hl=en&cites=8963911244645361852,https://scholar.google.com/citations?view_op=view_citation&hl=en&user=6SX0q70AAAAJ&pagesize=100&sortby=pubdate&citation_for_view=6SX0q70AAAAJ:qxL8FJ1GzNcC
6SX0q70AAAAJ,16,"DFT study of the structure, conformational profile and the vibrational analysis of 2-furancarbothialdehyde and 3-furancarbothialdehyde","S Ahmed, S Abdalla, A Ishaq, Y Umar","Journal of Structural Chemistry 62, 1485-1497",2021,https://scholar.google.com/scholar?oi=bibs&hl=en&cites=NA,""
6SX0q70AAAAJ,17,"Theoretical investigation of the molecular structure, vibrational spectra, and molecular docking of tramadol using density functional theory","Y Umar, S Abdalla, SKM Haque, GS Moran, A Ishaq, WC Villada, ...","Journal of the Chinese Chemical Society 67 (1), 62-71",2020,https://scholar.google.com/scholar?oi=bibs&hl=en&cites=15022082318657750836,https://scholar.google.com/citations?view_op=view_citation&hl=en&user=6SX0q70AAAAJ&pagesize=100&sortby=pubdate&citation_for_view=6SX0q70AAAAJ:Se3iqnhoufwC
6SX0q70AAAAJ,18,"Quasiparticle and Optical Properties of Hydrogen Titanate and Its Defective Systems: An Investigation by Density Functional Theory with Hubbard Correction, Many‐Body …","W Elsayed, S Abdalla, N Seriani","physica status solidi (b) 257 (3), 1900054",2020,https://scholar.google.com/scholar?oi=bibs&hl=en&cites=9187920265874225677,https://scholar.google.com/citations?view_op=view_citation&hl=en&user=6SX0q70AAAAJ&pagesize=100&sortby=pubdate&citation_for_view=6SX0q70AAAAJ:hqOjcs7Dif8C
6SX0q70AAAAJ,19,The impact of functionalization of organic semiconductors by electron donating groups on the reorganization energy,"R Oshi, S Abdalla, M Springborg","The European Physical Journal D 73, 1-8",2019,https://scholar.google.com/scholar?oi=bibs&hl=en&cites=3520393997217650049,https://scholar.google.com/citations?view_op=view_citation&hl=en&user=6SX0q70AAAAJ&pagesize=100&sortby=pubdate&citation_for_view=6SX0q70AAAAJ:roLk4NBRz8UC
6SX0q70AAAAJ,20,"Conformational stabilities, rotational barriers, and vibrational spectra of 2-pyrrolecarboxaldehyde and 3-pyrrolecarboxaldehyde calculated using density functional theory","Y Umar, J Tijani, S Abdalla","Journal of Structural Chemistry 60, 186-197",2019,https://scholar.google.com/scholar?oi=bibs&hl=en&cites=3318153705201386414,https://scholar.google.com/citations?view_op=view_citation&hl=en&user=6SX0q70AAAAJ&pagesize=100&sortby=pubdate&citation_for_view=6SX0q70AAAAJ:LkGwnXOMwfcC
6SX0q70AAAAJ,21,Theoretical study on functionalized anthracene and tetraceneas starting species to produce promising semiconductor materials,"R Oshi, S Abdalla, M Springborg","Computational and Theoretical Chemistry 1128, 60-69",2018,https://scholar.google.com/scholar?oi=bibs&hl=en&cites=14078196723287088797,https://scholar.google.com/citations?view_op=view_citation&hl=en&user=6SX0q70AAAAJ&pagesize=100&sortby=pubdate&citation_for_view=6SX0q70AAAAJ:eQOLeE2rZwMC
6SX0q70AAAAJ,22,"Theoretical Study of Mono-terminal Functionalized Oligo Acetylene [CnHn+ 2X](n= 3-5, X=-COOH, and-PO3H2) in Gas and Aqueous Phases","N Edres, S Abdalla, Y Umar","Current Physical Chemistry 8 (2), 95-108",2018,https://scholar.google.com/scholar?oi=bibs&hl=en&cites=NA,""
6SX0q70AAAAJ,23,"Theoretical Study of Mono-terminal Functionalized Oligo  Acetylene [CnHn+2X] (n=3-5, X= - COOH, and - PO3H2) in Gas and  Aqueous Phase",SAYU Nada Edres,current physical chemistry 8 (2),2018,https://scholar.google.com/scholar?oi=bibs&hl=en&cites=NA,""
6SX0q70AAAAJ,24,"A DFT STUDY OF THE EFFECT OF HALOGENATION ON THE CONFORMATION OF 1, 4-DITHIIN AND ITS S-OXIDE DERIVATIVES","AA Radwan, S Abdalla, Y Umar","Rev. Roum. Chim 63 (4), 293-298",2018,https://scholar.google.com/scholar?oi=bibs&hl=en&cites=NA,""
6SX0q70AAAAJ,25,"DFT study of the molecular structure, conformational preference, HOMO, LUMO, and vibrational analysis of 2-, and 3-furoyl chloride","Y Umar, S Abdalla","Journal of Solution Chemistry 46, 741-758",2017,https://scholar.google.com/scholar?oi=bibs&hl=en&cites=10467595317167649763,https://scholar.google.com/citations?view_op=view_citation&hl=en&user=6SX0q70AAAAJ&pagesize=100&sortby=pubdate&citation_for_view=6SX0q70AAAAJ:YsMSGLbcyi4C
6SX0q70AAAAJ,26,Study of the influence of functionalization on the reorganization energy of naphthalene using DFT,"R Oshi, S Abdalla, M Springborg","Computational and Theoretical Chemistry 1099, 209-215",2017,https://scholar.google.com/scholar?oi=bibs&hl=en&cites=5644736844614147614,https://scholar.google.com/citations?view_op=view_citation&hl=en&user=6SX0q70AAAAJ&pagesize=100&sortby=pubdate&citation_for_view=6SX0q70AAAAJ:Y0pCki6q_DkC
6SX0q70AAAAJ,27,"Conformational and vibrational analysis of 2-, 3-and 4-pyridinecarbonyl chloride using DFT","S Abdalla, Y Umar, I Mokhtar","Zeitschrift für Physikalische Chemie 230 (5-7), 867-882",2016,https://scholar.google.com/scholar?oi=bibs&hl=en&cites=11144012118121611538,https://scholar.google.com/citations?view_op=view_citation&hl=en&user=6SX0q70AAAAJ&pagesize=100&sortby=pubdate&citation_for_view=6SX0q70AAAAJ:UeHWp8X0CEIC
6SX0q70AAAAJ,28,Density functional theory studies of conformational stabilities and rotational barriers of 2-and 3-thiophenecarboxaldehydes,"Y Umar, J Tijani, S Abdalla","Journal of Structural Chemistry 57, 1545-1553",2016,https://scholar.google.com/scholar?oi=bibs&hl=en&cites=12926290661346733814,https://scholar.google.com/citations?view_op=view_citation&hl=en&user=6SX0q70AAAAJ&pagesize=100&sortby=pubdate&citation_for_view=6SX0q70AAAAJ:W7OEmFMy1HYC
6SX0q70AAAAJ,29,Analyzing Interaction Energy of Polycyclic Aromatic Hydrocarbons (PAH) Dimers,"S Abdalla, RF Fink",Crystallizing Ideas–The Role of Chemistry 113-126,2016,https://scholar.google.com/scholar?oi=bibs&hl=en&cites=1686122857214423685,https://scholar.google.com/citations?view_op=view_citation&hl=en&user=6SX0q70AAAAJ&pagesize=100&sortby=pubdate&citation_for_view=6SX0q70AAAAJ:Tyk-4Ss8FVUC
6SX0q70AAAAJ,30,Experimental FTIR and Theoretical Investigation of the Molecular Sturcture and Vibrational Spectra of Terephthaloyl Chloride by Density Functional Theory,"Y Umar, S Abdalla","IOSR Journal of Applied Chemistry (IOSR-JAC) 8 (9), 26-34",2015,https://scholar.google.com/scholar?oi=bibs&hl=en&cites=1159160790368800572,https://scholar.google.com/citations?view_op=view_citation&hl=en&user=6SX0q70AAAAJ&pagesize=100&sortby=pubdate&citation_for_view=6SX0q70AAAAJ:qjMakFHDy7sC
6SX0q70AAAAJ,31,Isolated and deposited potassium clusters: energetic and structural properties,"S Abdalla, M Springborg, Y Dong","Surface science 608, 255-264",2013,https://scholar.google.com/scholar?oi=bibs&hl=en&cites=12144488236837193771,https://scholar.google.com/citations?view_op=view_citation&hl=en&user=6SX0q70AAAAJ&pagesize=100&sortby=pubdate&citation_for_view=6SX0q70AAAAJ:d1gkVwhDpl0C
6SX0q70AAAAJ,32,A DFT study of the properties of substituted pyrrolidines and phospholanes in gas and in aqueous phase,"S Abdalla, M Springborg","Computational and Theoretical Chemistry 978 (1-3), 143-151",2011,https://scholar.google.com/scholar?oi=bibs&hl=en&cites=17420043265273423144,https://scholar.google.com/citations?view_op=view_citation&hl=en&user=6SX0q70AAAAJ&pagesize=100&sortby=pubdate&citation_for_view=6SX0q70AAAAJ:9yKSN-GCB0IC
6SX0q70AAAAJ,33,"Theoretical study of the effects of solvation, substitution, and structure on the properties of imidazolines, oxazolines, and thiazolines","S Abdalla, M Springborg","The Journal of Physical Chemistry A 114 (18), 5823-5829",2010,https://scholar.google.com/scholar?oi=bibs&hl=en&cites=9639717775224503666,https://scholar.google.com/citations?view_op=view_citation&hl=en&user=6SX0q70AAAAJ&pagesize=100&sortby=pubdate&citation_for_view=6SX0q70AAAAJ:u5HHmVD_uO8C
6SX0q70AAAAJ,34,"Theoretical study of tautomerization and isomerization of methylamino-and phenylamino-substituted cyclic azaphospholines, oxaphospholines and thiaphospholines in gas and …","S Abdalla, M Springborg","Journal of Molecular Structure: THEOCHEM 962 (1-3), 101-107",2010,https://scholar.google.com/scholar?oi=bibs&hl=en&cites=9719517076248459717,https://scholar.google.com/citations?view_op=view_citation&hl=en&user=6SX0q70AAAAJ&pagesize=100&sortby=pubdate&citation_for_view=6SX0q70AAAAJ:u-x6o8ySG0sC
