Scholar ID,Paper Number,Paper Title,Authors,"Publication (journal name. volume, no. pages)",Year,Cited_by,Link
mwyKeMsAAAAJ,1,EXISTENCE OF CLASSICAL SOLUTIONS FOR BROER-KAUP EQUATIONS,"D BOURENI, SG GEORGIEV, A KHELOUFI, K MEBARKI","Kragujevac Journal of Mathematics 49 (1), 125-140",2025,https://scholar.google.com/scholar?oi=bibs&hl=en&cites=NA,""
mwyKeMsAAAAJ,2,On singular φ-Laplacian BVPs of nonlinear fractional differential equation.,"B Temar, O Saifi, S Djebali","Studia Universitatis Babes-Bolyai, Mathematica 69 (1)",2024,https://scholar.google.com/scholar?oi=bibs&hl=en&cites=NA,""
mwyKeMsAAAAJ,3,System of fractional boundary value problems at resonance,"K Iatime, L Guedda, S Djebali","Fractional Calculus and Applied Analysis 26 (3), 1359-1383",2023,https://scholar.google.com/scholar?oi=bibs&hl=en&cites=3052766285104709928,https://scholar.google.com/citations?view_op=view_citation&hl=en&user=mwyKeMsAAAAJ&pagesize=100&sortby=pubdate&citation_for_view=mwyKeMsAAAAJ:WA5NYHcadZ8C
mwyKeMsAAAAJ,4,On the fixed point index for sums of operators,"S Benslimane, S Djebali, K Mebarki","Fixed Point Theory 23 (1), 143-162",2022,https://scholar.google.com/scholar?oi=bibs&hl=en&cites=5439208177540114662,https://scholar.google.com/citations?view_op=view_citation&hl=en&user=mwyKeMsAAAAJ&pagesize=100&sortby=pubdate&citation_for_view=mwyKeMsAAAAJ:J-pR_7NvFogC
mwyKeMsAAAAJ,5,A Measure of Weak Noncompactness in  and Applications,"B Boulfoul, S Djebali","Mediterranean Journal of Mathematics 19 (2), 64",2022,https://scholar.google.com/scholar?oi=bibs&hl=en&cites=9290405196943987552,https://scholar.google.com/citations?view_op=view_citation&hl=en&user=mwyKeMsAAAAJ&pagesize=100&sortby=pubdate&citation_for_view=mwyKeMsAAAAJ:1qzjygNMrQYC
mwyKeMsAAAAJ,6,Multiple solutions for a nonlocal fractional boundary value problem with fractional integral conditions on infinite interval,"AG Aoun, S Djebali","Asian-European Journal of Mathematics 15 (06), 2250118",2022,https://scholar.google.com/scholar?oi=bibs&hl=en&cites=4002584016805160365,https://scholar.google.com/citations?view_op=view_citation&hl=en&user=mwyKeMsAAAAJ&pagesize=100&sortby=pubdate&citation_for_view=mwyKeMsAAAAJ:eJXPG6dFmWUC
mwyKeMsAAAAJ,7,A system of nonlinear fractional BVPs with ϕ-Laplacian operators and nonlocal conditions,"B Temar, O Saif, S Djebali","Proyecciones (Antofagasta) 40 (2), 447-479",2021,https://scholar.google.com/scholar?oi=bibs&hl=en&cites=9494939745572230274,https://scholar.google.com/citations?view_op=view_citation&hl=en&user=mwyKeMsAAAAJ&pagesize=100&sortby=pubdate&citation_for_view=mwyKeMsAAAAJ:tOudhMTPpwUC
mwyKeMsAAAAJ,8,Coincidence and Common Fixed Point Theorems in Gb-Cone Metric Spaces,"S Benchabane, S Djebali","European Journal of Pure and Applied Mathematics 14 (4), 1350-1366",2021,https://scholar.google.com/scholar?oi=bibs&hl=en&cites=NA,""
mwyKeMsAAAAJ,9,"Common Fixed Point for A Sequence of Multivalued (G, Θ)-Prešić Type Maps in Symmetric Spaces Endowed with a Graph","S Benchabane, S Djebali","Jordan Journal of Mathematics and Statistics (JJMS) 14 (3), 437-452",2021,https://scholar.google.com/scholar?oi=bibs&hl=en&cites=NA,""
mwyKeMsAAAAJ,10,Fixed point theorems for the sum of nonlinear operators and applications,"MAT A. Aouane, S. Djebali","Pan-American Mathematical Journal 31 (1), 53-72",2021,https://scholar.google.com/scholar?oi=bibs&hl=en&cites=NA,""
mwyKeMsAAAAJ,11,On a singular multi-point third-order boundary value problem on the half-line,"Z Benbaziz, S Djebali","Mathematica Bohemica 145 (3), 305 - 324",2020,https://scholar.google.com/scholar?oi=bibs&hl=en&cites=6834692871540546322,https://scholar.google.com/citations?view_op=view_citation&hl=en&user=mwyKeMsAAAAJ&pagesize=100&sortby=pubdate&citation_for_view=mwyKeMsAAAAJ:tS2w5q8j5-wC
mwyKeMsAAAAJ,12,Mild solutions of a class of semilinear fractional integro-differential equations subjected to noncompact nonlocal initial conditions,"A Aouane, S Djebali, MA Taoudi","Cubo (Temuco) 22 (3), 361-377",2020,https://scholar.google.com/scholar?oi=bibs&hl=en&cites=15209430827759901330,https://scholar.google.com/citations?view_op=view_citation&hl=en&user=mwyKeMsAAAAJ&pagesize=100&sortby=pubdate&citation_for_view=mwyKeMsAAAAJ:WbkHhVStYXYC
mwyKeMsAAAAJ,13,Common Fixed Point Results for Set-valued Integral Type Contractions on Metric Spaces with Directed Graph,"S Benchabane, S Djebali, T Nazir","European Journal of Pure and Applied Mathematics 13 (5), 1072-1087",2020,https://scholar.google.com/scholar?oi=bibs&hl=en&cites=NA,""
mwyKeMsAAAAJ,14,Asymptotic behavior of solutions for systems of quadratic integral equations of Fredholm type,"L Benhamouche, S Djebali, J Garcia-Falset","Banach Journal of Mathematical Analysis 14 (2), 313-335",2020,https://scholar.google.com/scholar?oi=bibs&hl=en&cites=NA,""
mwyKeMsAAAAJ,15,Existence result for some fractional  multipoint boundary value problems at resonance with dimension kernel greater than one,"S Djebali, L Guedda",Mathematical Methods in the Applied Sciences 1 - 16,2020,https://scholar.google.com/scholar?oi=bibs&hl=en&cites=NA,""
mwyKeMsAAAAJ,16,Fixed point theorems for multi-valued 1-set contractions in Banach spaces,"Z Bounegab, S Djebali","Communications on Applied Nonlinear Analysis 27 (2), 45 - 66",2020,https://scholar.google.com/scholar?oi=bibs&hl=en&cites=NA,""
mwyKeMsAAAAJ,17,Fixed point index for expansive perturbation of k-set contraction mappings,"S Djebali, K Mebarki","Top. Meth. Nonli. Anal 54 (2), 613-640",2019,https://scholar.google.com/scholar?oi=bibs&hl=en&cites=8283599544594976900,https://scholar.google.com/citations?view_op=view_citation&hl=en&user=mwyKeMsAAAAJ&pagesize=100&sortby=pubdate&citation_for_view=mwyKeMsAAAAJ:LPZeul_q3PIC
mwyKeMsAAAAJ,18,"Resonant fractional differential equations with multi-point boundary conditions on (0,∞)","S Djebali, AG Aoun","J. Nonlinear Funct. Anal 2019, 1-15",2019,https://scholar.google.com/scholar?oi=bibs&hl=en&cites=15993301566197153417,https://scholar.google.com/citations?view_op=view_citation&hl=en&user=mwyKeMsAAAAJ&pagesize=100&sortby=pubdate&citation_for_view=mwyKeMsAAAAJ:1sJd4Hv_s6UC
mwyKeMsAAAAJ,19,"Common Fixed Point For Multivalued (ψ, θ, G)-Contraction Type Maps In Metric Spaces With A Graph Structure","S Benchabane, S Djebali","Applied Mathematics E-Notes 19, 515-526",2019,https://scholar.google.com/scholar?oi=bibs&hl=en&cites=234214713019807616,https://scholar.google.com/citations?view_op=view_citation&hl=en&user=mwyKeMsAAAAJ&pagesize=100&sortby=pubdate&citation_for_view=mwyKeMsAAAAJ:P5F9QuxV20EC
mwyKeMsAAAAJ,20,Functional quadratic integral equations in l 1,"L Benhamouche, S Djebali","Electronic Journal of Mathematical Analysis and Applications 7 (2), 79-88",2019,https://scholar.google.com/scholar?oi=bibs&hl=en&cites=594543049465930306,https://scholar.google.com/citations?view_op=view_citation&hl=en&user=mwyKeMsAAAAJ&pagesize=100&sortby=pubdate&citation_for_view=mwyKeMsAAAAJ:xtRiw3GOFMkC
mwyKeMsAAAAJ,21,Fixed Point Theorems for Multi-valued Nonexpansive Mappings in Banach Spaces,"Z Bounegab, S Djebali","Mediterranean Journal of Mathematics 16 (2), 49",2019,https://scholar.google.com/scholar?oi=bibs&hl=en&cites=906305641453778000,https://scholar.google.com/citations?view_op=view_citation&hl=en&user=mwyKeMsAAAAJ&pagesize=100&sortby=pubdate&citation_for_view=mwyKeMsAAAAJ:NhqRSupF_l8C
mwyKeMsAAAAJ,22,Ran and reurings in a generalized metric space with a graph structure,"M Alfuraidan, S Benchabane, S Djebali","Journal of Nonlinear and Convex Analysis 20 (11), 2269-2279",2019,https://scholar.google.com/scholar?oi=bibs&hl=en&cites=10271175862976225185,https://scholar.google.com/citations?view_op=view_citation&hl=en&user=mwyKeMsAAAAJ&pagesize=100&sortby=pubdate&citation_for_view=mwyKeMsAAAAJ:OU6Ihb5iCvQC
mwyKeMsAAAAJ,23,Common fixed point results for set-valued integral type rational contractions on semi-metric spaces with directed graph,"S Benchabane, S Djebali, T Nazir","Canadian Journal of Applied Mathematics 1 (1), 15-31",2019,https://scholar.google.com/scholar?oi=bibs&hl=en&cites=17634971876057105259,https://scholar.google.com/citations?view_op=view_citation&hl=en&user=mwyKeMsAAAAJ&pagesize=100&sortby=pubdate&citation_for_view=mwyKeMsAAAAJ:UxriW0iASnsC
mwyKeMsAAAAJ,24,Fixed point theory for sums of operators,"S Djebali, K Mebarki","Journal of Nonlinear and Convex Analysis 19 (6), 1029-1040",2018,https://scholar.google.com/scholar?oi=bibs&hl=en&cites=80315837858992612,https://scholar.google.com/citations?view_op=view_citation&hl=en&user=mwyKeMsAAAAJ&pagesize=100&sortby=pubdate&citation_for_view=mwyKeMsAAAAJ:u9iWguZQMMsC
mwyKeMsAAAAJ,25,Coincidence points for multivalued weak Γ-contraction mappings on metric spaces,"MR Alfuraidan, S Benchabane, S Djebali","Carpathian Journal of Mathematics 34 (3), 277-286",2018,https://scholar.google.com/scholar?oi=bibs&hl=en&cites=6377844698336707318,https://scholar.google.com/citations?view_op=view_citation&hl=en&user=mwyKeMsAAAAJ&pagesize=100&sortby=pubdate&citation_for_view=mwyKeMsAAAAJ:D03iK_w7-QYC
mwyKeMsAAAAJ,26,On quadratic integral equations of Volterra type in Fréchet spaces,"L Benhamouche, S Djebali","Malaya Journal of Matematik 6 (04), 744-750",2018,https://scholar.google.com/scholar?oi=bibs&hl=en&cites=NA,""
mwyKeMsAAAAJ,27,A third order boundary value problem with nonlinear growth at resonance on the half‐axis,"S Djebali, L Guedda","Mathematical Methods in the Applied Sciences 40 (8), 2859-2871",2017,https://scholar.google.com/scholar?oi=bibs&hl=en&cites=7381360915367107902,https://scholar.google.com/citations?view_op=view_citation&hl=en&user=mwyKeMsAAAAJ&pagesize=100&sortby=pubdate&citation_for_view=mwyKeMsAAAAJ:35N4QoGY0k4C
mwyKeMsAAAAJ,28,Positive solutions to semi-positone fourth-order -Laplacian BVPs,"K Bachouche, A Benmezai, S Djebali","Positivity 21 (1), 193-212",2017,https://scholar.google.com/scholar?oi=bibs&hl=en&cites=6046099804343439552,https://scholar.google.com/citations?view_op=view_citation&hl=en&user=mwyKeMsAAAAJ&pagesize=100&sortby=pubdate&citation_for_view=mwyKeMsAAAAJ:J_g5lzvAfSwC
mwyKeMsAAAAJ,29,FIXED POINT THEOREMS FOR COMPACT POTENTIAL OPERATORS IN HILBERT SPACES.,"A Boucenna, S Djebali",Fixed Point Theory 18 (2),2017,https://scholar.google.com/scholar?oi=bibs&hl=en&cites=8187405466574657005,https://scholar.google.com/citations?view_op=view_citation&hl=en&user=mwyKeMsAAAAJ&pagesize=100&sortby=pubdate&citation_for_view=mwyKeMsAAAAJ:dfsIfKJdRG4C
mwyKeMsAAAAJ,30,Solvability of an impulsive boundary value problem on the half-line via critical point theory,"M Briki, S Djebali, T Moussaoui","Bulletin of the Iranian Mathematical Society 43 (3), 601-615",2017,https://scholar.google.com/scholar?oi=bibs&hl=en&cites=259184942684089095,https://scholar.google.com/citations?view_op=view_citation&hl=en&user=mwyKeMsAAAAJ&pagesize=100&sortby=pubdate&citation_for_view=mwyKeMsAAAAJ:M05iB0D1s5AC
mwyKeMsAAAAJ,31,Krasnosel’skii type fixed point theorems in ordered Banach spaces,"A Boucenna, S Djebali, T Moussaoui","Afrika Matematika 28 (7), 1115-1129",2017,https://scholar.google.com/scholar?oi=bibs&hl=en&cites=NA,""
mwyKeMsAAAAJ,32,Solvability of Functional Integral Equations in the Fréchet Space ,"L Benhamouche, S Djebali","Mediterranean Journal of Mathematics 13 (6), 4805-4817",2016,https://scholar.google.com/scholar?oi=bibs&hl=en&cites=81628589980881080,https://scholar.google.com/citations?view_op=view_citation&hl=en&user=mwyKeMsAAAAJ&pagesize=100&sortby=pubdate&citation_for_view=mwyKeMsAAAAJ:lSLTfruPkqcC
mwyKeMsAAAAJ,33,Singular -Laplacian third-order BVPs with derivative dependance,"S Djebali, O Saifi","Archivum Mathematicum 52 (1), 35-48",2016,https://scholar.google.com/scholar?oi=bibs&hl=en&cites=6394523027420578020,https://scholar.google.com/citations?view_op=view_citation&hl=en&user=mwyKeMsAAAAJ&pagesize=100&sortby=pubdate&citation_for_view=mwyKeMsAAAAJ:RGFaLdJalmkC
mwyKeMsAAAAJ,34,Semi-positone Sturm-Liouville differential systems on unbounded intervals,"S Djebali, K Mebarki","Acta Mathematica Universitatis Comenianae 85 (2), 231-259",2016,https://scholar.google.com/scholar?oi=bibs&hl=en&cites=4061447525716431764,https://scholar.google.com/citations?view_op=view_citation&hl=en&user=mwyKeMsAAAAJ&pagesize=100&sortby=pubdate&citation_for_view=mwyKeMsAAAAJ:NaGl4SEjCO4C
mwyKeMsAAAAJ,35,Systems of ϕ-Laplacian Three-Point Boundary-Value Problems on the Positive Half Line,"S Djebali, K Mebarki","Ukrainian Mathematical Journal 67 (12), 1838-1863",2016,https://scholar.google.com/scholar?oi=bibs&hl=en&cites=16591710448262636662,https://scholar.google.com/citations?view_op=view_citation&hl=en&user=mwyKeMsAAAAJ&pagesize=100&sortby=pubdate&citation_for_view=mwyKeMsAAAAJ:RYcK_YlVTxYC
mwyKeMsAAAAJ,36,The Cone Compression And Expansion Fixed Point Theorem With Convex And a-Homogeneous Boundary Operators,"A Boucenna, S Djebali, T Moussaoui","Applied Mathematics E-Notes 16, 222-230",2016,https://scholar.google.com/scholar?oi=bibs&hl=en&cites=16387245328738970584,https://scholar.google.com/citations?view_op=view_citation&hl=en&user=mwyKeMsAAAAJ&pagesize=100&sortby=pubdate&citation_for_view=mwyKeMsAAAAJ:70eg2SAEIzsC
mwyKeMsAAAAJ,37,Resonant Riemann-Liouville fractional differential equations with periodic boundary conditions,"S Djebali, L Guedda","Buletinul Academiei de Ştiinţe a Republicii Moldova. Matematica 82 (3), 24-37",2016,https://scholar.google.com/scholar?oi=bibs&hl=en&cites=10381369937870626067,https://scholar.google.com/citations?view_op=view_citation&hl=en&user=mwyKeMsAAAAJ&pagesize=100&sortby=pubdate&citation_for_view=mwyKeMsAAAAJ:rO6llkc54NcC
mwyKeMsAAAAJ,38,Approximate viability for nonlinear evolution inclusions with application to controllability,"O Benniche, O Cârja, S Djebali","Ann. Acad. Rom. Sci 8, 96-112",2016,https://scholar.google.com/scholar?oi=bibs&hl=en&cites=16419706201103687629,https://scholar.google.com/citations?view_op=view_citation&hl=en&user=mwyKeMsAAAAJ&pagesize=100&sortby=pubdate&citation_for_view=mwyKeMsAAAAJ:_xSYboBqXhAC
mwyKeMsAAAAJ,39,Singular semi-positone φ-Laplacian BVP on infinite interval in Banach spaces,"S Djebali, K Mebarki","Dynamic Systems and Applications 25 (1-2), 197-218",2016,https://scholar.google.com/scholar?oi=bibs&hl=en&cites=8284127083925569769,https://scholar.google.com/citations?view_op=view_citation&hl=en&user=mwyKeMsAAAAJ&pagesize=100&sortby=pubdate&citation_for_view=mwyKeMsAAAAJ:vV6vV6tmYwMC
mwyKeMsAAAAJ,40,Multiple solutions for a BVP on  via Morse theory and  versus  local minimizers,"K Ait-Mahiout, S Djebali, T Moussaoui","Arabian Journal of Mathematics 5, 9-22",2016,https://scholar.google.com/scholar?oi=bibs&hl=en&cites=5804419845739766157,https://scholar.google.com/citations?view_op=view_citation&hl=en&user=mwyKeMsAAAAJ&pagesize=100&sortby=pubdate&citation_for_view=mwyKeMsAAAAJ:YFjsv_pBGBYC
mwyKeMsAAAAJ,41,Boundary Conditions for 1-Set Contractions Maps in Banach Spaces,"S Djebali, K Hammache","Mediterranean Journal of Mathematics 13, 1997-2010",2016,https://scholar.google.com/scholar?oi=bibs&hl=en&cites=NA,""
mwyKeMsAAAAJ,42,Fixed point theorems for 1-set contractions in Banach spaces,"S Djebali, K Hammache","Fixed Point Theory 16 (2), 285-302",2015,https://scholar.google.com/scholar?oi=bibs&hl=en&cites=7665398230102599786,https://scholar.google.com/citations?view_op=view_citation&hl=en&user=mwyKeMsAAAAJ&pagesize=100&sortby=pubdate&citation_for_view=mwyKeMsAAAAJ:ns9cj8rnVeAC
mwyKeMsAAAAJ,43,Systems of φ-Laplacian three-point boundary-value problems on the positive half-line,"S Djebali, K Mebarki","Ukrains’ kyi Matematychnyi Zhurnal 67 (12), 1626-1648",2015,https://scholar.google.com/scholar?oi=bibs&hl=en&cites=NA,""
mwyKeMsAAAAJ,44,Fixed point index on translates of cones and applications.,"S Djebali, K Mebarki",Nonlinear Studies 21 (4),2014,https://scholar.google.com/scholar?oi=bibs&hl=en&cites=15848011810335807578,https://scholar.google.com/citations?view_op=view_citation&hl=en&user=mwyKeMsAAAAJ&pagesize=100&sortby=pubdate&citation_for_view=mwyKeMsAAAAJ:blknAaTinKkC
mwyKeMsAAAAJ,45,Upper and lower solutions for φ-laplacian third-order bvps on the half line,"S Djebali, O Saifi","Cubo (Temuco) 16 (1), 105-116",2014,https://scholar.google.com/scholar?oi=bibs&hl=en&cites=4331335174509970811,https://scholar.google.com/citations?view_op=view_citation&hl=en&user=mwyKeMsAAAAJ&pagesize=100&sortby=pubdate&citation_for_view=mwyKeMsAAAAJ:M3NEmzRMIkIC
mwyKeMsAAAAJ,46,Existence Results for Singular Boundary Value Problems on Unbounded Domains in Banach Spaces,"S Djebali, F Madjidi, K Mebarki","Mediterranean Journal of Mathematics 11 (1), 45-74",2014,https://scholar.google.com/scholar?oi=bibs&hl=en&cites=4499329258217457001,https://scholar.google.com/citations?view_op=view_citation&hl=en&user=mwyKeMsAAAAJ&pagesize=100&sortby=pubdate&citation_for_view=mwyKeMsAAAAJ:k_IJM867U9cC
mwyKeMsAAAAJ,47,Boundary conditions for 1-set contractions,"S Djebali, K Hammache","Filomat 28 (5), 1059-1069",2014,https://scholar.google.com/scholar?oi=bibs&hl=en&cites=NA,""
mwyKeMsAAAAJ,48,Singular boundary value problems with variable coefficients on the positive half-line,"S Djebali, O Saifi, S Zahar","Electron. J. Differential Equations 73 (2013), 1-18",2013,https://scholar.google.com/scholar?oi=bibs&hl=en&cites=15426459094168531332,https://scholar.google.com/citations?view_op=view_citation&hl=en&user=mwyKeMsAAAAJ&pagesize=100&sortby=pubdate&citation_for_view=mwyKeMsAAAAJ:hC7cP41nSMkC
mwyKeMsAAAAJ,49,System of singular second-order differential equations with integral condition on the positive half-line,"S Djebali, K Mebarki",Electronic Journal of Qualitative Theory of Differential Equations 2013 (50 …,2013,https://scholar.google.com/scholar?oi=bibs&hl=en&cites=1336107648414435337,https://scholar.google.com/citations?view_op=view_citation&hl=en&user=mwyKeMsAAAAJ&pagesize=100&sortby=pubdate&citation_for_view=mwyKeMsAAAAJ:bEWYMUwI8FkC
mwyKeMsAAAAJ,50,Positive Solutions for a Class of Fourth-order Singular BVPs on the Positive Half-line,"S Djebali, O Saifi","Thai Journal of Mathematics 12 (3), 639-663",2013,https://scholar.google.com/scholar?oi=bibs&hl=en&cites=NA,""
mwyKeMsAAAAJ,51,Fixed point theory for: nonexpansive and contractive mappings,S Djebali,THE ABSTRACT BOOK 15,2013,https://scholar.google.com/scholar?oi=bibs&hl=en&cites=NA,""
mwyKeMsAAAAJ,52,Positive solutions for singular BVPs on the positive half-line arising from epidemiology and combustion theory,"S Djebali, O Saïfi, Y Baoqiang","Acta Mathematica Scientia 32 (2), 672-694",2012,https://scholar.google.com/scholar?oi=bibs&hl=en&cites=11075743268407981925,https://scholar.google.com/citations?view_op=view_citation&hl=en&user=mwyKeMsAAAAJ&pagesize=100&sortby=pubdate&citation_for_view=mwyKeMsAAAAJ:_FxGoFyzp5QC
mwyKeMsAAAAJ,53,-Laplacian BVPs with linear bounded operator conditions,"K Bachouche, S Djebali, T Moussaoui","Archivum Mathematicum 48 (2), 121-137",2012,https://scholar.google.com/scholar?oi=bibs&hl=en&cites=5204957157318213217,https://scholar.google.com/citations?view_op=view_citation&hl=en&user=mwyKeMsAAAAJ&pagesize=100&sortby=pubdate&citation_for_view=mwyKeMsAAAAJ:M3ejUd6NZC8C
mwyKeMsAAAAJ,54,"Multiple Positive Solutions for Singular ψ—Laplacian BVPs with Derivative Dependence on [0,+∞","S Djebali, O Saifi","Dynamic Systems and Applications 21 (1), 93",2012,https://scholar.google.com/scholar?oi=bibs&hl=en&cites=13987862700864546594,https://scholar.google.com/citations?view_op=view_citation&hl=en&user=mwyKeMsAAAAJ&pagesize=100&sortby=pubdate&citation_for_view=mwyKeMsAAAAJ:-f6ydRqryjwC
mwyKeMsAAAAJ,55,Existence and Structure of Solution Sets for Impulsive Differential Inclusions,"S Djebali, L Gorniewicz, A Ouahab","Lecture Notes, Nicolaus Copernicus University 13",2012,https://scholar.google.com/scholar?oi=bibs&hl=en&cites=17492801942951276025,https://scholar.google.com/citations?view_op=view_citation&hl=en&user=mwyKeMsAAAAJ&pagesize=100&sortby=pubdate&citation_for_view=mwyKeMsAAAAJ:nb7KW1ujOQ8C
mwyKeMsAAAAJ,56,Furi-Pera fixed point theorems for nonexpansive maps in Banach spaces,"S Djebali, K Hammache","Fixed Point Theory 13 (2), 461-474",2012,https://scholar.google.com/scholar?oi=bibs&hl=en&cites=16273411121620750770,https://scholar.google.com/citations?view_op=view_citation&hl=en&user=mwyKeMsAAAAJ&pagesize=100&sortby=pubdate&citation_for_view=mwyKeMsAAAAJ:ULOm3_A8WrAC
mwyKeMsAAAAJ,57,Unbounded positive solutions for multi-point Φ-Laplacian bvps with sign-changing nonlinearities on the positive half-line.,"S Djebali, K Mebarki",Nonlinear Studies 19 (2),2012,https://scholar.google.com/scholar?oi=bibs&hl=en&cites=3336177851380531732,https://scholar.google.com/citations?view_op=view_citation&hl=en&user=mwyKeMsAAAAJ&pagesize=100&sortby=pubdate&citation_for_view=mwyKeMsAAAAJ:7PzlFSSx8tAC
mwyKeMsAAAAJ,58,EXISTENCE OF SOLUTIONS FOR A SINGULAR FOURTH–ORDER p–LAPLACIAN SYSTEM,"K Bachouche, S Djebali, T Moussaoui","Differ. Equ. Appl 4, 637-651",2012,https://scholar.google.com/scholar?oi=bibs&hl=en&cites=8227371988624761011,https://scholar.google.com/citations?view_op=view_citation&hl=en&user=mwyKeMsAAAAJ&pagesize=100&sortby=pubdate&citation_for_view=mwyKeMsAAAAJ:IWHjjKOFINEC
mwyKeMsAAAAJ,59,Fixed Point Theorems for Some Operator Equations and Inclusions in Banach Spaces Relative to the Weak Topology,"S Djebali, D O'Regan, Z Sahnoun","Communications in Applied Analysis 16 (1), 1",2012,https://scholar.google.com/scholar?oi=bibs&hl=en&cites=NA,""
mwyKeMsAAAAJ,60,Topological structure of solution sets for impulsive differential inclusions in Fréchet spaces,"S Djebali, L Górniewicz, A Ouahab","Nonlinear Analysis: Theory, Methods & Applications 74 (6), 2141-2169",2011,https://scholar.google.com/scholar?oi=bibs&hl=en&cites=12734437466475261613,https://scholar.google.com/citations?view_op=view_citation&hl=en&user=mwyKeMsAAAAJ&pagesize=100&sortby=pubdate&citation_for_view=mwyKeMsAAAAJ:WF5omc3nYNoC
mwyKeMsAAAAJ,61,Upper and lower solutions for BVPs on the half-line with variable coefficient and derivative depending nonlinearity,"S Djebali, S Zahar",Electronic Journal of Qualitative Theory of Differential Equations 2011 (14 …,2011,https://scholar.google.com/scholar?oi=bibs&hl=en&cites=12427518268144692151,https://scholar.google.com/citations?view_op=view_citation&hl=en&user=mwyKeMsAAAAJ&pagesize=100&sortby=pubdate&citation_for_view=mwyKeMsAAAAJ:RHpTSmoSYBkC
mwyKeMsAAAAJ,62,On the solvability of some operator equations and inclusions in Banach spaces with the weak topology,"S Djebali, D O'regan, Z Sahnoun","Communications in Applied Analysis 15 (1), 125",2011,https://scholar.google.com/scholar?oi=bibs&hl=en&cites=3949628104398889126,https://scholar.google.com/citations?view_op=view_citation&hl=en&user=mwyKeMsAAAAJ&pagesize=100&sortby=pubdate&citation_for_view=mwyKeMsAAAAJ:_kc_bZDykSQC
mwyKeMsAAAAJ,63,One-dimensional Dirichlet φ−− Laplacian BVPs with first order derivative dependence,"K Bachouche, S Djebali, T Moussaoui","Adv. Dynam. Syst. Appl 6 (2), 159-175",2011,https://scholar.google.com/scholar?oi=bibs&hl=en&cites=465594648740328818,https://scholar.google.com/citations?view_op=view_citation&hl=en&user=mwyKeMsAAAAJ&pagesize=100&sortby=pubdate&citation_for_view=mwyKeMsAAAAJ:MXK_kJrjxJIC
mwyKeMsAAAAJ,64,Multiple positive solutions for singular multi-point boundary-value problem with general growth on the positive half line,"S Djebali, K Mebarki","Electronic Journal of Differential Equations 2011 (32), 1-29",2011,https://scholar.google.com/scholar?oi=bibs&hl=en&cites=11897482247747591264,https://scholar.google.com/citations?view_op=view_citation&hl=en&user=mwyKeMsAAAAJ&pagesize=100&sortby=pubdate&citation_for_view=mwyKeMsAAAAJ:dhFuZR0502QC
mwyKeMsAAAAJ,65,Nonlinear alternatives of Schauder and Krasnosel'skij types with applications to Hammerstein integral equations in L1 spaces,"S Djebali, Z Sahnoun","Journal of Differential Equations 249 (9), 2061-2075",2010,https://scholar.google.com/scholar?oi=bibs&hl=en&cites=1740163151419565073,https://scholar.google.com/citations?view_op=view_citation&hl=en&user=mwyKeMsAAAAJ&pagesize=100&sortby=pubdate&citation_for_view=mwyKeMsAAAAJ:2osOgNQ5qMEC
mwyKeMsAAAAJ,66,First-order periodic impulsive semilinear differential inclusions: existence and structure of solution sets,"S Djebali, L Górniewicz, A Ouahab","Mathématical and computer modelling 52 (5-6), 683-714",2010,https://scholar.google.com/scholar?oi=bibs&hl=en&cites=18369233735725227654,https://scholar.google.com/citations?view_op=view_citation&hl=en&user=mwyKeMsAAAAJ&pagesize=100&sortby=pubdate&citation_for_view=mwyKeMsAAAAJ:W7OEmFMy1HYC
mwyKeMsAAAAJ,67,Positive solutions for singular BVPs with sign changing and derivative depending nonlinearity on the positive half-line,"S Djebali, O Saifi","Acta applicandae mathematicae 110 (2), 639-665",2010,https://scholar.google.com/scholar?oi=bibs&hl=en&cites=2446403890535518639,https://scholar.google.com/citations?view_op=view_citation&hl=en&user=mwyKeMsAAAAJ&pagesize=100&sortby=pubdate&citation_for_view=mwyKeMsAAAAJ:YsMSGLbcyi4C
mwyKeMsAAAAJ,68,Fixed point theorems for nonexpansive maps in Banach spaces,"S Djebali, K Hammache","Nonlinear Analysis: Theory, Methods & Applications 73 (10), 3440-3449",2010,https://scholar.google.com/scholar?oi=bibs&hl=en&cites=9199699510736405323,https://scholar.google.com/citations?view_op=view_citation&hl=en&user=mwyKeMsAAAAJ&pagesize=100&sortby=pubdate&citation_for_view=mwyKeMsAAAAJ:5nxA0vEk-isC
mwyKeMsAAAAJ,69,The continuous dependence on parameters of solutions for a class of elliptic problems on exterior domains,"S Djebali, A Orpel","Nonlinear Analysis: Theory, Methods & Applications 73 (3), 660-672",2010,https://scholar.google.com/scholar?oi=bibs&hl=en&cites=727048142106726261,https://scholar.google.com/citations?view_op=view_citation&hl=en&user=mwyKeMsAAAAJ&pagesize=100&sortby=pubdate&citation_for_view=mwyKeMsAAAAJ:YOwf2qJgpHMC
