mwyKeMsAAAAJ,70,Multiple unbounded positive solutions for three-point bvps with sign-changing nonlinearities on the positive half-line,"S Djebali, K Mebarki","Acta applicandae mathematicae 109 (2), 361-388",2010,https://scholar.google.com/scholar?oi=bibs&hl=en&cites=3922686806876664247,https://scholar.google.com/citations?view_op=view_citation&hl=en&user=mwyKeMsAAAAJ&pagesize=100&sortby=pubdate&citation_for_view=mwyKeMsAAAAJ:ufrVoPGSRksC
mwyKeMsAAAAJ,71,Existence de géodésiques d’un groupe de difféomorphismes muni d’une métrique de Sobolev,"N Hermas, S Djebali","Afr. Diaspora J. Math.(NS) 9 (1), 50-63",2010,https://scholar.google.com/scholar?oi=bibs&hl=en&cites=14852702154531403636,https://scholar.google.com/citations?view_op=view_citation&hl=en&user=mwyKeMsAAAAJ&pagesize=100&sortby=pubdate&citation_for_view=mwyKeMsAAAAJ:hqOjcs7Dif8C
mwyKeMsAAAAJ,72,Existence de l'application exponentielle riemannienne d'un groupe de difféomorphismes muni d'une métrique de Sobolev,"N Hermas, S Djebali","Journal de mathématiques pures et appliquées 94 (4), 433-446",2010,https://scholar.google.com/scholar?oi=bibs&hl=en&cites=15130207330611802587,https://scholar.google.com/citations?view_op=view_citation&hl=en&user=mwyKeMsAAAAJ&pagesize=100&sortby=pubdate&citation_for_view=mwyKeMsAAAAJ:qUcmZB5y_30C
mwyKeMsAAAAJ,73,Bounded solutions for a derivative dependent boundary value problem on the half-line,"S Djebali, S Zahar","Dynamic Systems and Applications 19 (3), 545",2010,https://scholar.google.com/scholar?oi=bibs&hl=en&cites=13429060119481295558,https://scholar.google.com/citations?view_op=view_citation&hl=en&user=mwyKeMsAAAAJ&pagesize=100&sortby=pubdate&citation_for_view=mwyKeMsAAAAJ:Zph67rFs4hoC
mwyKeMsAAAAJ,74,"Upper and lower solution method for singular φ-Laplacian BVPs with derivative depending nonlinearity on [0,+∞","S Djebali, O Saifi","Communications in Applied Analysis 14 (3), 463",2010,https://scholar.google.com/scholar?oi=bibs&hl=en&cites=14074609403432279555,https://scholar.google.com/citations?view_op=view_citation&hl=en&user=mwyKeMsAAAAJ&pagesize=100&sortby=pubdate&citation_for_view=mwyKeMsAAAAJ:ZeXyd9-uunAC
mwyKeMsAAAAJ,75,Positive solutions for singular Laplacian BVPs on the positive half-line,"S Djebali, O Saifi",Electronic journal of qualitative theory of differential equations 2009 (56 …,2009,https://scholar.google.com/scholar?oi=bibs&hl=en&cites=14525941188639969079,https://scholar.google.com/citations?view_op=view_citation&hl=en&user=mwyKeMsAAAAJ&pagesize=100&sortby=pubdate&citation_for_view=mwyKeMsAAAAJ:9ZlFYXVOiuMC
mwyKeMsAAAAJ,76,Qualitative properties and existence of solutions for a generalized Fisher-like equation,"S Djebali, O Kavian, T Moussaoui","IRANIAN JOURNAL OF MATHEMATICAL SCIENCES AND INFORMATICS (IJMSI) 4 (2), 65-81",2009,https://scholar.google.com/scholar?oi=bibs&hl=en&cites=1164925530636028840,https://scholar.google.com/citations?view_op=view_citation&hl=en&user=mwyKeMsAAAAJ&pagesize=100&sortby=pubdate&citation_for_view=mwyKeMsAAAAJ:zYLM7Y9cAGgC
mwyKeMsAAAAJ,77,Fourth-Order p-Laplacian Nonlinear Systems via the Vector Version of Krasnosel’skiĭ’s Fixed Point Theorem,"S Djebali, T Moussaoui, R Precup","Mediterranean journal of mathematics 6, 447-460",2009,https://scholar.google.com/scholar?oi=bibs&hl=en&cites=4164457205715974623,https://scholar.google.com/citations?view_op=view_citation&hl=en&user=mwyKeMsAAAAJ&pagesize=100&sortby=pubdate&citation_for_view=mwyKeMsAAAAJ:Se3iqnhoufwC
mwyKeMsAAAAJ,78,A note on positive evanescent solutions for a certain class of elliptic problems,"S Djebali, A Orpel","Journal of mathematical analysis and applications 353 (1), 215-223",2009,https://scholar.google.com/scholar?oi=bibs&hl=en&cites=15209590101994832305,https://scholar.google.com/citations?view_op=view_citation&hl=en&user=mwyKeMsAAAAJ&pagesize=100&sortby=pubdate&citation_for_view=mwyKeMsAAAAJ:8k81kl-MbHgC
mwyKeMsAAAAJ,79,Global solutions to a class of second-order differential equations,"S Djebali, T Moussaoui","Arabian Journal for Science and Engineering 34 (2A), 147",2009,https://scholar.google.com/scholar?oi=bibs&hl=en&cites=10688848718234574756,https://scholar.google.com/citations?view_op=view_citation&hl=en&user=mwyKeMsAAAAJ&pagesize=100&sortby=pubdate&citation_for_view=mwyKeMsAAAAJ:R3hNpaxXUhUC
mwyKeMsAAAAJ,80,Existence and multiplicity results for Singular,"S Djebali, K Mebarki",Electronic Journal of Differential Equations (EJDE)[electronic only] 2009,2009,https://scholar.google.com/scholar?oi=bibs&hl=en&cites=5386550108138385267,https://scholar.google.com/citations?view_op=view_citation&hl=en&user=mwyKeMsAAAAJ&pagesize=100&sortby=pubdate&citation_for_view=mwyKeMsAAAAJ:bnK-pcrLprsC
mwyKeMsAAAAJ,81,Existence and multiplicity results for singular-Laplacian BVPs on the positive half-line.,"S Djebali, K Mebarki",Electronic Journal of Differential Equations (EJDE)[electronic only] 2009 …,2009,https://scholar.google.com/scholar?oi=bibs&hl=en&cites=10860309134418247784,https://scholar.google.com/citations?view_op=view_citation&hl=en&user=mwyKeMsAAAAJ&pagesize=100&sortby=pubdate&citation_for_view=mwyKeMsAAAAJ:QIV2ME_5wuYC
mwyKeMsAAAAJ,82,Multiple positive solutions for singular BVPs on the positive half-line,"S Djebali, K Mebarki","Computers & Mathematics with Applications 55 (12), 2940-2952",2008,https://scholar.google.com/scholar?oi=bibs&hl=en&cites=7732874280487750969,https://scholar.google.com/citations?view_op=view_citation&hl=en&user=mwyKeMsAAAAJ&pagesize=100&sortby=pubdate&citation_for_view=mwyKeMsAAAAJ:u-x6o8ySG0sC
mwyKeMsAAAAJ,83,On the singular generalized Fisher-like equation with derivative depending nonlinearity,"S Djebali, K Mebarki","Applied mathematics and computation 205 (1), 336-351",2008,https://scholar.google.com/scholar?oi=bibs&hl=en&cites=4391447738844932824,https://scholar.google.com/citations?view_op=view_citation&hl=en&user=mwyKeMsAAAAJ&pagesize=100&sortby=pubdate&citation_for_view=mwyKeMsAAAAJ:UeHWp8X0CEIC
mwyKeMsAAAAJ,84,Existence Results for One-dimensional Dirichlet Phi-Laplacian BVPS: a Fixed Point Approach,"A Benmeza I, SI Djebali, T Moussaoui","Dynamic Systems and Applications 17 (1), 149",2008,https://scholar.google.com/scholar?oi=bibs&hl=en&cites=2212794149501175561,https://scholar.google.com/citations?view_op=view_citation&hl=en&user=mwyKeMsAAAAJ&pagesize=100&sortby=pubdate&citation_for_view=mwyKeMsAAAAJ:mB3voiENLucC
mwyKeMsAAAAJ,85,On the asymptotic integration of nonlinear dynamic equations,"E Akın-Bohner, M Bohner, S Djebali, T Moussaoui",Adv. Difference Equ 17,2008,https://scholar.google.com/scholar?oi=bibs&hl=en&cites=17086195617283401912,https://scholar.google.com/citations?view_op=view_citation&hl=en&user=mwyKeMsAAAAJ&pagesize=100&sortby=pubdate&citation_for_view=mwyKeMsAAAAJ:maZDTaKrznsC
mwyKeMsAAAAJ,86,"ADEs-ODEs 3rd School Mostaganem, Algeria 24-29 May, 2008 Sign-Changing Singular Boundary Value Problems",S DJEBALI,"Sign 24, 29",2008,https://scholar.google.com/scholar?oi=bibs&hl=en&cites=NA,""
mwyKeMsAAAAJ,87,On the asymptotic integration of nonlinear differential equations,"RP Agarwal, S Djebali, T Moussaoui, OG Mustafa","Journal of Computational and Applied Mathematics 202 (2), 352-376",2007,https://scholar.google.com/scholar?oi=bibs&hl=en&cites=7639719807747557736,https://scholar.google.com/citations?view_op=view_citation&hl=en&user=mwyKeMsAAAAJ&pagesize=100&sortby=pubdate&citation_for_view=mwyKeMsAAAAJ:u5HHmVD_uO8C
mwyKeMsAAAAJ,88,Positive evanescent solutions of nonlinear elliptic equations,"S Djebali, T Moussaoui, OG Mustafa","Journal of mathematical analysis and applications 333 (2), 863-870",2007,https://scholar.google.com/scholar?oi=bibs&hl=en&cites=7597238983003410476,https://scholar.google.com/citations?view_op=view_citation&hl=en&user=mwyKeMsAAAAJ&pagesize=100&sortby=pubdate&citation_for_view=mwyKeMsAAAAJ:9yKSN-GCB0IC
mwyKeMsAAAAJ,89,Positive solution for φ− Laplacian Dirichlet bvps,"A Benmezai, S Djebali, T Moussaoui","Fixed Point Theory 8 (2), 167-186",2007,https://scholar.google.com/scholar?oi=bibs&hl=en&cites=11190964375509479555,https://scholar.google.com/citations?view_op=view_citation&hl=en&user=mwyKeMsAAAAJ&pagesize=100&sortby=pubdate&citation_for_view=mwyKeMsAAAAJ:Y0pCki6q_DkC
mwyKeMsAAAAJ,90,Existence results for a class of BVPs on the positive half-line,"S Djebali, K Mebarki","Comm. Appl. Nonlin. Anal 14 (2), 13-31",2007,https://scholar.google.com/scholar?oi=bibs&hl=en&cites=11473359142069859104,https://scholar.google.com/citations?view_op=view_citation&hl=en&user=mwyKeMsAAAAJ&pagesize=100&sortby=pubdate&citation_for_view=mwyKeMsAAAAJ:d1gkVwhDpl0C
mwyKeMsAAAAJ,91,Multiple positive solutions for N-Laplacian BVPs,"A Benmezai, S Djebali, T Moussaoui","PanAmerican Mathematical Journal 17 (3), 53",2007,https://scholar.google.com/scholar?oi=bibs&hl=en&cites=12678467387611704962,https://scholar.google.com/citations?view_op=view_citation&hl=en&user=mwyKeMsAAAAJ&pagesize=100&sortby=pubdate&citation_for_view=mwyKeMsAAAAJ:eQOLeE2rZwMC
mwyKeMsAAAAJ,92,On the asymptotic behavior of solutions to nonlinear ordinary differential equations,"RP Agarwal, S Djebali, T Moussaoui, OG Mustafa, YV Rogovchenko","Asymptotic Analysis 54 (1-2), 1-50",2007,https://scholar.google.com/scholar?oi=bibs&hl=en&cites=10771562900764789171,https://scholar.google.com/citations?view_op=view_citation&hl=en&user=mwyKeMsAAAAJ&pagesize=100&sortby=pubdate&citation_for_view=mwyKeMsAAAAJ:Tyk-4Ss8FVUC
mwyKeMsAAAAJ,93,Existence theory for perturbed boundary value problems for first order multivalued differential systems,"A Belarbi, M Benchohra, S Djebali","PANAMERICAN MATHEMATICAL JOURNAL 17 (4), 89",2007,https://scholar.google.com/scholar?oi=bibs&hl=en&cites=NA,""
mwyKeMsAAAAJ,94,A class of second order BVPs on infinite intervals,"S Djebali, T Moussaoui",Electronic Journal of Qualitative Theory of Differential Equations 2006 (4 …,2006,https://scholar.google.com/scholar?oi=bibs&hl=en&cites=8507597537602902453,https://scholar.google.com/citations?view_op=view_citation&hl=en&user=mwyKeMsAAAAJ&pagesize=100&sortby=pubdate&citation_for_view=mwyKeMsAAAAJ:hFOr9nPyWt4C
mwyKeMsAAAAJ,95,Boundary value problems for doubly perturbed first order ordinary differential systems,"M Benchohra, S Djebali, T Moussaoui",Electronic Journal of Qualitative Theory of Differential Equations 2006 (11 …,2006,https://scholar.google.com/scholar?oi=bibs&hl=en&cites=9184134402357680360,https://scholar.google.com/citations?view_op=view_citation&hl=en&user=mwyKeMsAAAAJ&pagesize=100&sortby=pubdate&citation_for_view=mwyKeMsAAAAJ:qjMakFHDy7sC
mwyKeMsAAAAJ,96,Traveling Wave Solutions To A Reaction-Diffusion System From Combustion Theory.,S Djebali,Nonlinear Studies 11 (4),2004,https://scholar.google.com/scholar?oi=bibs&hl=en&cites=2900095850510078320,https://scholar.google.com/citations?view_op=view_citation&hl=en&user=mwyKeMsAAAAJ&pagesize=100&sortby=pubdate&citation_for_view=mwyKeMsAAAAJ:0EnyYjriUFMC
mwyKeMsAAAAJ,97,Traveling wave solutions to a reaction–diffusion system arising in epidemiology,S Djebali,"Nonlinear analysis: real world applications 2 (4), 417-442",2001,https://scholar.google.com/scholar?oi=bibs&hl=en&cites=11523590278429968470,https://scholar.google.com/citations?view_op=view_citation&hl=en&user=mwyKeMsAAAAJ&pagesize=100&sortby=pubdate&citation_for_view=mwyKeMsAAAAJ:4JMBOYKVnBMC
mwyKeMsAAAAJ,98,Uniform continuity and growth of real continuous functions,S Djebali,International Journal of Mathematical Education in Science and Technology 32 …,2001,https://scholar.google.com/scholar?oi=bibs&hl=en&cites=656627364131734614,https://scholar.google.com/citations?view_op=view_citation&hl=en&user=mwyKeMsAAAAJ&pagesize=100&sortby=pubdate&citation_for_view=mwyKeMsAAAAJ:LkGwnXOMwfcC
mwyKeMsAAAAJ,99,Problèmes aux limites non linéaire associés aux EDO du second ordre,S Djebali,"Cours de magister, Département de Mathématiques, ENS-Kouba, Alger ,(2001-2002)",2001,https://scholar.google.com/scholar?oi=bibs&hl=en&cites=17643110015616004634,https://scholar.google.com/citations?view_op=view_citation&hl=en&user=mwyKeMsAAAAJ&pagesize=100&sortby=pubdate&citation_for_view=mwyKeMsAAAAJ:t6usbXjVLHcC
mwyKeMsAAAAJ,100,Existence of Travelling Waves for a Model from Epidemiology,S Djebali,"Arab Jour. of Math. Sci 7 (1), 53-75",2001,https://scholar.google.com/scholar?oi=bibs&hl=en&cites=6415173719906882895,https://scholar.google.com/citations?view_op=view_citation&hl=en&user=mwyKeMsAAAAJ&pagesize=100&sortby=pubdate&citation_for_view=mwyKeMsAAAAJ:Tiz5es2fbqcC
mwyKeMsAAAAJ,101,Traveling front solutions for a diffusive epidemic model with external sources,S Djebali,"Annales de la Faculté des sciences de Toulouse: Mathématiques 10 (2), 271-292",2001,https://scholar.google.com/scholar?oi=bibs&hl=en&cites=6399631825113631415,https://scholar.google.com/citations?view_op=view_citation&hl=en&user=mwyKeMsAAAAJ&pagesize=100&sortby=pubdate&citation_for_view=mwyKeMsAAAAJ:kNdYIx-mwKoC
