Scholar ID,Paper Number,Paper Title,Authors,"Publication (journal name. volume, no. pages)",Year,Cited_by,Link
RKkOH2gAAAAJ,1,ON  -GENERATIONS OF THE FISCHER GROUP ,"F Ali, N Alotaibi, I Al-Dayel","JP Journal of Algebra, Number Theory and Applications 63 (3), 281-296",2024,https://scholar.google.com/scholar?oi=bibs&hl=en&cites=NA,""
RKkOH2gAAAAJ,2,Specht Modules and Representations,"MO Alshammari, F Ali","Advances in Ring Theory and Applications: WARA A22, Messina, Italy, July 18-20 …",2024,https://scholar.google.com/scholar?oi=bibs&hl=en&cites=NA,""
RKkOH2gAAAAJ,3,Existence results of certain nonlinear polynomial and integral equations via ϝ-contractive operators,"RO Ogbumba, MS Shagari, A Azam, F Ali, T Alotaibi","AIMS Math 8 (12), 28646-69",2023,https://scholar.google.com/scholar?oi=bibs&hl=en&cites=4070917320671299445,https://scholar.google.com/citations?view_op=view_citation&hl=en&user=RKkOH2gAAAAJ&pagesize=100&sortby=pubdate&citation_for_view=RKkOH2gAAAAJ:NMxIlDl6LWMC
RKkOH2gAAAAJ,4,Exploring Integral ϝ-Contractions with Applications to Integral Equations and Fractional BVPs,"Z Nisar, N Mehmood, A Azam, F Ali, MA Al-Kadhi","Fractal and Fractional 7 (12), 833",2023,https://scholar.google.com/scholar?oi=bibs&hl=en&cites=NA,""
RKkOH2gAAAAJ,5,A Comprehensive Study on Advancement in Hybrid Contraction and Graphical Analysis of £-Fuzzy Fixed Points with Application,"M Rashid, A Azam, F Dar, F Ali, MA Al-Kadhi","Mathematics 11 (21), 4489",2023,https://scholar.google.com/scholar?oi=bibs&hl=en&cites=NA,""
RKkOH2gAAAAJ,6,Fixed-Point Convergence of Multi-Valued Non-Expansive Mappings with Applications,"A Azam, M Rashid, A Kalsoom, F Ali","Axioms 12 (11), 1020",2023,https://scholar.google.com/scholar?oi=bibs&hl=en&cites=NA,""
RKkOH2gAAAAJ,7,Reich–Krasnoselskii-type fixed point results with applications in integral equations,"A Azam, N Mehmood, N Ahmad, F Ali","Journal of Inequalities and Applications 2023 (1), 131",2023,https://scholar.google.com/scholar?oi=bibs&hl=en&cites=NA,""
RKkOH2gAAAAJ,8,Fixed point of Hardy-Rogers-type contractions on metric spaces with graph,"MS Shagari, F Ali, T Alotaibi, A Azam","Electronic Research Archive 31 (2), 675-690",2023,https://scholar.google.com/scholar?oi=bibs&hl=en&cites=NA,""
RKkOH2gAAAAJ,9,Existence and compatibility of positive solutions for boundary value fractional differential equation with modified analytic kernel,"A Kalsoom, S Afsheen, A Azam, F Ali","AIMS Mathematics 8 (4), 7766-7786",2023,https://scholar.google.com/scholar?oi=bibs&hl=en&cites=NA,""
RKkOH2gAAAAJ,10,Existence Results for Nonlinear Fractional Differential Inclusions via q-ROF Fixed Point,"L Shahid, M Rashid, A Azam, F Ali","Fractal and Fractional 7 (1), 41",2022,https://scholar.google.com/scholar?oi=bibs&hl=en&cites=NA,""
RKkOH2gAAAAJ,11,Hybrid Fuzzy Contraction Theorems with Their Role in Integral Inclusions,"F Ali, MS Shagari, A Azam","Axioms 11 (11), 580",2022,https://scholar.google.com/scholar?oi=bibs&hl=en&cites=NA,""
RKkOH2gAAAAJ,12,A fixed point result of weakly contractive operators in generalized metric spaces,"MS Shagari, F Ali, T Alotaibi, S Kanwal, A Azam","AIMS Mathematics 7 (9), 17603-17611",2022,https://scholar.google.com/scholar?oi=bibs&hl=en&cites=NA,""
RKkOH2gAAAAJ,13,Estimation of Fixed Points of Hardy and Rogers Generalized Non-Expansive Mappings,"J Ali, F Ali, FA Khan",Azerbaijan Journal of Mathematics 49-63,2021,https://scholar.google.com/scholar?oi=bibs&hl=en&cites=9318047265833336662,https://scholar.google.com/citations?view_op=view_citation&hl=en&user=RKkOH2gAAAAJ&pagesize=100&sortby=pubdate&citation_for_view=RKkOH2gAAAAJ:TFP_iSt0sucC
RKkOH2gAAAAJ,14,"On a maximal subgroup of the symplectic group Sp(8, 2)","F Ali, ABM Basheer","Afrika Matematika 32, 1531-1562",2021,https://scholar.google.com/scholar?oi=bibs&hl=en&cites=NA,""
RKkOH2gAAAAJ,15,Generating Pairs for the Fischer Group Fi23,"F Ali, M Al-Kadhi","Algebra Colloquium 27 (04), 713-730",2020,https://scholar.google.com/scholar?oi=bibs&hl=en&cites=4810674729430188452,https://scholar.google.com/citations?view_op=view_citation&hl=en&user=RKkOH2gAAAAJ&pagesize=100&sortby=pubdate&citation_for_view=RKkOH2gAAAAJ:dhFuZR0502QC
RKkOH2gAAAAJ,16,On a maximal subgroup of the Conway group Co3,"ABM Basheer, F Ali, ML Alotaibi","Italian Journal of Pure and Applied Mathematics 44, 348-356",2020,https://scholar.google.com/scholar?oi=bibs&hl=en&cites=NA,""
RKkOH2gAAAAJ,17,EFFECT OF WASTE WATER TREATMENT ON THE GROWTH OF SELECTED LEAFY VEGETABLE PLANTS.,"F Ali, SU Rehman, NM Tareen, K Ullah, A Ullah, T Bibi, S Laghari",Applied Ecology & Environmental Research 17 (2),2019,https://scholar.google.com/scholar?oi=bibs&hl=en&cites=14503936089639934284,https://scholar.google.com/citations?view_op=view_citation&hl=en&user=RKkOH2gAAAAJ&pagesize=100&sortby=pubdate&citation_for_view=RKkOH2gAAAAJ:k_IJM867U9cC
RKkOH2gAAAAJ,18,"On (2, 3)-generation of Fischer's largest sporadic simple group Fi24′","F Ali, MAF Ibrahim, A Woldar","Comptes Rendus Mathematique 357 (5), 401-412",2019,https://scholar.google.com/scholar?oi=bibs&hl=en&cites=8650297660280231446,https://scholar.google.com/citations?view_op=view_citation&hl=en&user=RKkOH2gAAAAJ&pagesize=100&sortby=pubdate&citation_for_view=RKkOH2gAAAAJ:4DMP91E08xMC
RKkOH2gAAAAJ,19,"(3, 𝑞, 𝑟)-generations of Fischer's sporadic group Fi′24","F Ali, MAF Ibrahim, A Woldar","Journal of Group Theory 22 (3), 453-489",2019,https://scholar.google.com/scholar?oi=bibs&hl=en&cites=6648477149350093044,https://scholar.google.com/citations?view_op=view_citation&hl=en&user=RKkOH2gAAAAJ&pagesize=100&sortby=pubdate&citation_for_view=RKkOH2gAAAAJ:4TOpqqG69KYC
RKkOH2gAAAAJ,20,On the ranks of Fischer group  and the Baby Monster group ,"MAF Ibrahim, F Ali, MA Al-Kadhi, AM Aljouiee","International Journal of Group Theory 8 (1), 11-22",2019,https://scholar.google.com/scholar?oi=bibs&hl=en&cites=596450636253757205,https://scholar.google.com/citations?view_op=view_citation&hl=en&user=RKkOH2gAAAAJ&pagesize=100&sortby=pubdate&citation_for_view=RKkOH2gAAAAJ:ZeXyd9-uunAC
RKkOH2gAAAAJ,21,"Impact of internally displaced persons on forest and vegetation of Jere LGA, Borno State, Nigeria","A Musa, MB Ibrahim, A Aliyu, FA Ali","Journal of Applied Sciences and Environmental Management 23 (5), 831-834",2019,https://scholar.google.com/scholar?oi=bibs&hl=en&cites=6673280434800403089,https://scholar.google.com/citations?view_op=view_citation&hl=en&user=RKkOH2gAAAAJ&pagesize=100&sortby=pubdate&citation_for_view=RKkOH2gAAAAJ:Wp0gIr-vW9MC
RKkOH2gAAAAJ,22,"Sur la (2, 3)-génération du plus grand groupe simple sporadique de Fischer Fi24′","F Ali, MAF Ibrahim, A Woldar","Comptes Rendus Mathematique 357 (5), 401-412",2019,https://scholar.google.com/scholar?oi=bibs&hl=en&cites=NA,""
RKkOH2gAAAAJ,23,Assessing the relationship between religiosity and rationality,"FS Khan, F Ali, I Muhammad",J Psychol Cognition. 2017; 2 (2): 166-169. J Psychol Cognition 2017 Volume 2 …,2017,https://scholar.google.com/scholar?oi=bibs&hl=en&cites=11178184189867019616,https://scholar.google.com/citations?view_op=view_citation&hl=en&user=RKkOH2gAAAAJ&pagesize=100&sortby=pubdate&citation_for_view=RKkOH2gAAAAJ:blknAaTinKkC
RKkOH2gAAAAJ,24,On the ranks of Fi22,F Ali,"Quaestiones Mathematicae 37 (4), 591-600",2014,https://scholar.google.com/scholar?oi=bibs&hl=en&cites=18097429683744583481,https://scholar.google.com/citations?view_op=view_citation&hl=en&user=RKkOH2gAAAAJ&pagesize=100&sortby=pubdate&citation_for_view=RKkOH2gAAAAJ:YOwf2qJgpHMC
RKkOH2gAAAAJ,25,The Fischer-Clifford matrices and character table of the split extension 2 6: S8,"F Ali, J Moori","Hacettepe Journal of Mathematics and Statistics 43 (2), 153-171",2014,https://scholar.google.com/scholar?oi=bibs&hl=en&cites=9055064661376529488,https://scholar.google.com/citations?view_op=view_citation&hl=en&user=RKkOH2gAAAAJ&pagesize=100&sortby=pubdate&citation_for_view=RKkOH2gAAAAJ:WF5omc3nYNoC
RKkOH2gAAAAJ,26,Simple Group Suz,F Ali,"Applied Mathematical Sciences 8 (48), 2375-2381",2014,https://scholar.google.com/scholar?oi=bibs&hl=en&cites=13513751360507848986,https://scholar.google.com/citations?view_op=view_citation&hl=en&user=RKkOH2gAAAAJ&pagesize=100&sortby=pubdate&citation_for_view=RKkOH2gAAAAJ:hqOjcs7Dif8C
RKkOH2gAAAAJ,27,Solvent-free determination of TPH in soil by near-infrared reflectance spectroscopy,"A Hauser, F Ali, B Al-Dosari, H Al-Sammar","International Journal of Sustainable Development and Planning 8 (3), 413-421",2013,https://scholar.google.com/scholar?oi=bibs&hl=en&cites=5331906567075554913,https://scholar.google.com/citations?view_op=view_citation&hl=en&user=RKkOH2gAAAAJ&pagesize=100&sortby=pubdate&citation_for_view=RKkOH2gAAAAJ:r0BpntZqJG4C
RKkOH2gAAAAJ,28,"On the simple sporadic group He generated by the (2, 3, t) generators","F Ali, MAF Ibrahim","Bull. Malays. Math. Sci. Soc 35 (3), 745-753",2012,https://scholar.google.com/scholar?oi=bibs&hl=en&cites=5741885222952790237,https://scholar.google.com/citations?view_op=view_citation&hl=en&user=RKkOH2gAAAAJ&pagesize=100&sortby=pubdate&citation_for_view=RKkOH2gAAAAJ:zYLM7Y9cAGgC
RKkOH2gAAAAJ,29,"On (2, 3, t)-generations for the Conway group Co2","MA Al-Kadhi, F Ali","J. Math. Stat 8 (3), 339-341",2012,https://scholar.google.com/scholar?oi=bibs&hl=en&cites=10848261203781321644,https://scholar.google.com/citations?view_op=view_citation&hl=en&user=RKkOH2gAAAAJ&pagesize=100&sortby=pubdate&citation_for_view=RKkOH2gAAAAJ:ufrVoPGSRksC
RKkOH2gAAAAJ,30,The Fischer-Clifford Matrices and Character Table of a Maximal Subgroup of Fi24,"F Ali, J Moori","Algebra Colloquium 17 (03), 389-414",2010,https://scholar.google.com/scholar?oi=bibs&hl=en&cites=11462771717864575765,https://scholar.google.com/citations?view_op=view_citation&hl=en&user=RKkOH2gAAAAJ&pagesize=100&sortby=pubdate&citation_for_view=RKkOH2gAAAAJ:Se3iqnhoufwC
RKkOH2gAAAAJ,31,Generations for the Conway group Co3,"MA Al-Kadhi, F Ali","Int. J. Algebra 4, 1341-1353",2010,https://scholar.google.com/scholar?oi=bibs&hl=en&cites=9167171486220923643,https://scholar.google.com/citations?view_op=view_citation&hl=en&user=RKkOH2gAAAAJ&pagesize=100&sortby=pubdate&citation_for_view=RKkOH2gAAAAJ:mB3voiENLucC
RKkOH2gAAAAJ,32,Fischer-Clifford Matrices of the Non-Split Group Extension 26˙U                4(2),"F Ali, J Moori","Quaestiones Mathematicae 31 (1), 27-36",2008,https://scholar.google.com/scholar?oi=bibs&hl=en&cites=7051240600644765322,https://scholar.google.com/citations?view_op=view_citation&hl=en&user=RKkOH2gAAAAJ&pagesize=100&sortby=pubdate&citation_for_view=RKkOH2gAAAAJ:Y0pCki6q_DkC
RKkOH2gAAAAJ,33,"On the Ranks of Janko Groups J                1, J                2, J                3 and J                4","F Ali, J Moori","Quaestiones Mathematicae 31 (1), 37-44",2008,https://scholar.google.com/scholar?oi=bibs&hl=en&cites=13880173016573059007,https://scholar.google.com/citations?view_op=view_citation&hl=en&user=RKkOH2gAAAAJ&pagesize=100&sortby=pubdate&citation_for_view=RKkOH2gAAAAJ:0EnyYjriUFMC
RKkOH2gAAAAJ,34,On the ranks of O’N and Ly,F Ali,"Discrete Applied Mathematics 155 (3), 394-399",2007,https://scholar.google.com/scholar?oi=bibs&hl=en&cites=5608072720826266749,https://scholar.google.com/citations?view_op=view_citation&hl=en&user=RKkOH2gAAAAJ&pagesize=100&sortby=pubdate&citation_for_view=RKkOH2gAAAAJ:IjCSPb-OGe4C
RKkOH2gAAAAJ,35,The Fischer–Clifford Matrices of a Maximal Subgroup of the Sporadic Simple Group of Held,F Ali,"Algebra Colloquium 14 (01), 135-142",2007,https://scholar.google.com/scholar?oi=bibs&hl=en&cites=3713085423716065484,https://scholar.google.com/citations?view_op=view_citation&hl=en&user=RKkOH2gAAAAJ&pagesize=100&sortby=pubdate&citation_for_view=RKkOH2gAAAAJ:qjMakFHDy7sC
RKkOH2gAAAAJ,36,On the generation of the Conway groups by conjugate involutions,"F Ali, MAF Ibrahim","Algebras, Groups Geometries 24, 203-210",2007,https://scholar.google.com/scholar?oi=bibs&hl=en&cites=9859249243192788409,https://scholar.google.com/citations?view_op=view_citation&hl=en&user=RKkOH2gAAAAJ&pagesize=100&sortby=pubdate&citation_for_view=RKkOH2gAAAAJ:_FxGoFyzp5QC
RKkOH2gAAAAJ,37,On the ranks of HS and McL,"F Ali, MAF Ibrahim","Utilitas Mathematica 70 (2006), 187-195",2006,https://scholar.google.com/scholar?oi=bibs&hl=en&cites=28082668803025344,https://scholar.google.com/citations?view_op=view_citation&hl=en&user=RKkOH2gAAAAJ&pagesize=100&sortby=pubdate&citation_for_view=RKkOH2gAAAAJ:u5HHmVD_uO8C
RKkOH2gAAAAJ,38,On the ranks of Tits simple group 2F4 (2)′,"MAF Ibrahim, F Ali","WSEAS Transactions on Mathematics 5 (7), 838-843",2006,https://scholar.google.com/scholar?oi=bibs&hl=en&cites=956915319155644133,https://scholar.google.com/citations?view_op=view_citation&hl=en&user=RKkOH2gAAAAJ&pagesize=100&sortby=pubdate&citation_for_view=RKkOH2gAAAAJ:u-x6o8ySG0sC
RKkOH2gAAAAJ,39,ON THE RANKS OF THE CONWAY GROUPS Co2 AND Co3,"F Ali, MAF Ibrahim","Journal of Algebra and Its Applications 4 (05), 557-565",2005,https://scholar.google.com/scholar?oi=bibs&hl=en&cites=2772994603533140164,https://scholar.google.com/citations?view_op=view_citation&hl=en&user=RKkOH2gAAAAJ&pagesize=100&sortby=pubdate&citation_for_view=RKkOH2gAAAAJ:9yKSN-GCB0IC
RKkOH2gAAAAJ,40,Perceived cost in the utilization of antenatal care services by pregnant women in Abeokuta South,"AT Onajole, FA Ali, KA Odeyemi, BO Ogunnowo, ES Oridota","Nigerian Medical Practitioner 48 (4), 98-102",2005,https://scholar.google.com/scholar?oi=bibs&hl=en&cites=3706392607317630968,https://scholar.google.com/citations?view_op=view_citation&hl=en&user=RKkOH2gAAAAJ&pagesize=100&sortby=pubdate&citation_for_view=RKkOH2gAAAAJ:M3ejUd6NZC8C
RKkOH2gAAAAJ,41,Fischer-Clifford matrices and character table of the group 27: Sp6 (2),"F Ali, J Moori","Int. J. Math. Game Theory and Algebra 14, 101-121",2004,https://scholar.google.com/scholar?oi=bibs&hl=en&cites=5141585167298969794,https://scholar.google.com/citations?view_op=view_citation&hl=en&user=RKkOH2gAAAAJ&pagesize=100&sortby=pubdate&citation_for_view=RKkOH2gAAAAJ:UeHWp8X0CEIC
RKkOH2gAAAAJ,42,The Fischer-Clifford matrices of a maximal subgroup of 𝐹𝑖′ ₂₄,"F Ali, J Moori","Representation Theory of the American Mathematical Society 7 (14), 300-321",2003,https://scholar.google.com/scholar?oi=bibs&hl=en&cites=2811845648024139431,https://scholar.google.com/citations?view_op=view_citation&hl=en&user=RKkOH2gAAAAJ&pagesize=100&sortby=pubdate&citation_for_view=RKkOH2gAAAAJ:2osOgNQ5qMEC
RKkOH2gAAAAJ,43,PK ISSN 0022-2941,"F ALI, TY MINHAS","Journal of Natural Sciences and Mathematics 37, 147",1997,https://scholar.google.com/scholar?oi=bibs&hl=en&cites=NA,""
RKkOH2gAAAAJ,44,Some Fixed Point Theorems for Expansive Mappings on Riez Spaces,"F Ali, TY Minhas","JOURNAL OF NATURAL SCIENCES AND MATHEMATICS-LAHORE- 37, 155-164",1997,https://scholar.google.com/scholar?oi=bibs&hl=en&cites=NA,""
RKkOH2gAAAAJ,45,Fixed points in vector lattices for generalized contractions,"I Beg, F Ali","DEPARTMENT OF MATHEMATICS ‘UNIVERSITY OF THE PUNJAB LAHORE- -54590 PAKISTAN, 63",1993,https://scholar.google.com/scholar?oi=bibs&hl=en&cites=7820063980027995541,https://scholar.google.com/citations?view_op=view_citation&hl=en&user=RKkOH2gAAAAJ&pagesize=100&sortby=pubdate&citation_for_view=RKkOH2gAAAAJ:YsMSGLbcyi4C
RKkOH2gAAAAJ,46,Some fixed point theorems in convex metric spaces,"I Beg, A Azam, F Ali, T Minhas","Rendiconti del Circolo Matematico di Palermo 40, 307-315",1991,https://scholar.google.com/scholar?oi=bibs&hl=en&cites=17144746873634518796,https://scholar.google.com/citations?view_op=view_citation&hl=en&user=RKkOH2gAAAAJ&pagesize=100&sortby=pubdate&citation_for_view=RKkOH2gAAAAJ:kNdYIx-mwKoC
RKkOH2gAAAAJ,47,The effect of white noise on the structural parameters of ABCCC system in oriented NMR spectrum,"KH Hashem, FA Ali","Egyptian Journal of Chemistry 30 (2), 97-108",1987,https://scholar.google.com/scholar?oi=bibs&hl=en&cites=15644267021611965904,https://scholar.google.com/citations?view_op=view_citation&hl=en&user=RKkOH2gAAAAJ&pagesize=100&sortby=pubdate&citation_for_view=RKkOH2gAAAAJ:RGFaLdJalmkC
RKkOH2gAAAAJ,48,LINKAGE OF UNIT OPERATIONS FOR LOW BTU COAL-GASIFICATION WASTE TREATMENT,"RD NEUFELD, C MORETTI, F ALI","ABSTRACTS OF PAPERS OF THE AMERICAN CHEMICAL SOCIETY 182 (AUG), 37-ENVR",1981,https://scholar.google.com/scholar?oi=bibs&hl=en&cites=NA,""
