Scholar ID,Paper Number,Paper Title,Authors,"Publication (journal name. volume, no. pages)",Year,Cited_by,Link
UwASpVMAAAAJ,1,"Synthesis, X-ray structure and anticancer activity evaluation of a binuclear La (III) complex with anthranilic acid","ASA Zidan, HK Mosbah, AAM Aly, ABM Ibrahim, P Mayer, SH Saber","Natural Product Research 38 (8), 1414-1423",2024,https://scholar.google.com/scholar?oi=bibs&hl=en&cites=13667910279171893768,https://scholar.google.com/citations?view_op=view_citation&hl=en&user=UwASpVMAAAAJ&pagesize=100&sortby=pubdate&citation_for_view=UwASpVMAAAAJ:5nxA0vEk-isC
UwASpVMAAAAJ,2,"Antimony complexes with SNN thiosemicarbazones: Synthesis, structural studies and cytotoxicity against bacterial and cancer cells","ABM Ibrahim, MS Al-Fakeh, A Fathy, S Abd Elkhalik, A Villinger, ...","Journal of Molecular Structure 1313, 138704",2024,https://scholar.google.com/scholar?oi=bibs&hl=en&cites=NA,""
UwASpVMAAAAJ,3,"Structural investigations and antibacterial, antifungal and anticancer studies on zinc salicylaldimine complexes","ABM Ibrahim, ES Williem, SA Elkhalik, A Villinger, SM Abbas",Future Medicinal Chemistry 1-10,2024,https://scholar.google.com/scholar?oi=bibs&hl=en&cites=NA,""
UwASpVMAAAAJ,4,"La (III), Ce (III), Pr (III) and Eu (III) complexes with fenamic acid based ligands: preparation, spectral and thermal analysis and evaluation of their cytotoxicity in MDA-MB …","HK Mosbah, ABM Ibrahim, ASA Zidan, AAM Aly, SH Saber","Journal of the Iranian Chemical Society 21 (6), 1681-1689",2024,https://scholar.google.com/scholar?oi=bibs&hl=en&cites=NA,""
UwASpVMAAAAJ,5,Ultrasound irradiation of hydrothermally engineered sub-20 nm PbS nanoparticles and effect of their size on Aspergillus species morphology,"GAE Mahmoud, ABM Ibrahim","Mendeleev Communications 34 (1), 93-96",2024,https://scholar.google.com/scholar?oi=bibs&hl=en&cites=NA,""
UwASpVMAAAAJ,6,"New iron (III) complexes with 2-formylpyridine thiosemicarbazones: Synthetic aspects, structural and spectral analyses and cytotoxicity screening against MCF-7 human cancer cells","A Fathy, ABM Ibrahim, S Abd Elkhalik, A Villinger, SM Abbas","Heliyon 9 (1), e13008",2023,https://scholar.google.com/scholar?oi=bibs&hl=en&cites=5223161729545335106,https://scholar.google.com/citations?view_op=view_citation&hl=en&user=UwASpVMAAAAJ&pagesize=100&sortby=pubdate&citation_for_view=UwASpVMAAAAJ:kNdYIx-mwKoC
UwASpVMAAAAJ,7,"(NH4) 2 [Co (H2O) 6] 2V10O28· 4H2O Vs.(NH4) 2 [Ni (H2O) 6] 2V10O28· 4H2O: Structural, Spectral and Thermal Analyses and Evaluation of Their Antibacterial Activities","AA Mamdouh, ABM Ibrahim, NEHA Reyad, TR Elsayed, IC Santos, ...","Journal of Cluster Science 34, 1535-1546",2023,https://scholar.google.com/scholar?oi=bibs&hl=en&cites=1727164833741749672,https://scholar.google.com/citations?view_op=view_citation&hl=en&user=UwASpVMAAAAJ&pagesize=100&sortby=pubdate&citation_for_view=UwASpVMAAAAJ:roLk4NBRz8UC
UwASpVMAAAAJ,8,"Synthesis, Solid State Structure, and Cytotoxic Activity of a Complex Dimer of Yttrium with Anthranilic Acid against Cancer Cells","ASA Zidan, ABM Ibrahim, AAM Aly, HK Mosbah, P Mayer, SH Saber","Biological Trace Element Research 201, 4688-4696",2023,https://scholar.google.com/scholar?oi=bibs&hl=en&cites=14002658705240547112,https://scholar.google.com/citations?view_op=view_citation&hl=en&user=UwASpVMAAAAJ&pagesize=100&sortby=pubdate&citation_for_view=UwASpVMAAAAJ:8k81kl-MbHgC
UwASpVMAAAAJ,9,Response to oxidative stress generation in Rhodotorula glutinis and Candida tropicalis by thallium dithiocarbamate complexes,"GAE Mahmoud, P Mayer, DA Gaber, ABM Ibrahim","Inorganic Chemistry Communications 156, 111283",2023,https://scholar.google.com/scholar?oi=bibs&hl=en&cites=NA,""
UwASpVMAAAAJ,10,In Vitro Biological Activity of Cobalt(II) Complexes With Salicylaldimine Ligands in Microbial and Cancer Cells,"ES Williem, ABM Ibrahim, SA Elkhalik, J Marek, SM Abbas","Future Medicinal Chemistry 15 (15), 1415-1426",2023,https://scholar.google.com/scholar?oi=bibs&hl=en&cites=NA,""
UwASpVMAAAAJ,11,"A Novel Trinuclear Nickel (II) Salicylaldimine Complex: Synthesis, Structural Characterization, Bioactivity Profile against Bacterial, Fungal and Breast Cancer Cells and …","ES Williem, A Amro, ABM Ibrahim, S Abd Elkhalik, P Mayer, SM Abbas","Crystals 13 (7), 1084",2023,https://scholar.google.com/scholar?oi=bibs&hl=en&cites=NA,""
UwASpVMAAAAJ,12,Binuclear Cu (II) complex based on N-acetylanthranilic acid induces significant cytotoxic effect on three cancer cell lines,"AAM Aly, ASA Zidan, ABM Ibrahim, HK Mosbah, P Mayer, SH Saber","Journal of Molecular Structure 1249, 131634",2022,https://scholar.google.com/scholar?oi=bibs&hl=en&cites=3788161521900029791,https://scholar.google.com/citations?view_op=view_citation&hl=en&user=UwASpVMAAAAJ&pagesize=100&sortby=pubdate&citation_for_view=UwASpVMAAAAJ:WF5omc3nYNoC
UwASpVMAAAAJ,13,"Trivalent Cobalt Complexes with NNS Tridentate Thiosemicarbazones: Preparation, Structural Study and Investigation of Antibacterial Activity and Cytotoxicity against Human …","A Fathy, ABM Ibrahim, S Abd Elkhalik, A Villinger, SM Abbas","Inorganics 10 (9), 145",2022,https://scholar.google.com/scholar?oi=bibs&hl=en&cites=8035042849243591642,https://scholar.google.com/citations?view_op=view_citation&hl=en&user=UwASpVMAAAAJ&pagesize=100&sortby=pubdate&citation_for_view=UwASpVMAAAAJ:Se3iqnhoufwC
UwASpVMAAAAJ,14,"Thiosemicarbazones and Derived Antimony Complexes: Synthesis, Structural Analysis, and In Vitro Evaluation against Bacterial, Fungal, and Cancer Cells","A Fathy, ABM Ibrahim, S Abd Elkhalik, F Meurer, M Bodensteiner, ...","Inorganics 10 (10), 172",2022,https://scholar.google.com/scholar?oi=bibs&hl=en&cites=15240769122456430534,https://scholar.google.com/citations?view_op=view_citation&hl=en&user=UwASpVMAAAAJ&pagesize=100&sortby=pubdate&citation_for_view=UwASpVMAAAAJ:0EnyYjriUFMC
UwASpVMAAAAJ,15,Isolation and crystal structure of the first Pr (IV) coordination polymer and the complex anti-proliferative activity evaluation against seven cancer cell lines,"AAM Aly, ABM Ibrahim, ASA Zidan, HK Mosbah, SA Atta, I Schicht, ...","Journal of Molecular Structure 1256, 132508",2022,https://scholar.google.com/scholar?oi=bibs&hl=en&cites=17900360785581633454,https://scholar.google.com/citations?view_op=view_citation&hl=en&user=UwASpVMAAAAJ&pagesize=100&sortby=pubdate&citation_for_view=UwASpVMAAAAJ:_FxGoFyzp5QC
UwASpVMAAAAJ,16,Pb (II) and Hg (II) thiosemicarbazones for inhibiting the broad‐spectrum pathogen Cladosporium sphaerospermum ASU18 (MK387875) and altering its antioxidant …,"ABM Ibrahim, GAE Mahmoud, DB Cordes, AMZ Slawin","Applied Organometallic Chemistry 36 (8), e6798",2022,https://scholar.google.com/scholar?oi=bibs&hl=en&cites=14521383029350458352,https://scholar.google.com/citations?view_op=view_citation&hl=en&user=UwASpVMAAAAJ&pagesize=100&sortby=pubdate&citation_for_view=UwASpVMAAAAJ:LkGwnXOMwfcC
UwASpVMAAAAJ,17,Monoclinic-vs. triclinic-(NH4) 2 [Mg (H2O) 6] 2V10O28∙ 4H2O: Structural studies and variation in antibacterial activities with the polymorph type,"AA Mamdouh, ABM Ibrahim, NEHA Reyad, TR Elsayed, IC Santos, ...","Journal of Molecular Structure 1253, 132247",2022,https://scholar.google.com/scholar?oi=bibs&hl=en&cites=7329889417603057616,https://scholar.google.com/citations?view_op=view_citation&hl=en&user=UwASpVMAAAAJ&pagesize=100&sortby=pubdate&citation_for_view=UwASpVMAAAAJ:ufrVoPGSRksC
UwASpVMAAAAJ,18,Chemical‐vs sonochemical‐assisted synthesis of ZnO nanoparticles from a new zinc complex for improvement of carotene biosynthesis from Rhodotorula toruloides MH023518,"ABM Ibrahim, GAE Mahmoud","Applied Organometallic Chemistry 35 (2), e6086",2021,https://scholar.google.com/scholar?oi=bibs&hl=en&cites=9203318587390151790,https://scholar.google.com/citations?view_op=view_citation&hl=en&user=UwASpVMAAAAJ&pagesize=100&sortby=pubdate&citation_for_view=UwASpVMAAAAJ:Y0pCki6q_DkC
UwASpVMAAAAJ,19,(NH4)2[Ni(H2O)6]2V10O28 ⋅ 4H2O; Structural Analysis and Bactericidal Activity against Pathogenic Gram Negative Bacteria,"GAE Mahmoud, ABM Ibrahim, P Mayer","ChemistrySelect 6 (15), 3782-3787",2021,https://scholar.google.com/scholar?oi=bibs&hl=en&cites=725157073401151370,https://scholar.google.com/citations?view_op=view_citation&hl=en&user=UwASpVMAAAAJ&pagesize=100&sortby=pubdate&citation_for_view=UwASpVMAAAAJ:eQOLeE2rZwMC
UwASpVMAAAAJ,20,Preparation and crystallographic studies of a new mercuric salicylaldimine complex for fabrication of microscaled and nanoscaled mercuric sulfide as antimicrobial agents …,"ABM Ibrahim, GAE Mahmoud, F Meurer, M Bodensteiner","Applied Organometallic Chemistry 35 (3), e6134",2021,https://scholar.google.com/scholar?oi=bibs&hl=en&cites=6082061489905037080,https://scholar.google.com/citations?view_op=view_citation&hl=en&user=UwASpVMAAAAJ&pagesize=100&sortby=pubdate&citation_for_view=UwASpVMAAAAJ:W7OEmFMy1HYC
UwASpVMAAAAJ,21,Zn(II) and Cd(II) thiosemicarbazones for stimulation/inhibition of kojic acid biosynthesis from Aspergillus flavus and the fungal defense behavior against the metal …,"GAE Mahmoud, ABM Ibrahim, P Mayer","JBIC Journal of Biological Inorganic Chemistry 25, 797-809",2020,https://scholar.google.com/scholar?oi=bibs&hl=en&cites=7945051657330479849,https://scholar.google.com/citations?view_op=view_citation&hl=en&user=UwASpVMAAAAJ&pagesize=100&sortby=pubdate&citation_for_view=UwASpVMAAAAJ:Tyk-4Ss8FVUC
UwASpVMAAAAJ,22,Mesoporous cadmium sulfide nanoparticles derived from a new cadmium anthranilato complex: characterization and induction of morphological abnormalities in pathogenic fungi,"ABM Ibrahim, ASA Zidan, AAM Aly, HK Mosbah, GAE Mahmoud","Applied Organometallic Chemistry 34 (2), e5391",2020,https://scholar.google.com/scholar?oi=bibs&hl=en&cites=6875626435994637011,https://scholar.google.com/citations?view_op=view_citation&hl=en&user=UwASpVMAAAAJ&pagesize=100&sortby=pubdate&citation_for_view=UwASpVMAAAAJ:zYLM7Y9cAGgC
UwASpVMAAAAJ,23,Calcium and strontium anthranilato complexes as effective Fusarium moniliforme controlling agents,"G Abd‐Elmonsef Mahmoud, ASA Zidan, AAM Aly, HK Mosbah, ...","Applied Organometallic Chemistry 33 (2), e4740",2019,https://scholar.google.com/scholar?oi=bibs&hl=en&cites=371052407083504804,https://scholar.google.com/citations?view_op=view_citation&hl=en&user=UwASpVMAAAAJ&pagesize=100&sortby=pubdate&citation_for_view=UwASpVMAAAAJ:qjMakFHDy7sC
UwASpVMAAAAJ,24,Nonstoichiometric Mesoporous Cu1.90S Nanoparticles Hydrothermally Prepared from a Copper Anthranilato Complex Inhibit Cellulases of Phytopathogenic Fungi,GAEM Ahmed B. M. Ibrahim,"Journal of Inorganic and Organometallic Polymers and Materials 29 (4), 1280–1287",2019,https://scholar.google.com/scholar?oi=bibs&hl=en&cites=4056843884628802402,https://scholar.google.com/citations?view_op=view_citation&hl=en&user=UwASpVMAAAAJ&pagesize=100&sortby=pubdate&citation_for_view=UwASpVMAAAAJ:IjCSPb-OGe4C
UwASpVMAAAAJ,25,"Synthesis, structural studies and antimicrobial evaluation of nickel (II) complexes of NNS tridentate thiosemicarbazone based ligands","ABM Ibrahim, MK Farh, P Mayer","Applied Organometallic Chemistry 33 (7), e4883",2019,https://scholar.google.com/scholar?oi=bibs&hl=en&cites=10518149665049739335,https://scholar.google.com/citations?view_op=view_citation&hl=en&user=UwASpVMAAAAJ&pagesize=100&sortby=pubdate&citation_for_view=UwASpVMAAAAJ:2osOgNQ5qMEC
UwASpVMAAAAJ,26,"Nickel complexes bearing SNN and SS donor atom ligands: synthesis, structural characterization and biological activity","ABM Ibrahim, MK Farh, IC Santos, A Paulo","Applied Organometallic Chemistry 33 (9), e5088",2019,https://scholar.google.com/scholar?oi=bibs&hl=en&cites=6370642416788106683,https://scholar.google.com/citations?view_op=view_citation&hl=en&user=UwASpVMAAAAJ&pagesize=100&sortby=pubdate&citation_for_view=UwASpVMAAAAJ:9yKSN-GCB0IC
UwASpVMAAAAJ,27,"Copper Complexes of New Thiosemicarbazone Ligands: Synthesis, Structural Studies and Antimicrobial Activity","PM Ahmed B.M. Ibrahim, Micheal Farh","Inorganic Chemistry Communications 94, 127–132",2018,https://scholar.google.com/scholar?oi=bibs&hl=en&cites=8309915660145382303,https://scholar.google.com/citations?view_op=view_citation&hl=en&user=UwASpVMAAAAJ&pagesize=100&sortby=pubdate&citation_for_view=UwASpVMAAAAJ:u-x6o8ySG0sC
UwASpVMAAAAJ,28,"Synthesis, structural studies and antimicrobial activities of manganese, nickel and copper complexes of two new tridentate 2‑formylpyridine thiosemicarbazone ligands","ABM Ibrahim, MK Farh, SA El-Gyar, MA El-Gahami, DM Fouad, F Silva, ...","Inorganic Chemistry Communications 96, 194-201",2018,https://scholar.google.com/scholar?oi=bibs&hl=en&cites=5862669782806204788,https://scholar.google.com/citations?view_op=view_citation&hl=en&user=UwASpVMAAAAJ&pagesize=100&sortby=pubdate&citation_for_view=UwASpVMAAAAJ:YsMSGLbcyi4C
UwASpVMAAAAJ,29,"Synthesis, structural and antimicrobial studies of binary and ternary complexes of a new tridentate thiosemicarbazone","AB M Ibrahim, MK Farh, JR Plaisier, ESM Shalaby","Future Medicinal Chemistry 10 (21), 2507-2519",2018,https://scholar.google.com/scholar?oi=bibs&hl=en&cites=16743834426991520683,https://scholar.google.com/citations?view_op=view_citation&hl=en&user=UwASpVMAAAAJ&pagesize=100&sortby=pubdate&citation_for_view=UwASpVMAAAAJ:UeHWp8X0CEIC
UwASpVMAAAAJ,30,Electronic Structure of Titanylphthalocyanine Layers On Ag(111),"FS A. Lerch, L. Fernandez, M. Ilyn, M. Gastaldo, M. Paradinas, M. A ...","The Journal of Physical Chemistry C 121 (45), 25353–25363",2017,https://scholar.google.com/scholar?oi=bibs&hl=en&cites=7823280413862322549,https://scholar.google.com/citations?view_op=view_citation&hl=en&user=UwASpVMAAAAJ&pagesize=100&sortby=pubdate&citation_for_view=UwASpVMAAAAJ:u5HHmVD_uO8C
UwASpVMAAAAJ,31,"Synthesis and thermal studies on new Co (II), Ni (II), Cu (II) and Cd (II) mixed ligand complexes with 3-benzyl-4-amino-1, 2, 4-triazole-5-thione Schiff bases and α, α′-bipyridyl","DM Fouad, A Bayoumi, MAEH El-Gahami, SA Ibrahim, AM Hammam","Analytical Chemistry - An Indian Journal 10 (1), 13-23",2011,https://scholar.google.com/scholar?oi=bibs&hl=en&cites=NA,""
UwASpVMAAAAJ,32,"Synthesis and thermal studies of mixed ligand complexes of Cu (II), Co (II), Ni (II) and Cd (II) with mercaptotriazoles and dehydroacetic acid","DM Fouad, A Bayoumi, MA ElGahami, SA Ibrahim, AM Hammam","Natural Science 2 (8), 817-827",2010,https://scholar.google.com/scholar?oi=bibs&hl=en&cites=2745313953242074622,https://scholar.google.com/citations?view_op=view_citation&hl=en&user=UwASpVMAAAAJ&pagesize=100&sortby=pubdate&citation_for_view=UwASpVMAAAAJ:UebtZRa9Y70C
UwASpVMAAAAJ,33,"Cobalt complexes with bidentate (NO) versus monodentate (N) salicylaldimine ligands: Syntheses, crystal structures, and comparison in bioactivity profile against bacterial …","ES Williem, A Amro, ABM Ibrahim, SA Elkhalik, F Meurer, M Bodensteiner, ...","Applied Organometallic Chemistry, e e760",,https://scholar.google.com/scholar?oi=bibs&hl=en&cites=NA,""
