Scholar ID,Paper Number,Paper Title,Authors,"Publication (journal name. volume, no. pages)",Year,Cited_by,Link
wTP2TbQAAAAJ,1,"Green synthesis of magnesium oxide nanoparticles using endophytic fungal strain to improve the growth, metabolic activities, yield traits, and phenolic compounds content of …","MAA Amin, AM Abu-Elsaoud, AI Nowwar, AT Abdelwahab, MA Awad, ...","Green Processing and Synthesis 13 (1), 20230215",2024,https://scholar.google.com/scholar?oi=bibs&hl=en&cites=13198517742281306193,https://scholar.google.com/citations?view_op=view_citation&hl=en&user=wTP2TbQAAAAJ&pagesize=100&sortby=pubdate&citation_for_view=wTP2TbQAAAAJ:geHnlv5EZngC
wTP2TbQAAAAJ,2,"Bioaccumulation of heavy metals in water, sediments, and tissues and their histopathological effects on Unio tigridis (Bourguignat 1852)","HH Abdoul, N Khalloufi, M Bejaoui, N Al-Hoshani, F Boufahja, ...","Acta Geophysica 72 (4), 2653-2662",2024,https://scholar.google.com/scholar?oi=bibs&hl=en&cites=NA,""
wTP2TbQAAAAJ,3,"Does Erodium trifolium (Cav.) Guitt exhibit medicinal properties? Response elements from phytochemical profiling, enzyme-inhibiting, and antioxidant and …","A Bouhedda, H Laouer, N Souilah, C Çakır, N Bouriah, AM Abu-Elsaoud, ...","Open Chemistry 22 (1), 20240049",2024,https://scholar.google.com/scholar?oi=bibs&hl=en&cites=NA,""
wTP2TbQAAAAJ,4,"An Investigation of Two Cu (II)‐Based Hybrid Materials: Physico‐Chemical Characterization, Theoretical Calculation and Evaluation of The Inhibitory Activities against Key …","I Tababi, N Mhadhbi, A Ben Ahmed, J Erwann, K Hamden, A Guesmi, ...","ChemistrySelect 9 (20), e202400240",2024,https://scholar.google.com/scholar?oi=bibs&hl=en&cites=NA,""
wTP2TbQAAAAJ,5,"Optimization of polyphenol extraction, phenolic profile by LC-ESI-MS/MS, antioxidant, anti-enzymatic, and cytotoxic activities of Physalis acutifolia","L Derbak, H Bendif, R Ayad, C Bensouici, İ Yildiz, I Demirtas, K Rebbas, ...","Open Chemistry 22 (1), 20240040",2024,https://scholar.google.com/scholar?oi=bibs&hl=en&cites=NA,""
wTP2TbQAAAAJ,6,Investigating Sulforaphane’s anti-virulence and anti-quorum sensing properties against Pseudomonas aeruginosa,"MM Bendary, MAM Ali, AS Abdel Halim, F Boufahja, AA Chaudhary, ...","Frontiers in Pharmacology 15, 1406653",2024,https://scholar.google.com/scholar?oi=bibs&hl=en&cites=NA,""
wTP2TbQAAAAJ,7,Are microplastics efficient remediation tools for removing the statin Lipitor? A laboratory experiment with meiobenthic nematodes,"BM Aldraiwish, MM Alaqeel, N Al-Hoshani, S Özdemir, O Pacioglu, ...","Frontiers in Marine Science 11, 1390700",2024,https://scholar.google.com/scholar?oi=bibs&hl=en&cites=NA,""
wTP2TbQAAAAJ,8,Effect of Slow Maxillary Expansion and Alternative Rapid Maxillary Expansion Protocols on Airway Volume in Cleft Palate Cases: A Cone Beam Computed Tomography Based Study,"AMI Diab, BBH Mohammed, MM Ghoneim, MAM Ali, S Özdemir, ...",Cureus 16 (5),2024,https://scholar.google.com/scholar?oi=bibs&hl=en&cites=NA,""
wTP2TbQAAAAJ,9,"Doping zinc oxide and titanium dioxide nanoparticles with gold induces additional oxidative stress, membrane damage, and neurotoxicity in Mytilus galloprovincialis: Results …","I Bouzidi, A Khazri, K Mougin, W Bendhafer, AM Abu-Elsaoud, OA Plavan, ...","Journal of Trace Elements in Medicine and Biology 83, 127401",2024,https://scholar.google.com/scholar?oi=bibs&hl=en&cites=NA,""
wTP2TbQAAAAJ,10,The Impact of Silver Diamine Fluoride Only or Simultaneously With Potassium Iodide Treatment on the Bond Durability of Resin Composite Material on Primary Teeth,"NY Mohammed, DM Abdel-Ghany, NB Hamadi, S Özdemir, Z Selamoglu, ...",Cureus 16 (3),2024,https://scholar.google.com/scholar?oi=bibs&hl=en&cites=NA,""
wTP2TbQAAAAJ,11,The anti-staphylococcal fusidic acid as an efflux pump inhibitor combined with fluconazole against vaginal candidiasis in mouse model,"SE Gomaa, HA Abbas, FA Mohamed, MAM Ali, TM Ibrahim, ...","BMC microbiology 24 (1), 54",2024,https://scholar.google.com/scholar?oi=bibs&hl=en&cites=NA,""
wTP2TbQAAAAJ,12,"Antibacterial, Antioxidant and Physicochemical Properties of Pipper nigram Aided Copper Oxide Nanoparticles","J Aien, AA Khan, S Haq, AR Khan, K Elmnasri, M Ben Ali, MS Al-Harbi, ...","Crystals 13 (2), 330",2023,https://scholar.google.com/scholar?oi=bibs&hl=en&cites=17689126170443235048,https://scholar.google.com/citations?view_op=view_citation&hl=en&user=wTP2TbQAAAAJ&pagesize=100&sortby=pubdate&citation_for_view=wTP2TbQAAAAJ:dshw04ExmUIC
wTP2TbQAAAAJ,13,"Exploration and Evaluation of Secondary Metabolites from Trichoderma harzianum: GC-MS Analysis, Phytochemical Profiling, Antifungal and Antioxidant Activity …","W Lakhdari, I Benyahia, MM Bouhenna, H Bendif, H Khelafi, H Bachir, ...","Molecules 28 (13), 5025",2023,https://scholar.google.com/scholar?oi=bibs&hl=en&cites=6120074535787468838,https://scholar.google.com/citations?view_op=view_citation&hl=en&user=wTP2TbQAAAAJ&pagesize=100&sortby=pubdate&citation_for_view=wTP2TbQAAAAJ:XiSMed-E-HIC
wTP2TbQAAAAJ,14,"Ecotoxicity of chrysene and phenanthrene on meiobenthic nematodes with a case study of Terschellingia longicaudata: Taxonomics, toxicokinetics, and molecular interactions modelling","R Badraoui, M Allouche, D El Ouaer, AJ Siddiqui, S Ishak, A Hedfi, ...","Environmental Pollution 316, 120459",2023,https://scholar.google.com/scholar?oi=bibs&hl=en&cites=4391380984269221553,https://scholar.google.com/citations?view_op=view_citation&hl=en&user=wTP2TbQAAAAJ&pagesize=100&sortby=pubdate&citation_for_view=wTP2TbQAAAAJ:qxL8FJ1GzNcC
wTP2TbQAAAAJ,15,Relocating Glyceryl Trinitrate as an Anti-Virulence Agent against Pseudomonas aeruginosa and Serratia marcescens: Insights from Molecular and In Vivo …,"SI Nazeih, MAM Ali, ASA Halim, H Al-Lawati, HA Abbas, M Al-Zharani, ...","Microorganisms 11 (10), 2420",2023,https://scholar.google.com/scholar?oi=bibs&hl=en&cites=451139446837785220,https://scholar.google.com/citations?view_op=view_citation&hl=en&user=wTP2TbQAAAAJ&pagesize=100&sortby=pubdate&citation_for_view=wTP2TbQAAAAJ:l7t_Zn2s7bgC
wTP2TbQAAAAJ,16,"Phytochemicals, Antioxidant and Antimicrobial Potentials and LC-MS Analysis of Centaurea parviflora Desf. Extracts","FZ Hechaichi, H Bendif, C Bensouici, SA Alsalamah, B Zaidi, ...","Molecules 28 (5), 2263",2023,https://scholar.google.com/scholar?oi=bibs&hl=en&cites=4577683978422684222,https://scholar.google.com/citations?view_op=view_citation&hl=en&user=wTP2TbQAAAAJ&pagesize=100&sortby=pubdate&citation_for_view=wTP2TbQAAAAJ:UxriW0iASnsC
wTP2TbQAAAAJ,17,Effects of an Endocrine Disruptor Triclosan on Ruditapes decussatus: Multimarker and Histological Approaches,"A Added, N Khalloufi, A Khazri, AH Harrath, L Mansour, S Nahdi, ...","Animals 13 (3), 402",2023,https://scholar.google.com/scholar?oi=bibs&hl=en&cites=14504653923213727396,https://scholar.google.com/citations?view_op=view_citation&hl=en&user=wTP2TbQAAAAJ&pagesize=100&sortby=pubdate&citation_for_view=wTP2TbQAAAAJ:P5F9QuxV20EC
wTP2TbQAAAAJ,18,"Successive solvent extraction, characterization and antioxidant activities of cardoon waste (Leaves and Stems) extracts: comparative study","M Hajji Nabih, H Boulika, M El Hajam, MI Alghonaim, NI Kandri, ...","Molecules 28 (3), 1129",2023,https://scholar.google.com/scholar?oi=bibs&hl=en&cites=10403810897285450677,https://scholar.google.com/citations?view_op=view_citation&hl=en&user=wTP2TbQAAAAJ&pagesize=100&sortby=pubdate&citation_for_view=wTP2TbQAAAAJ:1sJd4Hv_s6UC
wTP2TbQAAAAJ,19,"The multifaceted effects of fluoranthene and polystyrene on the taxonomic composition and associated functional traits of marine meiofauna, by using single and mixture applications","M Bellakhal, S Ishak, N Al-Hoshani, AA Qurtam, M Al-Zharani, O Pacioglu, ...","Marine Pollution Bulletin 194, 115390",2023,https://scholar.google.com/scholar?oi=bibs&hl=en&cites=18433356703948623168,https://scholar.google.com/citations?view_op=view_citation&hl=en&user=wTP2TbQAAAAJ&pagesize=100&sortby=pubdate&citation_for_view=wTP2TbQAAAAJ:K3LRdlH-MEoC
wTP2TbQAAAAJ,20,Dual biocontrol potential of the entomopathogenic fungus Akanthomyces muscarius against Thaumetopoea pityocampa and plant pathogenic fungi,"A Saidi, S Mebdoua, D Mecelem, N Al-Hoshani, N Sadrati, F Boufahja, ...","Saudi Journal of Biological Sciences 30 (8), 103719",2023,https://scholar.google.com/scholar?oi=bibs&hl=en&cites=3545812888963356577,https://scholar.google.com/citations?view_op=view_citation&hl=en&user=wTP2TbQAAAAJ&pagesize=100&sortby=pubdate&citation_for_view=wTP2TbQAAAAJ:u9iWguZQMMsC
wTP2TbQAAAAJ,21,Metallic nanoparticles affect uptake of polycyclic aromatic hydrocarbons and impacts in the Mediterranean mussels Mytilus galloprovincialis,"I Bouzidi, B Sellami, A Boulanger, C Joyeux, AH Harrath, MF Albeshr, ...","Marine Pollution Bulletin 188, 114641",2023,https://scholar.google.com/scholar?oi=bibs&hl=en&cites=16543818732435569321,https://scholar.google.com/citations?view_op=view_citation&hl=en&user=wTP2TbQAAAAJ&pagesize=100&sortby=pubdate&citation_for_view=wTP2TbQAAAAJ:nb7KW1ujOQ8C
wTP2TbQAAAAJ,22,How toxic is the COVID-19 drug azithromycin in the presence of Posidonia oceanica? Toxicokinetics and experimental approach of meiobenthic nematodes from a metallically …,"R Badraoui, G Mannai, AJ Siddiqui, O Pacioglu, HA Rudayni, F Boufahja, ...","Environmental Pollution 319, 121007",2023,https://scholar.google.com/scholar?oi=bibs&hl=en&cites=18323229600849206902,https://scholar.google.com/citations?view_op=view_citation&hl=en&user=wTP2TbQAAAAJ&pagesize=100&sortby=pubdate&citation_for_view=wTP2TbQAAAAJ:CHSYGLWDkRkC
wTP2TbQAAAAJ,23,"In Vitro Antibacterial, Antioxidant, Anticholinesterase, and Antidiabetic Activities and Chemical Composition of Salvia balansae","A Mokhtar, T Souhila, B Nacéra, B Amina, MI Alghonaim, M Öztürk, ...","Molecules 28 (23), 7801",2023,https://scholar.google.com/scholar?oi=bibs&hl=en&cites=16872828710353829559,https://scholar.google.com/citations?view_op=view_citation&hl=en&user=wTP2TbQAAAAJ&pagesize=100&sortby=pubdate&citation_for_view=wTP2TbQAAAAJ:tS2w5q8j5-wC
wTP2TbQAAAAJ,24,Statistical Design and Optimization of Cr (VI) Adsorption onto Native and HNO3/NaOH Activated Cedar Sawdust Using AAS and a Response Surface Methodology …,"M El Hajam, N Idrissi Kandri, S Özdemir, G Plavan, N Ben Hamadi, ...","Molecules 28 (21), 7271",2023,https://scholar.google.com/scholar?oi=bibs&hl=en&cites=12001022303782416174,https://scholar.google.com/citations?view_op=view_citation&hl=en&user=wTP2TbQAAAAJ&pagesize=100&sortby=pubdate&citation_for_view=wTP2TbQAAAAJ:tOudhMTPpwUC
wTP2TbQAAAAJ,25,"The development of decontamination methods in coastal marine habitats by transplantation of the mussel Mytilus galloprovincialis (Lamarck, 1819): Comparison between in vivo and …","I Bouzidi, H Beyrem, E Mahmoudi, N Al-Hoshani, O Pacioglu, F Boufahja, ...","Marine Pollution Bulletin 193, 115230",2023,https://scholar.google.com/scholar?oi=bibs&hl=en&cites=10394517380704576736,https://scholar.google.com/citations?view_op=view_citation&hl=en&user=wTP2TbQAAAAJ&pagesize=100&sortby=pubdate&citation_for_view=wTP2TbQAAAAJ:Tiz5es2fbqcC
wTP2TbQAAAAJ,26,Separate and simultaneous effects of silver nanoparticles and arsenic on the taxonomic diversity of free-living marine nematodes,"A Hedfi, S Ishak, A Al Hebs, N Al-Hoshani, M Ben Ali, HA Rudayni, ...","Diversity 15 (7), 836",2023,https://scholar.google.com/scholar?oi=bibs&hl=en&cites=12540493905492798644,https://scholar.google.com/citations?view_op=view_citation&hl=en&user=wTP2TbQAAAAJ&pagesize=100&sortby=pubdate&citation_for_view=wTP2TbQAAAAJ:WbkHhVStYXYC
wTP2TbQAAAAJ,27,Possible Interaction between ZnS Nanoparticles and Phosphonates on Mediterranean Clams Ruditapes decussatus,"W Saidani, I Bouzidi, A Khazri, S Ghannem, I Aouani, A Fkiri, S Touil, ...","Molecules 28 (6), 2460",2023,https://scholar.google.com/scholar?oi=bibs&hl=en&cites=4560296508465363277,https://scholar.google.com/citations?view_op=view_citation&hl=en&user=wTP2TbQAAAAJ&pagesize=100&sortby=pubdate&citation_for_view=wTP2TbQAAAAJ:SP6oXDckpogC
wTP2TbQAAAAJ,28,Physiological Impairment and Biochemical Modifications Induced by Triclosan in Mediterranean Mussels,"I Bouzidi, K Mougin, H Beyrem, MI Alghonaim, SA Alsalamah, AA Qurtam, ...","Animals 13 (4), 583",2023,https://scholar.google.com/scholar?oi=bibs&hl=en&cites=2918489909644965545,https://scholar.google.com/citations?view_op=view_citation&hl=en&user=wTP2TbQAAAAJ&pagesize=100&sortby=pubdate&citation_for_view=wTP2TbQAAAAJ:KxtntwgDAa4C
wTP2TbQAAAAJ,29,"HPLC-DAD-MS Characterization, Antioxidant Activity, α-amylase Inhibition, Molecular Docking, and ADMET of Flavonoids from Fenugreek Seeds","ML Khenifi, T Serseg, P Migas, M Krauze-Baranowska, S Özdemir, ...","Molecules 28 (23), 7798",2023,https://scholar.google.com/scholar?oi=bibs&hl=en&cites=NA,""
wTP2TbQAAAAJ,30,Aquatic subterranean food webs: a review,"O Pacioglu, IM Tuşa, I Popa, C Iţcuş, GI Plăvan, F Boufahja, ŞC Baba","Global Ecology and Conservation, e e02704",2023,https://scholar.google.com/scholar?oi=bibs&hl=en&cites=NA,""
wTP2TbQAAAAJ,31,Are iron ore microparticles toxic for the European clam Ruditapes decussatus? Response elements from biomarker activities and in silico modeling,"M Aillal, A Khazri, N Al-Hoshani, F Boufahja, H Beyrem, MY Lafdal","Saudi Journal of Biological Sciences 30 (8), 103718",2023,https://scholar.google.com/scholar?oi=bibs&hl=en&cites=NA,""
wTP2TbQAAAAJ,32,Physicochemical Analysis and Wound Healing Activity of Azadirachta indica (A. Juss) Fruits,"A Boukeloua, M Kouadria, H Bendif, G Plavan, SA Alsalamah, ...","Processes 11 (6), 1692",2023,https://scholar.google.com/scholar?oi=bibs&hl=en&cites=NA,""
wTP2TbQAAAAJ,33,"Comprehensive environmental assessment of heavy metal contamination of surface water, sediments and Nile Tilapia in Lake Nasser, Egypt","R Rizk, T Juzsakova, MB Ali, MA Rawash, E Domokos, A Hedfi, M Almalki, ...","Journal of King Saud University-Science 34 (1), 101748",2022,https://scholar.google.com/scholar?oi=bibs&hl=en&cites=1322575920464427245,https://scholar.google.com/citations?view_op=view_citation&hl=en&user=wTP2TbQAAAAJ&pagesize=100&sortby=pubdate&citation_for_view=wTP2TbQAAAAJ:Y0pCki6q_DkC
wTP2TbQAAAAJ,34,Molecular interactions of polyvinyl chloride microplastics and beta-blockers (Diltiazem and Bisoprolol) and their effects on marine meiofauna: Combined in vivo and modeling study,"M Allouche, S Ishak, MB Ali, A Hedfi, M Almalki, PK Karachle, AH Harrath, ...","Journal of Hazardous Materials 431, 128609",2022,https://scholar.google.com/scholar?oi=bibs&hl=en&cites=4530210173637375970,https://scholar.google.com/citations?view_op=view_citation&hl=en&user=wTP2TbQAAAAJ&pagesize=100&sortby=pubdate&citation_for_view=wTP2TbQAAAAJ:Wp0gIr-vW9MC
wTP2TbQAAAAJ,35,The exposure to polyvinyl chloride microplastics and chrysene induces multiple changes in the structure and functionality of marine meiobenthic communities,"A Hedfi, MB Ali, M Korkobi, M Allouche, AH Harrath, H Beyrem, ...","Journal of Hazardous Materials 436, 129161",2022,https://scholar.google.com/scholar?oi=bibs&hl=en&cites=4510658046429773230,https://scholar.google.com/citations?view_op=view_citation&hl=en&user=wTP2TbQAAAAJ&pagesize=100&sortby=pubdate&citation_for_view=wTP2TbQAAAAJ:4DMP91E08xMC
wTP2TbQAAAAJ,36,Effectiveness of Shewanella oneidensis bioaugmentation in the bioremediation of phenanthrene-contaminated sediments and possible consortia with omnivore-carnivore meiobenthic …,"M Yeferni, OB Saïd, E Mahmoudi, N Essid, A Hedfi, M Almalki, O Pacioglu, ...","Environmental Pollution 292, 118281",2022,https://scholar.google.com/scholar?oi=bibs&hl=en&cites=1795532728262365851,https://scholar.google.com/citations?view_op=view_citation&hl=en&user=wTP2TbQAAAAJ&pagesize=100&sortby=pubdate&citation_for_view=wTP2TbQAAAAJ:eQOLeE2rZwMC
wTP2TbQAAAAJ,37,The antidepressants amitriptyline and paroxetine induce changes in the structure and functional traits of marine nematodes,"S Ishak, M Allouche, A Nasri, AH Harrath, S Alwasel, G Plăvan, H Beyrem, ...","Sustainability 14 (10), 6100",2022,https://scholar.google.com/scholar?oi=bibs&hl=en&cites=1858184204646284477,https://scholar.google.com/citations?view_op=view_citation&hl=en&user=wTP2TbQAAAAJ&pagesize=100&sortby=pubdate&citation_for_view=wTP2TbQAAAAJ:WF5omc3nYNoC
wTP2TbQAAAAJ,38,Effects of the antidepressant paroxetine on migratory behaviour of meiobenthic nematodes: Computational and open experimental microcosm approach,"S Ishak, M Allouche, AH Harrath, S Alwasel, H Beyrem, O Pacioglu, ...","Marine Pollution Bulletin 177, 113558",2022,https://scholar.google.com/scholar?oi=bibs&hl=en&cites=5697209011550499338,https://scholar.google.com/citations?view_op=view_citation&hl=en&user=wTP2TbQAAAAJ&pagesize=100&sortby=pubdate&citation_for_view=wTP2TbQAAAAJ:IWHjjKOFINEC
wTP2TbQAAAAJ,39,"Physiological Responses of the Bivalves Mytilus galloprovincialis and Ruditapes decussatus Following Exposure to Phenanthrene: Toxicokinetics, Dynamics and …","M Dellali, K Mardassi, AH Harrath, L Mansour, O Pacioglu, W Aldahmash, ...","Animals 13 (1), 151",2022,https://scholar.google.com/scholar?oi=bibs&hl=en&cites=14591383141859822672,https://scholar.google.com/citations?view_op=view_citation&hl=en&user=wTP2TbQAAAAJ&pagesize=100&sortby=pubdate&citation_for_view=wTP2TbQAAAAJ:g5m5HwL7SMYC
wTP2TbQAAAAJ,40,Assessing metallic pollution using taxonomic diversity of offshore meiobenthic copepods,"J Amorri, G Veit-Köhler, F Boufahja, OH Abd-Elkader, G Plavan, ...","Sustainability 14 (23), 15670",2022,https://scholar.google.com/scholar?oi=bibs&hl=en&cites=6906782297962704599,https://scholar.google.com/citations?view_op=view_citation&hl=en&user=wTP2TbQAAAAJ&pagesize=100&sortby=pubdate&citation_for_view=wTP2TbQAAAAJ:R3hNpaxXUhUC
wTP2TbQAAAAJ,41,The survey of ectoparasites on two species of Triakids (Mustelus mustelus and M. punctulatus) sharks from Tunisian coasts,"B Benmansour, F Youssef, MB Ali, B Albogami, F Boufahja","Saudi Journal of Biological Sciences 29 (5), 3610-3616",2022,https://scholar.google.com/scholar?oi=bibs&hl=en&cites=4582623279379404549,https://scholar.google.com/citations?view_op=view_citation&hl=en&user=wTP2TbQAAAAJ&pagesize=100&sortby=pubdate&citation_for_view=wTP2TbQAAAAJ:mVmsd5A6BfQC
wTP2TbQAAAAJ,42,Benthic-pelagic coupling under juvenile oyster influence in a French Mediterranean coastal lagoon (Thau Lagoon),"É Lacoste, B Bec, P Le Gall, F Boufahja, P Raimbault, G Messiaen, ...","Estuarine, Coastal and Shelf Science 267, 107779",2022,https://scholar.google.com/scholar?oi=bibs&hl=en&cites=8264579135050838664,https://scholar.google.com/citations?view_op=view_citation&hl=en&user=wTP2TbQAAAAJ&pagesize=100&sortby=pubdate&citation_for_view=wTP2TbQAAAAJ:4JMBOYKVnBMC
wTP2TbQAAAAJ,43,How effective is wastewater treatment? A case study under the light of taxonomic and feeding features of meiobenthic nematodes,"M Mahmoudi, W Bejaoui, MB Ali, A Hedfi, M Almalki, N Essid, ...","Environmental Science and Pollution Research 29 (2), 2566-2578",2022,https://scholar.google.com/scholar?oi=bibs&hl=en&cites=14063023717364505430,https://scholar.google.com/citations?view_op=view_citation&hl=en&user=wTP2TbQAAAAJ&pagesize=100&sortby=pubdate&citation_for_view=wTP2TbQAAAAJ:SeFeTyx0c_EC
wTP2TbQAAAAJ,44,What Is the Impact of Dexamethasone and Prednisolone Glucocorticoids on the Structure of Meiobenthic Nematode Communities?,"M Allouche, S Ishak, A Nasri, AH Harrath, S Alwasel, H Beyrem, ...","Sustainability 14 (9), 5344",2022,https://scholar.google.com/scholar?oi=bibs&hl=en&cites=NA,""
wTP2TbQAAAAJ,45,"Toxicity of hydroxychloroquine, a potential treatment for COVID-19, on free-living marine nematodes","MB Ali, A Hedfi, M Almalki, PK Karachle, F Boufahja","Marine Pollution Bulletin 167, 112361",2021,https://scholar.google.com/scholar?oi=bibs&hl=en&cites=3409691800224312580,https://scholar.google.com/citations?view_op=view_citation&hl=en&user=wTP2TbQAAAAJ&pagesize=100&sortby=pubdate&citation_for_view=wTP2TbQAAAAJ:ULOm3_A8WrAC
wTP2TbQAAAAJ,46,"Nematode traits after separate and simultaneous exposure to Polycyclic Aromatic Hydrocarbons (anthracene, pyrene and benzo [a] pyrene) in closed and open microcosms","A Hedfi, MB Ali, MM Hassan, B Albogami, SS Al-Zahrani, E Mahmoudi, ...","Environmental Pollution 276, 116759",2021,https://scholar.google.com/scholar?oi=bibs&hl=en&cites=3941765947770585183,https://scholar.google.com/citations?view_op=view_citation&hl=en&user=wTP2TbQAAAAJ&pagesize=100&sortby=pubdate&citation_for_view=wTP2TbQAAAAJ:_kc_bZDykSQC
wTP2TbQAAAAJ,47,Impacts of nanoparticles and phosphonates in the behavior and oxidative status of the mediterranean mussels (Mytilus galloprovincialis),"B Sellami, I Bouzidi, A Hedfi, M Almalki, R Rizk, O Pacioglu, F Boufahja, ...","Saudi Journal of Biological Sciences 28 (11), 6365-6374",2021,https://scholar.google.com/scholar?oi=bibs&hl=en&cites=12441259233452204762,https://scholar.google.com/citations?view_op=view_citation&hl=en&user=wTP2TbQAAAAJ&pagesize=100&sortby=pubdate&citation_for_view=wTP2TbQAAAAJ:vV6vV6tmYwMC
wTP2TbQAAAAJ,48,Physicochemical Characterization of Cardoon “Cynara cardunculus” Wastes (Leaves and Stems): A Comparative Study,"M Hajji Nabih, M El Hajam, H Boulika, MM Hassan, N Idrissi Kandri, ...","Sustainability 13 (24), 13905",2021,https://scholar.google.com/scholar?oi=bibs&hl=en&cites=9464655608929961596,https://scholar.google.com/citations?view_op=view_citation&hl=en&user=wTP2TbQAAAAJ&pagesize=100&sortby=pubdate&citation_for_view=wTP2TbQAAAAJ:TFP_iSt0sucC
wTP2TbQAAAAJ,49,"Meiobenthic nematode Oncholaimus campylocercoides as a model in laboratory studies: selection, culture, and fluorescence microscopy after exposure to …","M Allouche, A Nasri, AH Harrath, L Mansour, S Alwasel, H Beyrem, ...","Environmental Science and Pollution Research 28, 29484-29497",2021,https://scholar.google.com/scholar?oi=bibs&hl=en&cites=2789298851603973104,https://scholar.google.com/citations?view_op=view_citation&hl=en&user=wTP2TbQAAAAJ&pagesize=100&sortby=pubdate&citation_for_view=wTP2TbQAAAAJ:8k81kl-MbHgC
wTP2TbQAAAAJ,50,Ecotoxicity of polybrominated diphenyl ether (BDE-47) on a meiobenthic community with special emphasis on nematodes: Taxonomic and trophic diversity assessment,"A Nasri, M Allouche, A Hannachi, B Barhoumi, A Wahbi, AH Harrath, ...","Environmental Pollution 277, 116727",2021,https://scholar.google.com/scholar?oi=bibs&hl=en&cites=6922362961697396757,https://scholar.google.com/citations?view_op=view_citation&hl=en&user=wTP2TbQAAAAJ&pagesize=100&sortby=pubdate&citation_for_view=wTP2TbQAAAAJ:e5wmG9Sq2KIC
wTP2TbQAAAAJ,51,Effects of Au/TiO2 metallic nanoparticles on Unio ravoisieri: assessment through an oxidative stress and toxicity biomarkers,"M Dellali, A Khallouli, AH Harrath, F Falodah, S Alwasel, H Beyrem, ...","Environmental Science and Pollution Research 28, 18176-18185",2021,https://scholar.google.com/scholar?oi=bibs&hl=en&cites=5732638280291567011,https://scholar.google.com/citations?view_op=view_citation&hl=en&user=wTP2TbQAAAAJ&pagesize=100&sortby=pubdate&citation_for_view=wTP2TbQAAAAJ:qUcmZB5y_30C
wTP2TbQAAAAJ,52,"Effects of ferroelectric oxides of barium strontium titanate (Ba0. 85Sr0. 15TiO3) nanoparticles on Ruditapes decussatus assessed through chemical, physiological, and …","M Zaoui, B Sellami, F Boufahja, F Faloda, S Nahdi, A Alrezaki, S Alwasel, ...","Chemosphere 265, 129078",2021,https://scholar.google.com/scholar?oi=bibs&hl=en&cites=4436162421700472368,https://scholar.google.com/citations?view_op=view_citation&hl=en&user=wTP2TbQAAAAJ&pagesize=100&sortby=pubdate&citation_for_view=wTP2TbQAAAAJ:aqlVkmm33-oC
wTP2TbQAAAAJ,53,"Using meiobenthic taxa, nematofauna biological traits, and bacterial abundance to assess the effects of the polybrominated diphenyl ethers compound: Case study of tetrabromo …","A Nasri, A Hannachi, M Allouche, B Barhoumi, T Barkaoui, A Wahbi, ...","Science of The Total Environment 770, 145251",2021,https://scholar.google.com/scholar?oi=bibs&hl=en&cites=1126286137681654778,https://scholar.google.com/citations?view_op=view_citation&hl=en&user=wTP2TbQAAAAJ&pagesize=100&sortby=pubdate&citation_for_view=wTP2TbQAAAAJ:Tyk-4Ss8FVUC
wTP2TbQAAAAJ,54,Effects of benzo(a)pyrene on meiobenthic assemblage and biochemical biomarkers in an Oncholaimus campylocercoides (Nematoda) microcosm,"A Hedfi, MB Ali, A Noureldeen, M Almalki, R Rizk, E Mahmoudi, G Plăvan, ...",Environmental Science and Pollution Research 1-20,2021,https://scholar.google.com/scholar?oi=bibs&hl=en&cites=15893212796228158951,https://scholar.google.com/citations?view_op=view_citation&hl=en&user=wTP2TbQAAAAJ&pagesize=100&sortby=pubdate&citation_for_view=wTP2TbQAAAAJ:fPk4N6BV_jEC
wTP2TbQAAAAJ,55,Toxicity of silver nanoparticles on the clam Ruditapes decussatus assessed through biomarkers and clearance rate,"S Elyousfi, M Dellali, A Mezni, MB Ali, A Hedfi, M Almalki, A Mezni, ...","Materials Research Express 8 (10), 105005",2021,https://scholar.google.com/scholar?oi=bibs&hl=en&cites=3195549595199343811,https://scholar.google.com/citations?view_op=view_citation&hl=en&user=wTP2TbQAAAAJ&pagesize=100&sortby=pubdate&citation_for_view=wTP2TbQAAAAJ:kNdYIx-mwKoC
wTP2TbQAAAAJ,56,Does Lake Balaton affected by pollution? Assessment through surface water quality monitoring by using different assessment methods,"R Rizk, M Alameraw, MA Rawash, T Juzsakova, E Domokos, A Hedfi, ...","Saudi Journal of Biological Sciences 28 (9), 5250-5260",2021,https://scholar.google.com/scholar?oi=bibs&hl=en&cites=14232526479044983783,https://scholar.google.com/citations?view_op=view_citation&hl=en&user=wTP2TbQAAAAJ&pagesize=100&sortby=pubdate&citation_for_view=wTP2TbQAAAAJ:3s1wT3WcHBgC
