Scholar ID,Paper Number,Paper Title,Authors,"Publication (journal name. volume, no. pages)",Year,Cited_by,Link
XoYxbGcAAAAJ,1,Weighted Second Order Adams Inequality in the Whole Space ,"S Baraket, B Dridi, R Jaidane, F Mtiri","Bulletin of the Malaysian Mathematical Sciences Society 47 (4), 1-34",2024,https://scholar.google.com/scholar?oi=bibs&hl=en&cites=NA,""
XoYxbGcAAAAJ,2,On Caffarelli–Kohn–Nirenberg Type Problems with a Sign-Changing Term,"S Baraket, A Ben Ghorbal, GM Figueiredo","The Journal of Geometric Analysis 34 (5), 142",2024,https://scholar.google.com/scholar?oi=bibs&hl=en&cites=NA,""
XoYxbGcAAAAJ,3,Ground states of weighted 4D biharmonic equations with exponential growth,"S Baraket, B Dridi, R Jaidane, VD Rădulescu","Mathematical Methods in the Applied Sciences 47 (6), 5007-5030",2024,https://scholar.google.com/scholar?oi=bibs&hl=en&cites=NA,""
XoYxbGcAAAAJ,4,"Lower Characteristic, Weakly Quasi-compact and Application","S Baraket, A Jeribi","Results in Mathematics 79 (2), 86",2024,https://scholar.google.com/scholar?oi=bibs&hl=en&cites=NA,""
XoYxbGcAAAAJ,5,Ground states of biharmonic equations with logarithmic weights and critical exponential growth,"I Abid, S Baraket",Complex Variables and Elliptic Equations 1-22,2024,https://scholar.google.com/scholar?oi=bibs&hl=en&cites=NA,""
XoYxbGcAAAAJ,6,Least energy nodal solutions for a weighted -Schrödinger problem involving a continuous potential under exponential growth nonlinearity,"S Baraket, B Dridi, A Grine, R Jaidane","Boundary Value Problems 2024 (1), 20",2024,https://scholar.google.com/scholar?oi=bibs&hl=en&cites=NA,""
XoYxbGcAAAAJ,7,Blow-up solutions for a 4-dimensional semilinear elliptic system of Liouville type in some general cases,"S Baraket, AB Ghorbal, R Chetouane, A Grine","Boundary Value Problems 2024 (1), 21",2024,https://scholar.google.com/scholar?oi=bibs&hl=en&cites=NA,""
XoYxbGcAAAAJ,8,Sign-changing solutions for a weighted Schrödinger-Kirchhoff equation with double exponential nonlinearities growth,"S Baraket, R Chetouane, R Jaidane, W Mtaouaa","Reviews in Mathematical Physics 36 (3), 2450004-657",2024,https://scholar.google.com/scholar?oi=bibs&hl=en&cites=NA,""
XoYxbGcAAAAJ,9,Limiting profile of the blow-up solutions for the fourth-order nonlinear Emden-Fowler equation with a singular source.,"S Baraket, S Mahdaoui, T Ouni",Discrete & Continuous Dynamical Systems-Series S 16 (6),2023,https://scholar.google.com/scholar?oi=bibs&hl=en&cites=15997842233501680504,https://scholar.google.com/citations?view_op=view_citation&hl=en&user=XoYxbGcAAAAJ&pagesize=100&sortby=pubdate&citation_for_view=XoYxbGcAAAAJ:e5wmG9Sq2KIC
XoYxbGcAAAAJ,10,Weighted Schr¨odinger- Kirchhoff type problem in dimension 2 with non-linear double exponential growth,"S Baraket, R Jaidane","Filomat 37 (16), pp.5373-5398",2023,https://scholar.google.com/scholar?oi=bibs&hl=en&cites=4276262475618019002,https://scholar.google.com/citations?view_op=view_citation&hl=en&user=XoYxbGcAAAAJ&pagesize=100&sortby=pubdate&citation_for_view=XoYxbGcAAAAJ:R3hNpaxXUhUC
XoYxbGcAAAAJ,11,On the blowing up solutions of the 4-d general q-Kuramoto-Sivashinsky equation with exponentially “dominated” nonlinearity and singular weight,"S Baraket, S Mahdaoui, T Ouni",Opuscula Mathematica 43 (1),2023,https://scholar.google.com/scholar?oi=bibs&hl=en&cites=14403200850046044041,https://scholar.google.com/citations?view_op=view_citation&hl=en&user=XoYxbGcAAAAJ&pagesize=100&sortby=pubdate&citation_for_view=XoYxbGcAAAAJ:mB3voiENLucC
XoYxbGcAAAAJ,12,Generalized lower characteristic involving measures of non-strict singularity,"S Baraket, AB Ghorbal, A Jeribi","Topological Algebra and its Applications 11 (1), 20230106",2023,https://scholar.google.com/scholar?oi=bibs&hl=en&cites=NA,""
XoYxbGcAAAAJ,13,Signed and Sign-Changing Solutions for a Kirchhoff-Type Problem Involving the Weighted N-Laplacian with Critical Double Exponential Growth,"S Baraket, R Chetouane, R Jaidane",Vietnam Journal of Mathematics 1-22,2023,https://scholar.google.com/scholar?oi=bibs&hl=en&cites=NA,""
XoYxbGcAAAAJ,14,NONDEGENERACY OF THE ENTIRE SOLUTION FOR THE n-LAPLACE HENON EQUATION OF LIOUVILLE TYPE,"S BARAKET, R CHETOUANE, F MTIRI","proceedings of the romanian academy series A 24 (number 3/2023), 215/220",2023,https://scholar.google.com/scholar?oi=bibs&hl=en&cites=NA,""
XoYxbGcAAAAJ,15,SINGULAR LIMITING RADIAL SOLUTIONS FOR 4-DIMENSIONAL ELLIPTIC PROBLEM INVOLVING EXPONENTIALLY DOMINATED NONLINEARITY,"S BARAKET, R CHETOUANE, F MTIRI, M TRABELSI",Mathematical reports 25 (1),2023,https://scholar.google.com/scholar?oi=bibs&hl=en&cites=NA,""
XoYxbGcAAAAJ,16,On a weighted elliptic equation of N-Kirchhoff type with double exponential growth,"I Abid, S Baraket, R Jaidane","Demonstratio Mathematica 55 (1), 634-657",2022,https://scholar.google.com/scholar?oi=bibs&hl=en&cites=11483990954666781441,https://scholar.google.com/citations?view_op=view_citation&hl=en&user=XoYxbGcAAAAJ&pagesize=100&sortby=pubdate&citation_for_view=XoYxbGcAAAAJ:hC7cP41nSMkC
XoYxbGcAAAAJ,17,Singular limit solutions for a 4-dimensional semilinear elliptic system of Liouville type,"S Baraket, I Bazarbacha, R Chetouane, A Messaoudi","Taiwanese Journal of Mathematics 24 (4), 855-909",2020,https://scholar.google.com/scholar?oi=bibs&hl=en&cites=7697827620191197530,https://scholar.google.com/citations?view_op=view_citation&hl=en&user=XoYxbGcAAAAJ&pagesize=100&sortby=pubdate&citation_for_view=XoYxbGcAAAAJ:Se3iqnhoufwC
XoYxbGcAAAAJ,18,Singular limit solutions for a 2-dimensional semilinear elliptic system of Liouville type in some general case.,"S Baraket, S Sâanouni, N Trabelsi",Discrete & Continuous Dynamical Systems: Series A 40 (2),2020,https://scholar.google.com/scholar?oi=bibs&hl=en&cites=17288445976313787517,https://scholar.google.com/citations?view_op=view_citation&hl=en&user=XoYxbGcAAAAJ&pagesize=100&sortby=pubdate&citation_for_view=XoYxbGcAAAAJ:QIV2ME_5wuYC
XoYxbGcAAAAJ,19,Singular limit solutions for a 2-dimensional semilinear elliptic system of Liouville type in some general case adding singular sources (Part I),"S Baraket, I Bazarbacha, R Chetouane",Nonlinear Analysis 196 (111799),2020,https://scholar.google.com/scholar?oi=bibs&hl=en&cites=NA,""
XoYxbGcAAAAJ,20,Blow-up in coupled solutions for a four dimen-sional semilinear elliptic system of Liouville type,"S Baraket, A Messaoudi, S Sâanouni, N Trabelsi","Graduate journal of Mathematics 5 (3), pp 1-19",2020,https://scholar.google.com/scholar?oi=bibs&hl=en&cites=NA,""
XoYxbGcAAAAJ,21,Construction of singular limits for a strongly perturbed four-dimensional Navier problem with exponentially dominated nonlinearity and nonlinear terms,"S Baraket, S Chebbi, N Chorfi","Boundary Value Problems 2019, 1-25",2019,https://scholar.google.com/scholar?oi=bibs&hl=en&cites=11474020611233647663,https://scholar.google.com/citations?view_op=view_citation&hl=en&user=XoYxbGcAAAAJ&pagesize=100&sortby=pubdate&citation_for_view=XoYxbGcAAAAJ:Zph67rFs4hoC
XoYxbGcAAAAJ,22,The effect of a discontinuous weight for a critical Sobolev problem,"R Hadiji, S Baraket, H Yazidi","Applicable Analysis 97 (14), 2544-2553",2018,https://scholar.google.com/scholar?oi=bibs&hl=en&cites=6707774569759276857,https://scholar.google.com/citations?view_op=view_citation&hl=en&user=XoYxbGcAAAAJ&pagesize=100&sortby=pubdate&citation_for_view=XoYxbGcAAAAJ:WF5omc3nYNoC
XoYxbGcAAAAJ,23,Singular limiting solutions for 2-dimensional semilinear elliptic system of Liouville type adding singular sources terms given by Dirac masses,"S Baraket, I Bazarbacha","Complex Variables and Elliptic Equations 63 (1), 37-67",2018,https://scholar.google.com/scholar?oi=bibs&hl=en&cites=6638634598224930350,https://scholar.google.com/citations?view_op=view_citation&hl=en&user=XoYxbGcAAAAJ&pagesize=100&sortby=pubdate&citation_for_view=XoYxbGcAAAAJ:eQOLeE2rZwMC
XoYxbGcAAAAJ,24,Concentration on Curves for a Neumann Ambrosetti–Prodi-Type Problem in Two-Dimensional Domains,"S Baraket, Z Khemiri, F Mahmoudi, A Messaoudi","Annales Henri Poincaré 19, 3581-3633",2018,https://scholar.google.com/scholar?oi=bibs&hl=en&cites=NA,""
XoYxbGcAAAAJ,25,Multiplicity results for elliptic Kirchhoff-type problems,"S Baraket, G Molica Bisci","Advances in Nonlinear Analysis 6 (1), 85-93",2017,https://scholar.google.com/scholar?oi=bibs&hl=en&cites=8097941502459538602,https://scholar.google.com/citations?view_op=view_citation&hl=en&user=XoYxbGcAAAAJ&pagesize=100&sortby=pubdate&citation_for_view=XoYxbGcAAAAJ:hqOjcs7Dif8C
XoYxbGcAAAAJ,26,"Non-autonomous Eigenvalue Problems with Variable (p1,p2)-Growth","S Baraket, S Chebbi, N Chorfi, VD Rădulescu","Advanced Nonlinear Studies 17 (4), 781-792",2017,https://scholar.google.com/scholar?oi=bibs&hl=en&cites=15195384124067121490,https://scholar.google.com/citations?view_op=view_citation&hl=en&user=XoYxbGcAAAAJ&pagesize=100&sortby=pubdate&citation_for_view=XoYxbGcAAAAJ:qxL8FJ1GzNcC
XoYxbGcAAAAJ,27,Combined effects of concave-convex nonlinearities in a fourth-order problem with variable exponent,"S Baraket, VD Rădulescu","Advanced Nonlinear Studies 16 (3), 409-419",2016,https://scholar.google.com/scholar?oi=bibs&hl=en&cites=16225555644804784952,https://scholar.google.com/citations?view_op=view_citation&hl=en&user=XoYxbGcAAAAJ&pagesize=100&sortby=pubdate&citation_for_view=XoYxbGcAAAAJ:Wp0gIr-vW9MC
XoYxbGcAAAAJ,28,SINGULAR LIMITS FOR 2-DIMENSIONAL ELLIPTIC PROBLEMS INVOLVING EXPONENTIAL DOMINATED NONLINEARITY WITH SUBQUADRATIC CONVECTION TERM,"S BARAKET, M DAMMAK, S KHARRATI",Analele Stiintifice ale Universitatii Al I Cuza din Iasi - Matematica 62 (1 …,2016,https://scholar.google.com/scholar?oi=bibs&hl=en&cites=NA,""
XoYxbGcAAAAJ,29,Singular limiting solutions to 4-dimensional elliptic problems involving exponentially dominated nonlinearity and nonlinear terms,"S Baraket, I Bazarbacha, M Trabelsi","Electron. J. Differ. Equ 289, 2015",2015,https://scholar.google.com/scholar?oi=bibs&hl=en&cites=7978592212372058832,https://scholar.google.com/citations?view_op=view_citation&hl=en&user=XoYxbGcAAAAJ&pagesize=100&sortby=pubdate&citation_for_view=XoYxbGcAAAAJ:UebtZRa9Y70C
XoYxbGcAAAAJ,30,Singular limit solutions for 4-dimensional stationary Kuramoto-Sivashinsky equations with exponential nonlinearity,"S Baraket, M Khtaifi, T Ouni","Electronic Journal of Differential Equations 2015 (187), 1-26",2015,https://scholar.google.com/scholar?oi=bibs&hl=en&cites=5890989747623593828,https://scholar.google.com/citations?view_op=view_citation&hl=en&user=XoYxbGcAAAAJ&pagesize=100&sortby=pubdate&citation_for_view=XoYxbGcAAAAJ:W7OEmFMy1HYC
XoYxbGcAAAAJ,31,Singular limits solution for 2-dimensional elliptic problems involving exponential nonlinearities with sub-quadratic convection nonlinear gradient terms and singular weights,"S Baraket, T Ouni","Advances in Nonlinear Analysis 3 (S1), s69-s88",2014,https://scholar.google.com/scholar?oi=bibs&hl=en&cites=985763118320553395,https://scholar.google.com/citations?view_op=view_citation&hl=en&user=XoYxbGcAAAAJ&pagesize=100&sortby=pubdate&citation_for_view=XoYxbGcAAAAJ:2osOgNQ5qMEC
XoYxbGcAAAAJ,32,Singular limits for 2-dimensional elliptic problems involving exponential nonlinearities with sub-quadratic convection term,"S Baraket, T Ouni","Glasgow Mathematical Journal 55 (3), 537-557",2013,https://scholar.google.com/scholar?oi=bibs&hl=en&cites=15494589137919983978,https://scholar.google.com/citations?view_op=view_citation&hl=en&user=XoYxbGcAAAAJ&pagesize=100&sortby=pubdate&citation_for_view=XoYxbGcAAAAJ:aqlVkmm33-oC
XoYxbGcAAAAJ,33,Singular limits solution for two-dimensional elliptic problems involving exponential nonlinearities with nonlinear gradient terms and singular weights,"S Baraket, I Abid, T Ouni","Annali di Matematica Pura ed Applicata 191 (4), 845-869",2012,https://scholar.google.com/scholar?oi=bibs&hl=en&cites=14393447199218214153,https://scholar.google.com/citations?view_op=view_citation&hl=en&user=XoYxbGcAAAAJ&pagesize=100&sortby=pubdate&citation_for_view=XoYxbGcAAAAJ:M3ejUd6NZC8C
XoYxbGcAAAAJ,34,Singular limits for 2-dimensional elliptic problem with exponentially dominated nonlinearity and singular data,"S Baraket, I Ben Omrane, T Ouni, N Trabelsi","Communications in Contemporary Mathematics 13 (04), 697-725",2011,https://scholar.google.com/scholar?oi=bibs&hl=en&cites=9558881592862408113,https://scholar.google.com/citations?view_op=view_citation&hl=en&user=XoYxbGcAAAAJ&pagesize=100&sortby=pubdate&citation_for_view=XoYxbGcAAAAJ:MXK_kJrjxJIC
XoYxbGcAAAAJ,35,Singular limits for 2-dimensional elliptic problem involving exponential nonlinearity with nonlinear gradient term,"S Baraket, I Ben Omrane, T Ouni","Nonlinear Differential Equations and Applications NoDEA 18 (1), 59-78",2011,https://scholar.google.com/scholar?oi=bibs&hl=en&cites=7045543459277827262,https://scholar.google.com/citations?view_op=view_citation&hl=en&user=XoYxbGcAAAAJ&pagesize=100&sortby=pubdate&citation_for_view=XoYxbGcAAAAJ:LkGwnXOMwfcC
XoYxbGcAAAAJ,36,Singular limits solutions for 2-dimensional elliptic problem with exponentially dominated nonlinearity with nonlinear gradient term,"I Abid, S Baraket, T Ouni, N Trabelsi","Boundary Value Problems 10 (10.1186), 1687-2770",2011,https://scholar.google.com/scholar?oi=bibs&hl=en&cites=11316197128018408657,https://scholar.google.com/citations?view_op=view_citation&hl=en&user=XoYxbGcAAAAJ&pagesize=100&sortby=pubdate&citation_for_view=XoYxbGcAAAAJ:maZDTaKrznsC
XoYxbGcAAAAJ,37,Singular limiting solutions for elliptic problem involving exponentially dominated nonlinearity and convection term,"S Baraket, I Abid, T Ouni, N Trabelsi","Boundary Value Problems 2011, 1-17",2011,https://scholar.google.com/scholar?oi=bibs&hl=en&cites=17641711594891676222,https://scholar.google.com/citations?view_op=view_citation&hl=en&user=XoYxbGcAAAAJ&pagesize=100&sortby=pubdate&citation_for_view=XoYxbGcAAAAJ:dhFuZR0502QC
XoYxbGcAAAAJ,38,Integrability of det\7u and evolutionary Wente's problem associated to reaction-diffusion operator,"S Baraket, T Ouni","Arab J. Math. Sc. 15 (2), pp 1-11",2009,https://scholar.google.com/scholar?oi=bibs&hl=en&cites=NA,""
XoYxbGcAAAAJ,39,Construction of singular solutions for elliptic problem of fourth order derivative with a subcritical non-linearity,"I Abid, S Baraket","Differential and integral equations. 21 (7-8), 653-664",2008,https://scholar.google.com/scholar?oi=bibs&hl=en&cites=10601478633606225405,https://scholar.google.com/citations?view_op=view_citation&hl=en&user=XoYxbGcAAAAJ&pagesize=100&sortby=pubdate&citation_for_view=XoYxbGcAAAAJ:kNdYIx-mwKoC
XoYxbGcAAAAJ,40,Singular limits for a -dimensional semilinear elliptic problem with exponential nonlinearity,"S Baraket, M Dammak, T Ouni, F Pacard","Annales de l'IHP Analyse non linéaire 24 (6), 875-895",2007,https://scholar.google.com/scholar?oi=bibs&hl=en&cites=11349595755073393770,https://scholar.google.com/citations?view_op=view_citation&hl=en&user=XoYxbGcAAAAJ&pagesize=100&sortby=pubdate&citation_for_view=XoYxbGcAAAAJ:KlAtU1dfN6UC
XoYxbGcAAAAJ,41,Construction of singular limits for four-dimensional elliptic problems with exponentially dominated nonlinearity,"S Baraket, I Bazarbacha, N Trabelsi","Bulletin des sciences mathematiques 131 (7), 670-685",2007,https://scholar.google.com/scholar?oi=bibs&hl=en&cites=1230035813335066489,https://scholar.google.com/citations?view_op=view_citation&hl=en&user=XoYxbGcAAAAJ&pagesize=100&sortby=pubdate&citation_for_view=XoYxbGcAAAAJ:qjMakFHDy7sC
XoYxbGcAAAAJ,42,Integrability of det∇u and Evolutionary Wente’s Problem Associated to Heat Operator,"S Baraket, M Dammak, M Jleli, D Ye","Chinese Annals of Mathematics, Series B 28, 527-532",2007,https://scholar.google.com/scholar?oi=bibs&hl=en&cites=9185724121752235274,https://scholar.google.com/citations?view_op=view_citation&hl=en&user=XoYxbGcAAAAJ&pagesize=100&sortby=pubdate&citation_for_view=XoYxbGcAAAAJ:5nxA0vEk-isC
XoYxbGcAAAAJ,43,Best constant involving the L∞ norm of evolutionary Wente's problem associated to wave operator,"I Abid, S Baraket, I Bazarbacha, T Ouni","Journal of mathematical analysis and applications 325 (2), 866-878",2007,https://scholar.google.com/scholar?oi=bibs&hl=en&cites=12219964106697149696,https://scholar.google.com/citations?view_op=view_citation&hl=en&user=XoYxbGcAAAAJ&pagesize=100&sortby=pubdate&citation_for_view=XoYxbGcAAAAJ:YOwf2qJgpHMC
XoYxbGcAAAAJ,44,Estimation of the best constant involving the L2 norm of the higher-order Wente problem,"S Baraket, M Dammak","Abstract and Applied Analysis 2005 (6), 599-606",2005,https://scholar.google.com/scholar?oi=bibs&hl=en&cites=16204027195496204945,https://scholar.google.com/citations?view_op=view_citation&hl=en&user=XoYxbGcAAAAJ&pagesize=100&sortby=pubdate&citation_for_view=XoYxbGcAAAAJ:4DMP91E08xMC
XoYxbGcAAAAJ,45,The Wente inequality on weighted Sobolev spaces,"S Baraket, LB Chaabane","Houston Journal of Mathematics, University of Houston 29, 1065-1075",2003,https://scholar.google.com/scholar?oi=bibs&hl=en&cites=17690164287286551588,https://scholar.google.com/citations?view_op=view_citation&hl=en&user=XoYxbGcAAAAJ&pagesize=100&sortby=pubdate&citation_for_view=XoYxbGcAAAAJ:7PzlFSSx8tAC
XoYxbGcAAAAJ,46,The Wente problem for a singular elliptic equation,"S Baraket, I Bazarbacha","Journal of mathematical analysis and applications 284 (2), 711-723",2003,https://scholar.google.com/scholar?oi=bibs&hl=en&cites=4145601781849379990,https://scholar.google.com/citations?view_op=view_citation&hl=en&user=XoYxbGcAAAAJ&pagesize=100&sortby=pubdate&citation_for_view=XoYxbGcAAAAJ:zYLM7Y9cAGgC
XoYxbGcAAAAJ,47,Singular limit solutions for two-dimensional elliptic problems with exponentially dominated nonlinearity,"S Baraket, D Ye","Chinese Annals of Mathematics 22 (03), 287-296",2001,https://scholar.google.com/scholar?oi=bibs&hl=en&cites=10808959053641903340,https://scholar.google.com/citations?view_op=view_citation&hl=en&user=XoYxbGcAAAAJ&pagesize=100&sortby=pubdate&citation_for_view=XoYxbGcAAAAJ:IWHjjKOFINEC
XoYxbGcAAAAJ,48,The Wente problem in higher dimensions,S Baraket,"Communications in Partial Differential Equations 26 (9-10), 1497-1508",2001,https://scholar.google.com/scholar?oi=bibs&hl=en&cites=9775570466653638292,https://scholar.google.com/citations?view_op=view_citation&hl=en&user=XoYxbGcAAAAJ&pagesize=100&sortby=pubdate&citation_for_view=XoYxbGcAAAAJ:ZeXyd9-uunAC
XoYxbGcAAAAJ,49,Construction of singular limits for a strongly perturbed two-dimensional Dirichlet problem with exponential nonlinearity,S Baraket,"Bulletin des sciences mathematiques 123 (4), 255-284",1999,https://scholar.google.com/scholar?oi=bibs&hl=en&cites=8855509293748058196,https://scholar.google.com/citations?view_op=view_citation&hl=en&user=XoYxbGcAAAAJ&pagesize=100&sortby=pubdate&citation_for_view=XoYxbGcAAAAJ:0EnyYjriUFMC
XoYxbGcAAAAJ,50,Construction of singular limits for a semilinear elliptic equation in dimension 2,"S Baraket, F Pacard","Calculus of Variations and Partial Differential Equations 6 (1), 1-38",1998,https://scholar.google.com/scholar?oi=bibs&hl=en&cites=6908404848436316839,https://scholar.google.com/citations?view_op=view_citation&hl=en&user=XoYxbGcAAAAJ&pagesize=100&sortby=pubdate&citation_for_view=XoYxbGcAAAAJ:ufrVoPGSRksC
XoYxbGcAAAAJ,51,Estimations of the best constant involving the  norm in Wente’s inequality,S Baraket,"Annales de la Faculté des sciences de Toulouse: Mathématiques 5 (3), 373-385",1996,https://scholar.google.com/scholar?oi=bibs&hl=en&cites=84086566379940229,https://scholar.google.com/citations?view_op=view_citation&hl=en&user=XoYxbGcAAAAJ&pagesize=100&sortby=pubdate&citation_for_view=XoYxbGcAAAAJ:u-x6o8ySG0sC
XoYxbGcAAAAJ,52,Critical points of the Ginzburg–Landau system on a Riemannian surface,S Baraket,"Asymptotic Analysis 13 (3), 277-317",1996,https://scholar.google.com/scholar?oi=bibs&hl=en&cites=1776453670775102105,https://scholar.google.com/citations?view_op=view_citation&hl=en&user=XoYxbGcAAAAJ&pagesize=100&sortby=pubdate&citation_for_view=XoYxbGcAAAAJ:UeHWp8X0CEIC
XoYxbGcAAAAJ,53,Construction de limites singulières pour des problèmes elliptiques non linéaires en dimension deux,S Baraket,"Comptes rendus de l'Académie des sciences. Série 1, Mathématique 323 (6 …",1996,https://scholar.google.com/scholar?oi=bibs&hl=en&cites=5820527036571215499,https://scholar.google.com/citations?view_op=view_citation&hl=en&user=XoYxbGcAAAAJ&pagesize=100&sortby=pubdate&citation_for_view=XoYxbGcAAAAJ:Y0pCki6q_DkC
XoYxbGcAAAAJ,54,CRITICAL-POINTS OF THE GINZBURG-LANDAU SYSTEM ON A RIEMANNIAN SURFACE,S Baraket,"COMPTES RENDUS DE L ACADEMIE DES SCIENCES SERIE I-MATHEMATIQUE 319 (9), 949-952",1994,https://scholar.google.com/scholar?oi=bibs&hl=en&cites=NA,""
XoYxbGcAAAAJ,55,POINT CRITIQUES DU SYSTEME DE GINZBURG-LANDAU SUR UNE SURFACE RIEMANNIENNE,S Baraket,"Comptes rendus de l'Académie des sciences. Série 1, Mathématique 319 (9 …",1994,https://scholar.google.com/scholar?oi=bibs&hl=en&cites=NA,""
XoYxbGcAAAAJ,56,Minimizing harmonic mappings from a surface perfored with small holes into a Riemannian manifold,"S Baraket, D Ye","manuscripta mathematica 77 (1), 191-199",1992,https://scholar.google.com/scholar?oi=bibs&hl=en&cites=NA,""
